date,source,title,description
2026-06-04,TOP_NEWS,Zelensky in open letter to Putin proposes face-to-face meeting and 'full ceasefire' - France 24,"Zelensky in open letter to Putin proposes face-to-face meeting and 'full ceasefire'  France 24Zelensky proposes face-to-face talks in open letter to Putin  BBCZelensky asks Putin to meet face-to-face, with US ‘fully focused’ on Iran  The HillZelenskyy calls for face-to-face Ukraine war negotiations in letter to Putin  The GuardianUkraine war latest: Kremlin responds after Zelenskyy taunts Putin in 1,800-word letter and proposes meeting  Sky News"
2026-06-04,TOP_NEWS,Republicans' sweeping election overhaul fails in the Senate - NPR,Republicans' sweeping election overhaul fails in the Senate  NPRFour Senate Republicans again unite with Dems to block Trump's SAVE America Act  Fox NewsSenate rejects yet another GOP push to revive SAVE America Act  Democracy DocketUS Senate votes down Trump administration's SAVE America Act  Anadolu AjansıDefend democracy from the SAVE Act | Opinion  The Tennessean
2026-06-04,TOP_NEWS,"Here's how every California county voted for governor, per current tallies - SFGATE","Here's how every California county voted for governor, per current tallies  SFGATECalifornia Governor Primary Election 2026 Live Results  NBC NewsBecerra advances in California governor’s race  The HillWhat just happened in California?  vox.comCalifornia Democrats play it safe with Becerra, defying national trends  The Washington Post"
2026-06-04,TOP_NEWS,Trump’s attorney general pick has exactly one qualification - vox.com,"Trump’s attorney general pick has exactly one qualification  vox.comPresident Trump says he will nominate Todd Blanche to serve as attorney general  YahooBlanche faces uncertain path through Senate  PoliticoBlanche's nomination for AG could be an uphill battle  ABC News - Breaking News, Latest News and VideosThune: ‘Hard to say’ whether Blanche can win confirmation as attorney general  CNN"
2026-06-04,TOP_NEWS,"Another day passes with Auburn student still missing in Japan, parents say - NBC News","Another day passes with Auburn student still missing in Japan, parents say  NBC NewsAlabama family pleads for return of son missing on family trip in Japan  CNNAlabama community prays for missing Auburn student as search continues in Japan  WVTMAuburn student missing in Japan went off alone after family bickering on vacation, parents say  Fox NewsAuburn University student reported missing while on vacation with family in Japan  WBRC"
2026-06-04,TOP_NEWS,Live updates: Hezbollah and Israel trade new strikes as uncertainty surrounds US-Iran talks - CNN,"Live updates: Hezbollah and Israel trade new strikes as uncertainty surrounds US-Iran talks  CNNIran war updates: Israel continues attacks after new Lebanon ceasefire  Al JazeeraBetween Beaufort and Beirut, Israel faces narrowing options against Hezbollah  The Times of IsraelMiddle East live: Israeli strikes kill eight in Lebanon as Hezbollah rejects latest ceasefire  France 24Israel to continue ground operation in southern Lebanon despite agreed ceasefire – as it happened  The Guardian"
2026-06-04,TOP_NEWS,From reform hopes to brutal crackdown - China's Tiananmen protests - Reuters,"From reform hopes to brutal crackdown - China's Tiananmen protests  ReutersPolice warn families of Tiananmen crackdown dead not to visit graves on 37th anniversary  AP NewsChina, US clash over Tiananmen anniversary; Taiwan says face up to history  Reuters‘Every year I get new pictures’: the fight to preserve the memory of Tiananmen  The Guardian7 taken away as police ramp up patrols around former site of Tiananmen vigil  South China Morning Post"
2026-06-04,TOP_NEWS,How Much Do I Need to Buy the SpaceX IPO? Fidelity Just Lowered the Bar. - Barron's,"How Much Do I Need to Buy the SpaceX IPO? Fidelity Just Lowered the Bar.  Barron'sA single new sentence in SpaceX's amended IPO filing could signal the biggest merger in history  FortuneElon Musk’s SpaceX lines up retail investors for record IPO allocation  Financial TimesWho’s Excited for SpaceX’s I.P.O.? Space Nerds.  The New York TimesASTS, RKLB, RDW, SIDU Slip Overnight: Retail Hopes For SpaceX-Fueled S&P 500 Buying Frenzy Take A Hit  Yahoo Finance"
2026-06-04,TOP_NEWS,Lululemon Cuts Outlook as Headwinds Mount - WSJ,"Lululemon Cuts Outlook as Headwinds Mount  WSJLululemon cuts annual outlook, citing 'negative' media commentary and disappointing product launches  CNBCLululemon stock tanks after company trims full-year financial outlook, citing 'headwinds'  Yahoo FinanceLululemon Trims Outlook, Adding Pressure Ahead of New CEO  Bloomberg.comLululemon cuts forecasts amid persistent sales slump in key US market, shares drop By Reuters  Investing.com"
2026-06-04,TOP_NEWS,S&P will not change the rules to allow SpaceX into its benchmark index early - Axios,"S&P will not change the rules to allow SpaceX into its benchmark index early  AxiosSpaceX, Other Mega IPOs Denied Fast Index Entry by S&P  Bloomberg.comSpaceX blocked from early US benchmark index entry as S&P reaffirms existing rules  ReutersS&P 500 Won’t Change Rules for SpaceX  WSJIn ‘wild’ twist, SpaceX won’t be allowed early entry to the S&P 500 after all  MarketWatch"
2026-06-04,TOP_NEWS,Blackstone private credit fund caps withdrawals as redemption requests jump - Reuters,Blackstone private credit fund caps withdrawals as redemption requests jump  ReutersBlackstone restricts flagship fund withdrawals as private asset fears reemerge  CNBCPrivate Credit’s Resurgent Redemptions Shatter Short-Lived Calm  Bloomberg.comUS asset managers fall as investors brace for updates on private credit fund withdrawals  ReutersAnother redemption wave is spooking the $2 trillion private-credit market  MarketWatch
2026-06-04,TOP_NEWS,Filtr is a new privacy tool that blocks ads in almost every iPhone and Mac app - TechCrunch,Filtr is a new privacy tool that blocks ads in almost every iPhone and Mac app  TechCrunchSee more headlines & perspectives on Google News
2026-06-04,TOP_NEWS,Wired Found Code For An Unreleased Facial Recognition Feature In Meta's AI App - Engadget,"Wired Found Code For An Unreleased Facial Recognition Feature In Meta's AI App  EngadgetMeta Silently Added Face-Recognition Code for Its Smart Glasses to Millions of Phones  WIREDMove Fast, Surveil Things  Electronic Frontier FoundationMeta Smart Glasses Face Recognition Code: Lawsuit and Leaked Memo Explained  virtual.reality.newsMeta accused of preparing facial recognition features for AI smart glasses  Digital Trends"
2026-06-04,TOP_NEWS,Meta rolls out a new AI creator assistant on Facebook - TechCrunch,"Meta rolls out a new AI creator assistant on Facebook  TechCrunchIntroducing Creator Assistant, Plus More Languages For AI Translations on Facebook  meta.comMeta's Latest AI Tool Gives Creators A 'Brainstorming Partner'  EngadgetMeta launches creator assistant chatbot  Social Media TodayFacebook’s new AI Creator Assistant wants to be your personal content strategist  Digital Trends"
2026-06-04,TOP_NEWS,The price of Nvidia RTX Spark PCs is going to hurt - PCWorld,The price of Nvidia RTX Spark PCs is going to hurt  PCWorldNVIDIA and Microsoft Reinvent Windows PCs for the Age of Personal AI  NVIDIA NewsroomNVIDIA's Jensen Huang Wants To Reinvent PC That Has Not Changed In 40 Years  Yahoo FinanceNvidia wants to supercharge your laptop  The EconomistNvidia’s RTX Spark laptops are gunning for the MacBook Pro. Yawn  Macworld
2026-06-04,TOP_NEWS,Jimmy Kimmel slams 'Trump suck-ups' at CBS for 'cowardly' Scott Pelley firing from 60 Minutes - Entertainment Weekly,"Jimmy Kimmel slams 'Trump suck-ups' at CBS for 'cowardly' Scott Pelley firing from 60 Minutes  Entertainment WeeklyNick Bilton, New ‘60 Minutes’ Chief, Pledges Independence  The New York TimesInside the CBS mutiny against Bari Weiss and David Ellison  Financial TimesThree ‘60 Minutes’ correspondents were fired, and the result has been chaos  The Washington PostCBS News races to steady ‘60 Minutes’ after Scott Pelley’s firing  CNN"
2026-06-04,TOP_NEWS,Lena the Plug’s porn partner Jason Luv takes dig at Adam22 after couple’s divorce announcement - Yahoo,"Lena the Plug’s porn partner Jason Luv takes dig at Adam22 after couple’s divorce announcement  YahooAdult Film Star Lena the Plug Files for Divorce from Adam22, Seeks Custody of 5-Year-Old Daughter  YahooLena the Plug Denies Divorcing Adam22, Claims Court Filing Was Forged by Alleged Stalker  ComplexOnlyFans’ Lena the Plug Says Adam22 Divorce Was Hoax Filed by Impersonator  E! News"
2026-06-04,TOP_NEWS,NBA Finals’ 6 biggest overreactions after Knicks steal Game 1 - SB Nation,"NBA Finals’ 6 biggest overreactions after Knicks steal Game 1  SB NationThe Smallest Player on the Court Just Delivered the Knicks’ Biggest Win of the Century  WSJJalen Brunson, Victor Wembanyama weren’t flawless, but set stage for epic NBA Finals  The New York TimesThe Knicks’ Jalen Brunson can already do what the Spurs are still figuring out  NBC NewsNBA Finals features new stars on the biggest stage  WJLA"
2026-06-04,TOP_NEWS,Potential northern lights and planetary sights in DC region Thursday - WTOP,"Potential northern lights and planetary sights in DC region Thursday  WTOP‘Severe’ Northern Lights Alert For 23 States On Thursday And Friday  ForbesUPDATE on G3 Watch for 4-5 June UTC Days  SpaceWeather.govAuroras could be visible in more states with forecast 'strong' geomagnetic storm  ABC News - Breaking News, Latest News and VideosUPDATE: Aurora forecast for Vt., NY, and NH, Thursday night due to ‘G3′ geomagnetic storm  WCAX"
2026-06-04,TOP_NEWS,"Sun erupts with 3 huge solar flares, increasing chances of northern lights across U.S. - CBS News","Sun erupts with 3 huge solar flares, increasing chances of northern lights across U.S.  CBS NewsStrong Flare Erupts from Sun  NASA Science (.gov)R1 Conditions Return with Low-level M-class Flares  NOAA Space Weather Prediction Center (.gov)Sun erupts with 3 colossal solar flares in less than 24 hours, boosting chances for northern lights  SpaceX1.0 solar flare erupts from geoeffective Region 4455  The Watchers - Watching the world evolve and transform"
