date,source,title,description
2025-05-28,TOP_NEWS,Trump Downplays Prospect of New Sanctions on Russia - WSJ,Trump Downplays Prospect of New Sanctions on Russia  WSJRussia says Trump 'does not fully understand' after criticism of Putin  ABC NewsFormer Russian president raises specter of a World War III as rhetoric ramps up over Ukraine  NBC NewsTrump’s frustration with Putin boils over with no Ukraine peace deal in sight  The Washington PostRepublicans Urge Trump to Put New Sanctions on Russia Amid Ukraine Strikes  The New York Times
2025-05-28,TOP_NEWS,"Harvard agrees to relinquish early photos of enslaved people, ending a long legal battle - AP News","Harvard agrees to relinquish early photos of enslaved people, ending a long legal battle  AP NewsHarvard settles lawsuit over enslaved ancestor images  YahooHarvard Relents After Protracted Fight Over Slave Photos  The New York TimesHarvard University agrees to transfer ownership of slavery photographs  Al JazeeraHarvard relinquishes possession of slave photos after a years-long dispute  The Washington Post"
2025-05-28,TOP_NEWS,Sean 'Diddy' Combs allegedly threatened to leak sex tapes of his ex - Reuters,"Sean 'Diddy' Combs allegedly threatened to leak sex tapes of his ex  ReutersSean 'Diddy' Combs trial recap: LAPD, LAFD members testify after Kid Cudi, Cassie and ex-assistants  NBC NewsAt Diddy Trial, Cassie’s Stylist Testifies About Decade of Bloody Abuse and Alleged Blackmail  The Hollywood ReporterDiddy's Assistant Cries on Stand Recalling When Mogul Allegedly Brutalized Cassie — and No One Stopped Him  People.comSean Combs' inner circle reveals a world of guns, abuse, kidnapping and death threats  Yahoo"
2025-05-28,TOP_NEWS,Checks on Migrant Children by Homeland Security Agents Stir Fear - The New York Times,"Checks on Migrant Children by Homeland Security Agents Stir Fear  The New York TimesImmigrant advocates worry about ICE 'wellness checks'  The Baltimore BannerLA Times Today: Are ICE agent checks on migrant children to protect them or deport them?  Los Angeles TimesImmigration agents conducting welfare checks on migrant children  Spectrum NewsFederal cops spent weeks tracking young immigrants, was it for their safety, or to make deportation easier?  Colorado Public Radio"
2025-05-28,TOP_NEWS,Netanyahu says Hamas Gaza chief Mohammad Sinwar has been killed - Reuters,Netanyahu says Hamas Gaza chief Mohammad Sinwar has been killed  ReutersExclusive | Israeli Airstrike That Killed Top Hamas Leader in Gaza Hit Meeting of Top Militants  WSJIsrael PM says Hamas's Gaza chief Mohammed Sinwar has been killed  BBCNetanyahu says Israel has killed Hamas' Gaza chief Mohammed Sinwar  Fox NewsNetanyahu gives final confirmation Hamas's Mohammed Sinwar is dead  The Jerusalem Post
2025-05-28,TOP_NEWS,"Andrew and Tristan Tate Charged With Rape, Human Trafficking in the U.K. - Rolling Stone","Andrew and Tristan Tate Charged With Rape, Human Trafficking in the U.K.  Rolling StoneTate brothers face rape and trafficking charges in U.K.  NPRCourt records: Healthcare center resident accused in rape investigation  YahooAndrew and Tristan Tate to face 21 charges in UK, prosecutors say  BBCInfluencers Andrew and Tristan Tate face rape and human trafficking charges in UK  The Guardian"
2025-05-28,TOP_NEWS,Nvidia expects to lose billions in revenue due to H20 chip licensing requirements - TechCrunch,"Nvidia expects to lose billions in revenue due to H20 chip licensing requirements  TechCrunchNvidia CEO Jensen Huang hammers chip controls that 'effectively closed' China market  CNBCNvidia CEO Warns That Chinese AI Rivals Have Become ‘Formidable’  Bloomberg.comNvidia CEO Jensen Huang touts US manufacturing plans, warns China export controls threaten US chip lead  Yahoo FinanceNvidia’s Business Is Booming Despite Being Shut Out of China  WSJ"
2025-05-28,TOP_NEWS,"Fed saw inflation, jobless, stability risks at May meeting, minutes show - Reuters","Fed saw inflation, jobless, stability risks at May meeting, minutes show  ReutersThe Fed Forecasts Stagflation  WSJFed worried it could face 'difficult tradeoffs' if tariffs reaggravate inflation, minutes show  CNBCFed ‘Well Positioned’ to Wait on Rate Cuts Even as Economic Risks Rise, Minutes Show  The New York TimesFed May Meeting Minutes Are Out. What to Know.  Barron's"
2025-05-28,TOP_NEWS,"Victoria’s Secret responds after website, app shutdown leaving customers in the dark - nbc4i.com","Victoria’s Secret responds after website, app shutdown leaving customers in the dark  nbc4i.comVictoria’s Secret Security Incident Disrupts Website, Email  Bloomberg.comVictoria’s Secret hit by outages as it battles security incident  TechCrunchVictoria's Secret pulls down website amid security incident  Yahoo Finance"
2025-05-28,TOP_NEWS,Google says Instagram fixed a battery drain issue on Android - The Verge,"Google says Instagram fixed a battery drain issue on Android  The VergeGoogle says Pixel battery woes on May update were due to Instagram bug [U]  9to5GoogleGoogle issues warning – update Instagram on Android to stop battery drain  The Shortcut | Matt SwiderGoogle says Instagram has been tanking your battery, but a fix is out  Android PoliceUpdate Instagram if you’re having battery drain issues on Android  Boy Genius Report"
2025-05-28,TOP_NEWS,The Cyberpunk 2077 sequel finally makes it to preproduction - Engadget,"The Cyberpunk 2077 sequel finally makes it to preproduction  EngadgetCyberpunk 2077 Sequel Cyberpunk 2 Enters Pre-Production — and Yes, CD Projekt Is Officially Calling It Cyberpunk 2 Now  IGNCyberpunk 2 has entered pre-production, as The Witcher 3 leaps above Super Mario Bros to sell 60 million copies  GamesRadar+Cyberpunk 2 Moves Into Pre-Production As CD Projekt Red Confirms Almost 100 Developers Are Already Working On It  KotakuCD Projekt Red is moving forward with Cyberpunk 2  The Verge"
2025-05-28,TOP_NEWS,"Thousands of Asus routers are being hit with stealthy, persistent backdoors - Ars Technica","Thousands of Asus routers are being hit with stealthy, persistent backdoors  Ars TechnicaBotnet hacks 9,000+ ASUS routers to add persistent SSH backdoor  BleepingComputerCisco security flaw exploited to build botnet of thousands of devices  YahooViciousTrap Uses Cisco Flaw to Build Global Honeypot from 5,300 Compromised Devices  The Hacker NewsASUS router backdoors affect 9K devices, persist after firmware updates  SC Media"
2025-05-28,TOP_NEWS,Google took 25 years to be ready for this AI moment. Apple is just starting. - Business Insider,"Google took 25 years to be ready for this AI moment. Apple is just starting.  Business InsiderGoogle has a massive mobile opportunity, and it's partly thanks to Apple  Business InsiderGoogle’s ‘world-model’ bet: building the AI operating layer before Microsoft captures the UI  VentureBeatGoogle Gemini May Be Outpacing Apple but I Use These 6 Apple Intelligence Features Daily  CNETWhat the Tech? New Google AI features  WFMZ.com"
2025-05-28,TOP_NEWS,Smokey Robinson Accuses Housekeepers of Defamation in Countersuit - The New York Times,"Smokey Robinson Accuses Housekeepers of Defamation in Countersuit  The New York TimesSmokey Robinson strikes back against 'fabricated' sexual assault lawsuit in court  USA TodaySmokey Robinson sues accusers and their lawyers, claiming defamation  NBC NewsSmokey Robinson Sues Rape Accusers for Defamation, Elder Abuse  Rolling StoneSmokey Robinson Files $500 Million Counter-Suit Against Accusers  Variety"
2025-05-28,TOP_NEWS,Brad Pitt Addresses Angelina Jolie Divorce For the First Time - instyle.com,Brad Pitt Addresses Angelina Jolie Divorce For the First Time  instyle.comBrad Pitt Breaks Silence on Finalizing Divorce from Angelina Jolie After Intense 8-Year Legal Battle  People.comBrad Pitt downplays Angelina Jolie divorce settlement as not 'that major'  USA TodayIllegal migrant suspects arrested in fatal jet ski hit-and-run of teen Texas Air Force recruit  YahooBrad Pitt Says ‘My Personal Life Is Always in the News’ and It’s an ‘Annoyance’ to Deal With While Filming: ‘It’s Always Been’ a ‘Nagging Time Suck’  Variety
2025-05-28,TOP_NEWS,‘Karate Kid: Legends’ Headed for $25 Million Debut as ‘Lilo & Stitch’ Continues Box Office Dominance - Variety,‘Karate Kid: Legends’ Headed for $25 Million Debut as ‘Lilo & Stitch’ Continues Box Office Dominance  Variety'Karate Kid: Legends' review: Mr. Miyagi's absence is felt  AP NewsKarate Kid: Legends review – charming throwback sequel  The GuardianKarate Kid: Legends First Reviews: A Fast-Paced Feel-good Movie with a Breakout Star  editorial.rottentomatoes.comRalph Macchio on Decision to Return to ‘Karate Kid’ Films and Future of the Franchise 40 Years In  The Hollywood Reporter
2025-05-28,TOP_NEWS,Caleb Williams addresses predraft ‘ideas’ about evading Chicago Bears — and declares: ‘I wanted to come here’ - Chicago Tribune,"Caleb Williams addresses predraft ‘ideas’ about evading Chicago Bears — and declares: ‘I wanted to come here’  Chicago TribuneWilliams makes it clear he wanted to be a Bear  ESPNBears QB Caleb Williams stresses desire to be in Chicago following book details  NFL.comCaleb Williams: I wanted to come here, I love being here  NBC SportsCaleb Williams addresses NFL Draft controversy: 'I wanted to be here' with Bears  Fox News"
2025-05-28,TOP_NEWS,Projected Lineup: ECF Game 5 vs. FLA - NHL.com,"Projected Lineup: ECF Game 5 vs. FLA  NHL.comPanthers-Hurricanes Game 5 preview: Can Carolina force another game?  ESPNThe Florida Panthers are Eastern Conference champions, buy the official championship gear  MLive.comReigning Stanley Cup champion Panthers beat Hurricanes 5-3 in Eastern final  CBS NewsShorthanded Panthers make no excuses after Game 4 loss against Carolina denies a clinching chance  Yahoo Sports"
2025-05-28,TOP_NEWS,"Terry Bradshaw, Cam Heyward comments about Aaron Rodgers resonate with plenty of Steelers fans - NBC Sports","Terry Bradshaw, Cam Heyward comments about Aaron Rodgers resonate with plenty of Steelers fans  NBC SportsBradshaw: Steelers' interest in Rodgers 'a joke'  ESPNSteelers legend Terry Bradshaw calls Pittsburgh's interest in QB Aaron Rodgers 'a joke'  NFL.comCan Aaron Rodgers succeed if he waits until late summer to sign with Steelers? Brett Favre did it  Yahoo SportsTerry Bradshaw slams Steelers, Aaron Rodgers for quarterback situation  USA Today"
2025-05-28,TOP_NEWS,Cosmic mystery deepens as astronomers find object flashing in both radio waves and X-rays - Phys.org,"Cosmic mystery deepens as astronomers find object flashing in both radio waves and X-rays  Phys.orgAstronomers discover strange new celestial object in our Milky Way galaxy  AP NewsMysterious object spotted in our galaxy is emitting X-rays and radio waves, astronomers say  CBS NewsDetection of X-ray emission from a bright long-period radio transient  NatureAstronomers discover mystery cosmic body bursting with X-rays: 'This object is unlike anything we have seen before'  Space"
