date,source,title,description
2026-05-20,TOP_NEWS,Trump’s Government Moves to Spare an Unhappy Taxpayer Named Trump - The New York Times,Trump’s Government Moves to Spare an Unhappy Taxpayer Named Trump  The New York TimesBlanche insists violent conduct will be weighed when applying for new anti-weaponization fund payouts  CNNTranscript: Trump’s new $1.8bn fund under fire  Financial TimesOpinion | Trump Just Pardoned Himself and His Family Forever  The New York TimesWhat to Know About the Trump Administration Ending Tax Audits of Trump  WSJ
2026-05-20,TOP_NEWS,"Republicans squirm as Trump pursues legacy, control and revenge - Politico","Republicans squirm as Trump pursues legacy, control and revenge  Politico4 takeaways from Tuesday’s primary night in half a dozen states  NPRAs Trump's approval ratings drop, how does he keep ousting GOP rivals?  USA TodayTrump Gets His Payback in Primary Elections, but It Comes at a Cost in Congress  The New York TimesAnalysis | The Trump paradox: What’s good for him is weighing down his party  The Washington Post"
2026-05-20,TOP_NEWS,US police officers sue Trump over $1.8bn ‘anti-weaponisation’ fund - Al Jazeera,"US police officers sue Trump over $1.8bn ‘anti-weaponisation’ fund  Al JazeeraPolice officers at Capitol on Jan. 6 sue to block DOJ payout fund  The Washington PostHouse Republican: ‘We’re gonna kill’ Trump’s nearly $1.8B ‘anti-weaponization’ fund  The Hill'I'm not greedy': January 6 rioters and Trump allies eye $1.8 billion 'weaponization' fund  ReutersCongress is best chance to stop Trump 'lawfare' fund, attorneys say  CNBC"
2026-05-20,TOP_NEWS,"Four swing House races in Pennsylvania loom large for both parties — and for 2028, too - NBC News","Four swing House races in Pennsylvania loom large for both parties — and for 2028, too  NBC NewsPennsylvania primaries spotlight key races for Democrats to retake House  The Guardian4 Lehigh Valley Democrats look to unseat U.S. Rep. Mackenzie  WHYYPA primary election results: Who won US House races?  Spotlight PABob Brooks, Labor Leader Backed by Top Democrats, Wins Pennsylvania House Primary  The New York Times"
2026-05-20,TOP_NEWS,Bipartisan home affordability bill passes the House - NPR,"Bipartisan home affordability bill passes the House  NPRHouse approves breakthrough housing bill in a win for investors  CNBCTrump-backed housing bill clears House after GOP defies Senate pressure campaign  Fox NewsHouse passes housing affordability bill that softens institutional investor ban  CNNHouse Passes Housing Bill, Uniting on a Measure to Bring Down Costs  The New York Times"
2026-05-20,TOP_NEWS,Trump could sign AI executive order as soon as Thursday - CNN,Trump could sign AI executive order as soon as Thursday  CNNAI & Tech Brief: Exclusive | White House AI order expected  The Washington PostTrump Set to Sign AI Cybersecurity Directive as Soon as Thursday  Bloomberg.comScoop: Trump AI executive order seeks early government access to advanced models  AxiosTrump moves to police frontier AI models  Politico
2026-05-20,TOP_NEWS,U.S. intel community analyzing how Cuba might respond to military action - CBS News,U.S. intel community analyzing how Cuba might respond to military action  CBS NewsSee more headlines & perspectives on Google News
2026-05-20,TOP_NEWS,"Interactive 3D map shows Sandy Fire perimeter, evacuation zones - KTLA","Interactive 3D map shows Sandy Fire perimeter, evacuation zones  KTLASandy Fire is 3rd largest wildfire currently burning in CA  ABC7 Los AngelesSandy Fire: Incident Update on 05/20/2026 at 5:12 PM  CAL FIRE (.gov)Several fires are burning around Southern California. Here's a roundup  LAistMap: Where wildfires are burning in Southern California  NBC Los Angeles"
2026-05-20,TOP_NEWS,Rutte shrugs off shrinking US military presence in Europe as ‘expected’ - politico.eu,"Rutte shrugs off shrinking US military presence in Europe as ‘expected’  politico.euExclusive: US plans to shrink forces available to NATO during crises, sources say  ReutersMore US troop withdrawals from Europe expected, NATO commander says  Military TimesNATO: Rutte says US troop withdrawal won't hurt Europe  dw.comTop NATO Official Says 5,000 US Troops to Leave Europe  Bloomberg.com"
2026-05-20,TOP_NEWS,"Xi and Putin to dine over Peking duck, Chinese opera and Swan Lake - Reuters","Xi and Putin to dine over Peking duck, Chinese opera and Swan Lake  ReutersChina’s Xi gives Putin a red-carpet welcome – and makes a veiled jab at the US  CNNLive Q&A: What Putin's China Visit Means for Beijing’s Ties With Russia and the US  Bloomberg.comTrump Scrambles to Console Himself Over Putin-Xi Slight  The Daily BeastPutin and Xi hail their friendship and growing energy trade at their meeting in Beijing  AP News"
2026-05-20,TOP_NEWS,Bitcoin miners tied to AI rise as Nvidia posts big earnings beat and strong outlook - CoinDesk,"Bitcoin miners tied to AI rise as Nvidia posts big earnings beat and strong outlook  CoinDeskNvidia earnings takeaways: Data center revenue nearly doubles, report is strong but stock slides  CNBCNvidia posts record profit and revenue amid AI chip boom  Al JazeeraNvidia tops Q1 estimates, offers upbeat outlook on strong chip sales  Yahoo FinanceThe stock reaction to Nvidia earnings has been a 'knife fight,' analyst says  MarketWatch"
2026-05-20,TOP_NEWS,"Meta cuts 8,000 jobs in sweeping global layoffs - Al Jazeera","Meta cuts 8,000 jobs in sweeping global layoffs  Al JazeeraMeta Lays Off 8,000 Employees, as A.I. Casualties Mount  The New York TimesRead the email Meta is sending to thousands of laid-off employees  Business InsiderZuckerberg's Meta layoffs memo: 'Success isn't a given' in the AI era  CNBCA Meta employee gets real about the horror of working there right now  The San Francisco Standard"
2026-05-20,TOP_NEWS,Google I/O 2026 had nothing to say and said it badly ahead of Apple's WWDC - AppleInsider,"Google I/O 2026 had nothing to say and said it badly ahead of Apple's WWDC  AppleInsiderPowered by A.I., Google Changes Its Search Box for the First Time in 25 Years  The New York TimesThe Gemini app becomes more agentic, delivering proactive, 24/7 help  blog.googleGoogle is making its biggest change to the search bar in years  CNNGoogle reinvents search before AI rivals replace it  Axios"
2026-05-20,TOP_NEWS,Xreal's Project Aura Smartglasses Are A Maximalist Take On Android XR - Engadget,"Xreal's Project Aura Smartglasses Are A Maximalist Take On Android XR  EngadgetIntelligent eyewear is coming this fall  blog.googleI Tried Google's Screen-Free Smart Glasses, and They're Exactly What I Want  PCMagSamsung and Google Give First Look at New Intelligent Eyewear  samsung.comWarby Parker Stock Slumps 11% as Questions Cloud Its Google Gemini AI Eyewear Reveal  Barron's"
2026-05-20,TOP_NEWS,"The Hypershell Exoskeleton Is Slimmer, Faster, and Still Not Built for Your Bad Knees - Gizmodo","The Hypershell Exoskeleton Is Slimmer, Faster, and Still Not Built for Your Bad Knees  GizmodoI Tried the Newest Exoskeleton for Hikers. It Could Help Millions Enjoy the Trail.  Outside MagazineI Hiked Using Robot Legs in the Grand Canyon. I Didn’t Even Need My Cane  CNETE-Hiking Is Here. You Can Tell by My 1,000-Watt Hips.  WSJI hiked the Grand Canyon in an exoskeleton  Popular Science"
2026-05-20,TOP_NEWS,Weekend Preview: MANDALORIAN AND GROGU Set to Lead Memorial Day Weekend - Boxoffice Pro,"Weekend Preview: MANDALORIAN AND GROGU Set to Lead Memorial Day Weekend  Boxoffice ProNot Even Baby Yoda Can Save “Star Wars""  The AtlanticHow Pedro Pascal became the best 'Star Wars' dad in 'The Mandalorian'  USA TodayThe Mandalorian And Grogu First Reviews: A Fun But Familiar Return To The Galaxy Far, Far Away  Rotten Tomatoes'Star Wars: The Mandalorian and Grogu' Targets $80M-Plus Box Office  The Hollywood Reporter"
2026-05-20,TOP_NEWS,"‘The Boys’ series finale explained, from the hidden Easter eggs and callbacks to the Queen Maeve cameo that didn’t happen - Gold Derby","‘The Boys’ series finale explained, from the hidden Easter eggs and callbacks to the Queen Maeve cameo that didn’t happen  Gold Derby‘The Boys’ Creator Breaks Down Series Finale’s Boldest Choices: “I Own That Decision”  The Hollywood ReporterInside the Series Finale of ‘The Boys’: ‘Every Strongman Eventually Goes Too Far’  Rolling Stone‘The Boys’ Finale: Creator Explains Those Major Deaths, How Canceled ‘Gen V’ Season 3 Would’ve Continued the Story and ‘Embryonic’ Spinoff Ideas  Variety‘The Boys’ Bows Out on an Uncharacteristic Note  The Ringer"
2026-05-20,TOP_NEWS,Mackenzie Shirilla Heard in Jail Call Saying She's 'Not Gonna Be Able to Have Kids' After Prison Release (Exclusive) - Yahoo News Canada,Mackenzie Shirilla Heard in Jail Call Saying She's 'Not Gonna Be Able to Have Kids' After Prison Release (Exclusive)  Yahoo News CanadaSee more headlines & perspectives on Google News
2026-05-20,TOP_NEWS,What Cavs coach Kenny Atkinson said upon review of Game 1 of Eastern Conference finals - Cleveland.com,What Cavs coach Kenny Atkinson said upon review of Game 1 of Eastern Conference finals  Cleveland.comNBA roundup: Cavs no stranger to playoff comebacks; Thunder-Spurs tied 1-1  The Detroit NewsStephen A. Smith doubles down on demand to arrest Knicks’ Jalen Brunson for James Harden assault  Yahoo SportsCleveland sports radio host has rough morning trying to process Cavaliers' Game 1 choke job  Fox NewsThe Bounce: Making sense of that Knicks comeback against the Cavs  The New York Times
2026-05-20,TOP_NEWS,Aaron Rodgers says he will retire after the 2026 NFL season: ‘This is it’ - NBC News,Aaron Rodgers says he will retire after the 2026 NFL season: ‘This is it’  NBC NewsSteelers' Aaron Rodgers says he plans to retire after season  ESPN$396 million legend won't be able to hurt Cowboys feelings anymore  Yahoo SportsAaron Rodgers confirms he's retiring after upcoming season with the Pittsburgh Steelers  Fox NewsAaron Rodgers says he will retire from football after 2026 NFL season: 'This is it'  NFL.com
