date,source,title,description
2026-04-08,TOP_NEWS,President Trump’s ceasefire with Iran draws praise from world leaders - Fox News,"President Trump’s ceasefire with Iran draws praise from world leaders  Fox NewsIran reveals 10-point plan for peace with the US – here's what's in it  Fox News36 Hours of Chaos: The Scramble for a Cease-Fire in Iran  The New York TimesWATCH: White House addresses Strait of Hormuz opening, Trump's 'civilization' threat  PBS5 things to know for April 8: US-Iran ceasefire, Iran-linked hackers, ICE shooting, Hawaii flood threat, Missing American  CNN"
2026-04-08,TOP_NEWS,At least 182 killed across Lebanon in large wave of Israeli strikes - BBC,"At least 182 killed across Lebanon in large wave of Israeli strikes  BBCIran war live: Lebanon mourns as Israel raids shake Trump, Tehran ceasefire  Al JazeeraIsraeli strikes pummel Lebanon, killing 250 in deadliest day of war  ReutersIsrael kills scores in Beirut as U.S. says Lebanon is not part of Iran truce  The Washington PostIsrael launches sprawling attacks on Lebanon after Iran ceasefire was declared  NBC News"
2026-04-08,TOP_NEWS,Bondi Won’t Appear on Capitol Hill for Scheduled Epstein Deposition - The New York Times,"Bondi Won’t Appear on Capitol Hill for Scheduled Epstein Deposition  The New York TimesJustice Department says Bondi won’t appear for Epstein deposition now that she’s no longer attorney general  CNNPam Bondi defies House subpoena over Epstein files  AxiosEpstein files: Pam Bondi testimony to House panel canceled, Democrats threaten contempt charges  CNBCBondi Brutally Humiliated by Deputy on Her Way Out the Door  The Daily Beast"
2026-04-08,TOP_NEWS,Iran’s proposal to collect tolls in the Strait of Hormuz violates trade norms - AP News,"Iran’s proposal to collect tolls in the Strait of Hormuz violates trade norms  AP NewsIs Strait of Hormuz Open Again? Maybe, but Few Ships Are Using It.  The New York TimesA Prospectus for the ‘Tehran Toll Booth’ IPO  WSJOil industry pleads its Hormuz case with White House  PoliticoIran demands crypto fees for ships passing Hormuz during ceasefire  Financial Times"
2026-04-08,TOP_NEWS,Vance to lead U.S. delegation at peace talks with Iran in Pakistan on Saturday - Axios,"Vance to lead U.S. delegation at peace talks with Iran in Pakistan on Saturday  AxiosVance to Lead Iran Talks as Tehran Says Ceasefire Violated  Bloomberg.comTrump sending Vance, Witkoff and Kushner to Pakistan for ceasefire talks with Iran  PoliticoMiddle East war day 40 as it happened: Ceasefire under pressure as strikes persist; JD Vance to lead US delegation in Islamabad talks  Financial TimesJD Vance to lead US team in talks with Iran in Pakistan  BBC"
2026-04-08,TOP_NEWS,‘We lose the midterms’: Republicans worry Iran might have already cost them Congress - Politico,"‘We lose the midterms’: Republicans worry Iran might have already cost them Congress  PoliticoDonald Trump’s US ratings fall to a record low amid Iran war  The ConversationIran war rejected: Trump’s credibility gap widens  The Hill""Not Our Responsibility"": How Young MAGA Voters Are Reacting to Trump’s War in Iran  Time MagazineHow Democrats and Republicans Are Clashing in Week 6 of the Iran War  The New York Times"
2026-04-08,TOP_NEWS,Has Trump Met His War Goals in Iran? - The New York Times,"Has Trump Met His War Goals in Iran?  The New York TimesTrump Allies, U.S. Officials Fear Iran Victory Lap Is Premature  WSJ‘Seems like losing’: What the US hasn’t won in Iran  PoliticoDiscussing the Iran Ceasefire: Rubin on C-SPAN  American Enterprise Institute - AEIUS says Iran war met all objectives ‘exactly as planned’  The Independent"
2026-04-08,TOP_NEWS,Gulf States Fear an Emboldened Iran after Trump’s Cease-Fire - WSJ,"Gulf States Fear an Emboldened Iran after Trump’s Cease-Fire  WSJIran is holding the world economy hostage. Trump’s truce proves its leverage  CNNOpinion | The Iranian Advantage Is an Illusion  The New York TimesAs Trump claims victory, Iran emerges bruised but powerful with leverage over Hormuz  ReutersCivilization Hasn’t Ended But It Sure Has Changed  Bloomberg.com"
2026-04-08,TOP_NEWS,Report: Hungary offered Iran intel on Hezbollah pager attack by Israel - The Times of Israel,Report: Hungary offered Iran intel on Hezbollah pager attack by Israel  The Times of Israel
2026-04-08,TOP_NEWS,"Hungary's Tisza party seen winning two-thirds majority in parliament, Median projection shows - Reuters","Hungary's Tisza party seen winning two-thirds majority in parliament, Median projection shows  ReutersMAGA’s favorite strongman might be on the brink of defeat  vox.comHow Orban Went From Invincible to Underdog in Hungary  Bloomberg.comWhen emigration helps bad rulers survive  The EconomistWhat's at Stake for Israel – and Netanyahu – if Orban Loses Hungary's Election  Haaretz"
2026-04-08,TOP_NEWS,Meta unveils first AI model from costly superintelligence team - Reuters,"Meta unveils first AI model from costly superintelligence team  ReutersIntroducing Muse Spark: MSL’s First Model, Purpose-Built to Prioritize People  meta.comMeta’s New AI Model Gives Mark Zuckerberg a Seat at the Big Kid’s Table  WIREDScaling How We Build and Test Our Most Advanced AI  AI at MetaMeta releases Muse Spark, the first model from Alexandr Wang's AI team  Business Insider"
2026-04-08,TOP_NEWS,Adam Back Denies He Is Satoshi Nakamoto in Response to Times Investigation - The New York Times,Adam Back Denies He Is Satoshi Nakamoto in Response to Times Investigation  The New York TimesThe New York Times may have found bitcoin founder Satoshi Nakamoto. Here's what you need to know.  Yahoo FinanceBritish computer scientist denies he is bitcoin developer Satoshi Nakamoto  The GuardianLatest investigation into bitcoin founder ties identity to Blockstream CEO Adam Back  CNBCAdam Back says he is not Bitcoin founder Satoshi Nakamoto  BBC
2026-04-08,TOP_NEWS,Amazon to end support for older Kindle devices - TechCrunch,Amazon to end support for older Kindle devices  TechCrunchAmazon Pulls Support for Perfectly Fine Older Kindles  WIREDGot a Kindle From Before 2013? Amazon Is Pulling Support  PCMagAmazon to end support for these 13 Kindle devices. Here's what you need to know.  MashableAmazon thanks loyal Kindle devotees by bricking their kit  theregister.com
2026-04-08,TOP_NEWS,"iOS 26.4.1 fixes iPhone bug that stopped iCloud data from syncing, including Apple Passwords - 9to5Mac","iOS 26.4.1 fixes iPhone bug that stopped iCloud data from syncing, including Apple Passwords  9to5MaciOS and iPadOS 26.4.1 is out to fix iCloud syncing bug  MacworldApple Releases iOS 26.4.1 and iPadOS 26.4.1 With Bug Fixes  MacRumorsiOS 26.4.1 Isn't a Big Update, but Download It Anyway  CNETStolen Device Protection now enabled by default for enterprise devices in iOS 26.4.1  9to5Mac"
2026-04-08,TOP_NEWS,Poke makes AI agents as easy to use as sending a text - TechCrunch,"Poke makes AI agents as easy to use as sending a text  TechCrunchPoke launches AI agents across iMessage, SMS and Telegram  mezha.netPoke brings AI agents to your phone via simple text message  The Tech BuzzPoke Brings AI Agents to Everyday Users via Text Message  National Today"
2026-04-08,TOP_NEWS,Google Pixel bests iPhone and Samsung in repairability name-and-shame report - 9to5Google,"Google Pixel bests iPhone and Samsung in repairability name-and-shame report  9to5GoogleThe iPhone Gets a D– for Repairability  WIREDFailing the Fix (2026)  PIRGApple and Lenovo have the least repairable laptops, analysis finds  Ars TechnicaApple gets bottom ranking for repairability of iPhones and MacBooks – with one exception  9to5Mac"
2026-04-08,TOP_NEWS,"WGA Deal: $321 Million for Health Fund, Better Residuals, AI Meetings - Variety","WGA Deal: $321 Million for Health Fund, Better Residuals, AI Meetings  VarietyWGA Reveals Details Of Its Studio Deal: Health Plan Takes Precedence As Writers Hold The Line On Other Key Issues  DeadlineWriters Guild Reveals Details of Four-Year Deal: A $321M Health Plan Infusion, Higher Residuals and AI Licensing Language  The Hollywood ReporterAwards Season Is Over. Strike Season Has Just Begun.  Vanity FairSAG-AFTRA to Resume Talks With Studios in April, Thanks to Early WGA Deal  Variety"
2026-04-08,TOP_NEWS,"HBO show’s final season scores 100% on Rotten Tomatoes, making it the network’s highest-rated show ever - Syracuse.com","HBO show’s final season scores 100% on Rotten Tomatoes, making it the network’s highest-rated show ever  Syracuse.comFrom Jean Smart’s Heart Surgery to a Shocking Lesbian Episode, ‘Hacks’ Ends — and Cements Its Legacy as One of TV’s Best Comedies  Variety'Hacks' returns for its final season. What time does it premiere?  USA Today'Hacks' Season 5 Review: Jean Smart in Final Season of HBO Max Comedy  The Hollywood Reporter‘Hacks’ Star ‘Taken Aback’ by Series-Ending Surprise Twist  The Daily Beast"
2026-04-08,TOP_NEWS,"Offset addresses shooting, blasts Lil Tjay claim he’s a ‘rat’ - Yahoo News New Zealand","Offset addresses shooting, blasts Lil Tjay claim he’s a ‘rat’  Yahoo News New ZealandLil Tjay Arrested and Charged in Connection With Offset Casino Shooting in Florida  Rolling StoneRapper Lil Tjay arrested in connection with Offset shooting; calls him a ‘rat’  AJC.comRapper Breaks Silence After Being Shot Outside Casino  The Daily BeastRapper Lil Tjay arrested in connection with Offset shooting in Florida  NBC News"
2026-04-08,TOP_NEWS,Shannen Doherty Ex-Husband Ashley Hamilton Hospitalized After Overdose - TMZ,"Shannen Doherty Ex-Husband Ashley Hamilton Hospitalized After Overdose  TMZShannen Doherty’s Ex-Husband Ashley Hamilton Reportedly Recovering After Apparent Overdose  YahooShannen Doherty’s first husband, Ashley Hamilton, hospitalized after overdose: report  Page SixAshley Hamilton hospitalised following overdose - report  YahooShannen Doherty’s Ex-Husband Ashley Hamilton Hospitalized After Apparent Overdose: Report  Us Weekly"
