date,source,title,description
2025-05-14,TOP_NEWS,Qatar Airways orders 160 Boeing twin-aisle jets during Trump visit - Reuters,"Qatar Airways orders 160 Boeing twin-aisle jets during Trump visit  ReutersTrump signs agreements with Qatar on defense and Boeing purchases  Fox NewsRepublicans voice concern over Trump's support for a new Air Force One from Qatar  NPRBoeing, GE Aerospace Get Qatar Airways Order After Saudi AI Tech Deals  WSJPlanes on the brain: Trump covets jet gift, announces Boeing deal on Qatar trip  USA Today"
2025-05-14,TOP_NEWS,First on CNN: New book reveals how Biden’s inner circle kept Cabinet from him in final two years of presidency - CNN,First on CNN: New book reveals how Biden’s inner circle kept Cabinet from him in final two years of presidency  CNNA Book Points to Biden’s Decline and Democrats’ Cowardice: 6 Takeaways  The New York Times‘Original Sin’ indicts the ‘cover-up’ of a steeply declining Joe Biden  The Washington PostHow Joe Biden Handed the Presidency to Donald Trump  The New YorkerDavid Axelrod says book's allegations about Biden's cognitive decline are 'troubling'  NPR
2025-05-14,TOP_NEWS,"Congress grills RFK Jr. on budget cuts, measles vaccine - The Washington Post","Congress grills RFK Jr. on budget cuts, measles vaccine  The Washington PostWATCH: RFK Jr Senate hearing disrupted by screaming protesters: 'RFK kills people with hate'  Fox NewsBen & Jerry's co-founder Ben Cohen arrested as Kennedy testifies at Senate hearing  AxiosDemocrats confront RFK Jr. on budget cuts, but will need Republican help to stop them  PoliticoLawmakers press Kennedy on mass cuts, canceled medical research  CNN"
2025-05-14,TOP_NEWS,California governor outlines $12 billion deficit and freeze on immigrant health program access - AP News,California governor outlines $12 billion deficit and freeze on immigrant health program access  AP NewsNewsom Proposes Scaling Back Health Care for Undocumented Immigrants in California  The New York TimesCalifornia's budget woes are back: State faces $12 billion deficit  CalMattersCalifornia governor seeks to exclude undocumented from Medicaid program  The GuardianState worker pay cuts proposed in Gov. Gavin Newsom’s revised California budget  Sacramento Bee
2025-05-14,TOP_NEWS,Republicans advance bill with steep cuts to Medicaid as part of Trump agenda - The Hill,Republicans advance bill with steep cuts to Medicaid as part of Trump agenda  The Hill'What a joke': Republicans lock horns over Medicaid proposal  ABC NewsHere's how proposed Medicaid cuts could impact Americans  WMURAOC’s 3 a.m. comment over miscarriages sparks fiery exchange with GOP male counterparts  PoliticoHow the Republican Tax Bill Would Hurt America’s Most Vulnerable  Barron's
2025-05-14,TOP_NEWS,Putin not on Kremlin list of officials attending Ukraine peace talks in Turkey - BBC,"Putin not on Kremlin list of officials attending Ukraine peace talks in Turkey  BBCWill Putin Be in Turkey for Peace Talks? Kremlin’s List Indicates Not.  The New York TimesPutin to skip summit with Ukraine and send low-level Russian negotiators  AxiosPlanned Russia-Ukraine talks upend European push for U.S. sanctions on Moscow  The Washington PostAs Russia and Ukraine prepare for possible direct talks, cue President Trump  NPR"
2025-05-14,TOP_NEWS,Divisions emerge among House Republicans over how much to cut taxes and Medicaid in Trump's bill - AP News,Divisions emerge among House Republicans over how much to cut taxes and Medicaid in Trump's bill  AP NewsTrump Arrives in Qatar After Meeting Syrian President in Saudi Arabia: Live Updates  The New York Times‘First time we were hearing of them’: The GOP megabill is packed with surprises for some Republicans  PoliticoRich vs. Poor: Who Gets What in the GOP Tax Bill  WSJThe latest roadblock for House Republicans' 'big beautiful bill': Senate Republicans  NPR
2025-05-14,TOP_NEWS,Georgetown researcher released from ICE custody after judge’s order - The Washington Post,"Georgetown researcher released from ICE custody after judge’s order  The Washington PostJudge Orders Georgetown Academic Released From Immigration Detention  The New York TimesIndian academic held over pro-Palestinian views released from Ice jail  The GuardianJudge orders release of Georgetown researcher arrested by ICE after allegedly spreading Hamas propaganda  Fox NewsAs a Political Prisoner, I Won’t Back Down on Supporting Palestine  Truthout"
2025-05-14,TOP_NEWS,House Democrat withdraws Trump impeachment bill that angered party leaders - ABC News,House Democrat withdraws Trump impeachment bill that angered party leaders  ABC NewsTop House Dems say they'll join GOP to quash Trump impeachment effort  Fox NewsThanedar opts against forcing impeachment vote amid backlash  PoliticoSmart politics or a publicity stunt? The man behind the latest effort to impeach Donald Trump  AP NewsLone Democrat’s Trump impeachment push blindsides party  CNN
2025-05-14,TOP_NEWS,Wisconsin judge argues prosecutors can’t charge her with helping a man evade immigration agents - CNN,Wisconsin judge argues prosecutors can’t charge her with helping a man evade immigration agents  CNNWisconsin Judge Accused of Obstructing Immigration Agents Seeks Dismissal of Case  The New York TimesHannah Dugan: US judge charged for allegedly helping Mexican man evade Ice  BBCJudge arrested by Trump administration cites presidential immunity ruling in defense  MSNBC NewsMilwaukee judge indicted for helping immigrant evade ICE faces up to 6 years in prison  Fox News
2025-05-14,TOP_NEWS,Key takeaways from day two of Donald Trump’s Middle East tour in Qatar - Al Jazeera,"Key takeaways from day two of Donald Trump’s Middle East tour in Qatar  Al JazeeraThe Trump franchise is expanding in the Middle East — and so are ethical concerns  NBC NewsWhy Trump’s boasts about Saudi Arabian investments are so hard to take seriously  MSNBC NewsIn Riyadh, President Trump Charts the Course for a Prosperous Future in the Middle East  The White House (.gov)Trump joined by dozens of CEOs during his Middle East trip  CNBC"
2025-05-14,TOP_NEWS,Gaza Hospital Strike Draws New Attention to Israel’s Medical Facility Attacks - The New York Times,"Gaza Hospital Strike Draws New Attention to Israel’s Medical Facility Attacks  The New York TimesIsrael targets Hamas leader Mohammed Sinwar in hospital strike in Gaza, sources say  CNNIsraeli 'bunker buster' bombs used in Gaza hospital strike, experts say  BBCIsrael may have killed Muhammad Sinwar, but he was likely never in the driver’s seat  The Times of IsraelHamas Rafah brigade commander probably killed in IDF strike on Sinwar  The Jerusalem Post"
2025-05-14,TOP_NEWS,Syrians rejoice after Trump pledge to lift crippling sanctions - The Washington Post,"Syrians rejoice after Trump pledge to lift crippling sanctions  The Washington PostTrump asks Syria to join Abraham Accords, normalize ties with Israel in return for sanctions relief  Fox NewsTrump meets with Syria’s interim president, a first between the nations’ leaders in 25 years  AP NewsTrump shocks and delights Syrians by lifting sanctions after 45 years. Now what?  NBC NewsTrump announces plan to lift punishing sanctions on Syria  CNN"
2025-05-14,TOP_NEWS,"Qatar Woos Trump, and Israeli Officers Privately Admit Gazans Near Starvation - The New York Times","Qatar Woos Trump, and Israeli Officers Privately Admit Gazans Near Starvation  The New York TimesIn Private, Some Israeli Officers Admit That Gaza Is on the Brink of Starvation  The New York TimesPalestinians are counting lentils, as Gaza food crisis worsens  NPRUNRWA makes urgent appeal for immediate end to Gaza siege  Vatican NewsUN Relief Chief calls on Security Council to act decisively to prevent genocide in Gaza  OCHA"
2025-05-14,TOP_NEWS,Who Needs China? Saudi Arabia Steps Up As Big Buyer Of AI Chips. - Investor's Business Daily,"Who Needs China? Saudi Arabia Steps Up As Big Buyer Of AI Chips.  Investor's Business DailyNvidia stock extends gains as Saudi Arabia set to spend billions on AI chips, US moves to rescind Biden's chip curbs  Yahoo FinanceNvidia, AMD extend stock gains. Why the AI trade is roaring back.  MarketWatchChina is 'big loser' of Nvidia's deal with Saudi AI startup Humain: Wedbush analyst Dan Ives  FortuneSovereign AI Is the Next Big Trend in Tech. What Investors Need to Know.  Barron's"
2025-05-14,TOP_NEWS,Nvidia-backed CoreWeave beats first-quarter revenue estimate - Yahoo Finance,"Nvidia-backed CoreWeave beats first-quarter revenue estimate  Yahoo FinanceNvidia-backed CoreWeave stock jumps on Q1 revenue beat as CEO cites 'robust' AI demand  Yahoo FinanceCoreWeave beats on revenue, reports more than 400% growth in first earnings after IPO  CNBCCoreWeave Q1 Revenue Beats. Stock Reverses Down Amid 2025 Capital Spending, Revenue Outlook.  Investor's Business DailyCoreWeave Reports Strong First Quarter 2025 Results  PR Newswire"
2025-05-14,TOP_NEWS,Online Trading Platform eToro Stock Jumps on IPO Day - Yahoo Finance,"Online Trading Platform eToro Stock Jumps on IPO Day  Yahoo FinanceStock trading app eToro pops 29% in Nasdaq debut after pricing IPO above expected range  CNBCIndividual Investors Are ‘Much More Resilient’ These Days, eToro CEO Says  WSJCrypto broker eToro’s upsized IPO to test the waters for stock-market newcomers  MarketWatcheToro Announces Pricing of Upsized Initial Public Offering  Business Wire"
2025-05-14,TOP_NEWS,Netflix’s ad tier is growing really fast — and that means more ads - The Verge,Netflix’s ad tier is growing really fast — and that means more ads  The VergeNetflix says its ad tier now has 94 million monthly active users  CNBCNetflix says ad-supported service has 94 million subscribers  Yahoo FinanceNetflix will show generative AI ads midway through streams in 2026  Ars TechnicaNetflix Says Ad Tier Has More Than 94 Million Users  The Hollywood Reporter
2025-05-14,TOP_NEWS,Google DeepMind creates super-advanced AI that can invent new algorithms - Ars Technica,"Google DeepMind creates super-advanced AI that can invent new algorithms  Ars TechnicaAlphaEvolve: A Gemini-powered coding agent for designing advanced algorithms  Google DeepMindMeet AlphaEvolve, the Google AI that writes its own code—and just saved millions in computing costs  VentureBeatThe frontier: A trading algorithm that writes itself and evolves  Forexlive | Forex News, Technical Analysis & Trading ToolsGoogle DeepMind’s AI Agent Dreams Up Algorithms Beyond Human Expertise  WIRED"
2025-05-14,TOP_NEWS,89 Million Steam Accounts Allegedly Compromised in a Data Breach. Our Advice: Change Your Password Now - CNET,89 Million Steam Accounts Allegedly Compromised in a Data Breach. Our Advice: Change Your Password Now  CNETTwilio denies breach following leak of alleged Steam 2FA codes  BleepingComputer89 million Steam accounts reportedly leaked. Change your password now.  MashableNow's a good time to check in on your Steam account security  EngadgetValve responds to Steam leak rumors: ‘this was not a breach of Steam systems’  The Verge
