date,source,title,description
2025-11-21,TOP_NEWS,Zelensky warns Ukraine risks losing US support over White House peace plan - BBC,"Zelensky warns Ukraine risks losing US support over White House peace plan  BBCAs Trump Pushes on Russia-Ukraine Peace Plan, Zelensky’s Options Are Narrowing  The New York TimesU.S. pushing Ukraine to sign peace deal by Thanksgiving or lose support  The Washington Post‘The Ukrainians will have to accept’: Why Trump officials think now is their best chance for a deal  PoliticoTrump's full 28-point Ukraine-Russia peace plan  Axios"
2025-11-21,TOP_NEWS,"Comey seeks to dismiss charges, alleging ""fundamental errors"" before grand jury - CBS News","Comey seeks to dismiss charges, alleging ""fundamental errors"" before grand jury  CBS NewsComey Seeks to Dismiss Charges Based on Grand Jury Errors  The New York TimesReaders Write: James Comey indictment, stereotypes, human rights, Target, the Epstein files  Star TribuneIn reversal, DOJ says Comey indictment was reviewed by full grand jury  ABC NewsNovember 19, 2025: Lindsey Halligan says full grand jury never saw final indictment it handed up against Comey  CNN"
2025-11-21,TOP_NEWS,Just follow orders or obey the law? What US troops told us about refusing illegal commands - The Conversation,"Just follow orders or obey the law? What US troops told us about refusing illegal commands  The ConversationDemocrats seek police action on Trump’s ‘threatening’ social media posts  The Washington PostSenator whose wife was shot fears for safety after Trump sedition accusation  The GuardianTrump says he wasn't threatening Democrats he accused of 'seditious behavior, punishable by death'  NBC NewsDemocrats defend message to troops as Trump, officials suggest they be punished  ABC News"
2025-11-21,TOP_NEWS,7 things to know about the Justice Department’s Epstein files - PBS,7 things to know about the Justice Department’s Epstein files  PBS4 questions — and answers — about the Epstein files release  PoliticoCongress isn’t done with Epstein — but Trump’s thumb is firmly on the scale  The IndependentTrump says he's signed bill to release Epstein files  CBS NewsPolitics  The Economist
2025-11-21,TOP_NEWS,Ohio officer found not guilty of murdering pregnant Black woman - Reuters,"Ohio officer found not guilty of murdering pregnant Black woman  ReutersOhio officer found not guilty of murder in Ta'Kiya Young's shooting death  ABC NewsOfficer found not guilty in shooting of pregnant mom  YahooOhio police officer acquitted in death of Ta’Kiya Young, a pregnant Black mother accused of shoplifting  CNNJury reaches verdict in trial of Ohio officer charged with murder. Watch live  The Columbus Dispatch"
2025-11-21,TOP_NEWS,Democratic Rep. Eric Swalwell enters crowded California governor's race - NBC News,"Democratic Rep. Eric Swalwell enters crowded California governor's race  NBC NewsRepresentative Eric Swalwell Will Run for California Governor  The New York TimesUS Representative Eric Swalwell announces run for California governor  The GuardianDemocratic Rep. Eric Swalwell joins race for California governor  CNNRep. Eric Swalwell, staunch Trump critic, launches bid for California governor  The Washington Post"
2025-11-21,TOP_NEWS,3 Children Are Injured in Grizzly Bear Attack in British Columbia - The New York Times,"3 Children Are Injured in Grizzly Bear Attack in British Columbia  The New York Times11 injured after grizzly bear attacks group of elementary school students  YahooEleven injured after grizzly bear attacks schoolchildren and teachers in Canada  The GuardianGrizzly bear on loose after attacking school group in Canada, injuring 11  BBCGrizzly bear attack on school group leaves 4 seriously hurt  DW"
2025-11-21,TOP_NEWS,Japan’s Takaichi Rejects China Demand to Retract Taiwan Remarks - Bloomberg.com,"Japan’s Takaichi Rejects China Demand to Retract Taiwan Remarks  Bloomberg.comThe real reason behind China’s fury toward Japan’s Takaichi  CNNChina & Taiwan Update November 21, 2025  Institute for the Study of WarJapanese concerts in China are getting abruptly canceled as tensions simmer  CNBCChina unleashes 'wolf warriors' in diplomatic duel with Japan  Reuters"
2025-11-21,TOP_NEWS,Former key figure in UK populist party Reform jailed for taking bribes to make pro-Russia statements - CNN,Former key figure in UK populist party Reform jailed for taking bribes to make pro-Russia statements  CNNFormer Reform U.K. Politician Sent to Prison for Taking Pro-Russia Bribes  The New York TimesNathan Gill: How WhatsApp messages revealed ex-Reform politician's pro-Russian bribes  BBCEx-Farage Ally Gets 10.5 Years in Jail for Taking Pro-Russian Bribes  Bloomberg.comEx-leader of Reform UK in Wales jailed for 10 years over pro-Russia bribes  Al Jazeera
2025-11-21,TOP_NEWS,'A lot of fighting': Fossil fuel row breaks out at UN climate summit - BBC,"'A lot of fighting': Fossil fuel row breaks out at UN climate summit  BBCCOP30 host Brazil urges unity as climate summit deadlocked over fossil fuels  Reuters‘It’s like arguing with robots’: negotiators on the state of Cop30 talks  The GuardianEU threatens to block ‘weak’ COP30 deal  PoliticoDispute over fossil fuel phaseout upsets UN climate talks, and overtime looks likely  AP News"
2025-11-21,TOP_NEWS,"Stock Market Tumbles On Nvidia, Bitcoin; Walmart, Google Strong: Weekly Review - Investor's Business Daily","Stock Market Tumbles On Nvidia, Bitcoin; Walmart, Google Strong: Weekly Review  Investor's Business DailyStock market today: Dow, S&P 500, Nasdaq bounce but end turbulent week with sharp losses  Yahoo FinanceMore swings hit Wall Street, but this time stocks finish higher  AP NewsCNBC Daily Open: From AI enthusiasm to bubble worries in one day  CNBCWhy were stocks down today? What to know as Dow gives up 700-point gain  USA Today"
2025-11-21,TOP_NEWS,Crypto plunge wipes out nearly $400 billion in a week - Axios,"Crypto plunge wipes out nearly $400 billion in a week  AxiosBitcoin Heading for Worst Month Since Crypto Collapse of 2022  Yahoo FinanceBitcoin Plunge Hits Market Makers in a Fragile Trading Landscape  Bloomberg.comBitcoin continues slide that's roiling markets, threatens to break below $80,000  CNBCBitcoin on thin ice after sinking in flight from risk  Reuters"
2025-11-21,TOP_NEWS,Uneasiness Over A.I. Spending Looms Over Markets - The New York Times,"Uneasiness Over A.I. Spending Looms Over Markets  The New York TimesTech stocks wrap big losing week as AI names get rocked after Nvidia earnings  CNBCAI Fears Shake Markets. Why Nvidia No Longer Shows the Way and What Can.  Barron'sNvidia, Palantir, Microsoft, Tesla Remain Hot Picks Amid AI Sell-Off  Yahoo FinanceBuy 'AI winners,' Wedbush says, as bears 'all come out of hibernation' (NVDA:NASDAQ)  Seeking Alpha"
2025-11-21,TOP_NEWS,"Starting today, Full Screen Experience for Windows 11 PCs is available for Xbox Insiders! - Xbox Wire","Starting today, Full Screen Experience for Windows 11 PCs is available for Xbox Insiders!  Xbox WireYou can now try the Xbox Full Screen Experience on any PC, laptop, or tablet  The VergeMicrosoft built a Windows 11 shell for Xbox and gaming — so why can’t we get one for phones?  Windows CentralMicrosoft brings the Xbox Ally X's full screen experience to other handhelds  EngadgetMicrosoft makes Full Screen Experience available to all Windows 11 gaming handhelds — highly requested feature no longer exclusive to the Asus ROG Xbox Ally X  Tom's Hardware"
2025-11-21,TOP_NEWS,Apple Launches Second Limited-Edition iPhone Accessory in a Month - MacRumors,"Apple Launches Second Limited-Edition iPhone Accessory in a Month  MacRumorsApple’s new limited edition iPhone grip is all about accessibility  The VergeApple Debuts a New iPhone Accessory Designed With Accessibility in Mind  ELLE DecorApple teamed up with another artist to make this iPhone grip and stand  EngadgetBailey Hikawa makes an iPhone grip and stand that looks odd but is actually pure, powerful purpose  TechRadar"
2025-11-21,TOP_NEWS,SpaceX loses debut V3 Super Heavy in ground test mishap - theregister.com,"SpaceX loses debut V3 Super Heavy in ground test mishap  theregister.comBooster 18 implodes, footage captured on LabPadre Space Channel camera  ValleyCentral.comSpaceX’s upgraded Starship suffers explosion during testing  TechCrunchSpaceX's 1st 'Version 3' Super Heavy Starship booster buckles under pressure during initial tests  SpaceSpaceX issues statement on Starship V3 Booster 18 anomaly  Teslarati"
2025-11-21,TOP_NEWS,Google Sparks Backlash After Gmail Setting Lets Gemini Peek Inside Inboxes - Decrypt,"Google Sparks Backlash After Gmail Setting Lets Gemini Peek Inside Inboxes  DecryptGmail can read your emails and attachments to train its AI, unless you opt out  MalwarebytesGoogle denies ‘misleading’ reports of Gmail using your emails to train AI  The VergeGoogle's AI is now snooping on your emails - here's how to opt out  ZDNETGmail Users Warned To Opt Out Of New Feature—What We Know  Newsweek"
2025-11-21,TOP_NEWS,"Box Office: ‘Wicked: For Good’ Earns Huge $30.8 Million in Previews, Highest of the Year - Variety","Box Office: ‘Wicked: For Good’ Earns Huge $30.8 Million in Previews, Highest of the Year  VarietyWatch a ‘Wonderful’ Moment From ‘Wicked: For Good’  The New York TimesNew movies to watch this weekend: See 'Sisu: Road to Revenge' in theaters, rent 'Anniversary,' stream 'After the Hunt' on Prime Video  Yahoo‘Wicked: For Good’ Bursts Its Own Bubble  The AtlanticWicked: For Good Movie vs. Broadway Musical: Breaking Down the Biggest Differences  E! News"
2025-11-21,TOP_NEWS,Kandi Burruss Announces Split From Todd Tucker - TMZ,"Kandi Burruss Announces Split From Todd Tucker  TMZRHOA Alum Kandi Burruss and Todd Tucker Split After 11 Years of Marriage: 'A Difficult and Emotional Time' (Exclusive)  People.com‘Real Housewives of Atlanta’ Alum Kandi Burruss and Husband Todd Tucker Split After 11 Years of Marriage  Us WeeklyRHOA' alum Kandi Burruss and Todd Tucker to divorce after 11 years of marriage  Page SixKandi Burruss-Todd Tucker divorce: Prenup, net worth, kids, and more  Hindustan Times"
2025-11-21,TOP_NEWS,Record Prices Paid For ‘Superman’ Comics Could Bode Well For Warner Bros Discovery Sale - Deadline,Record Prices Paid For ‘Superman’ Comics Could Bode Well For Warner Bros Discovery Sale  Deadline‘Superman #1’ copy found in attic becomes most expensive comic ever sold  CNNMom bought it for 10 cents in SF. Her sons just sold it for an unthinkable price  SFGATEBay Area brothers shocked after discovering $9 million comic in mother's attic  YahooSuperman copy found in mum's attic is most valuable comic ever at $9.12m  BBC
