date,source,title,description
2025-12-25,TOP_NEWS,"Live updates: Mountain mudslide damage extensive, SoCal storm still a threat - KTLA","Live updates: Mountain mudslide damage extensive, SoCal storm still a threat  KTLALA is getting a breather on Christmas, but another big storm is coming our way  LAistEvacuation warning extended in Pacific Palisades as rainfall continues  NBC Los AngelesAnother storm slams California on Christmas Day with flooding rain, high winds and mountain snow  CNNHere’s what to expect Friday after record-breaking holiday rain in SoCal  Los Angeles Times"
2025-12-25,TOP_NEWS,New York City Braces for Heavy Snow as Winter Storm Approaches - The New York Times,"New York City Braces for Heavy Snow as Winter Storm Approaches  The New York TimesWinter Storm Warning in effect ahead of widespread snow, mix across NYC, Tri-State area on Friday night into Saturday morning  ABC7 New YorkPreliminary Storm Forecast : Friday 12/26 – Saturday 12/27  Hudson Valley WeatherWinter storm warning issued for NYC area ahead of Friday snow; up to 8 inches likely  NBC New YorkSnow could make post-Christmas travel difficult in Upstate NY  Syracuse.com"
2025-12-25,TOP_NEWS,Coast Guard Tracks Down Runaway Oil Tanker Linked to Iran and Venezuela - The Wall Street Journal,"Coast Guard Tracks Down Runaway Oil Tanker Linked to Iran and Venezuela  The Wall Street JournalTrump Discovers Maduro’s Achilles’ Heel  The AtlanticTrump’s Seizures of Oil Tankers Challenge Maritime Rules and Customs  The New York TimesTrump, ramping up pressure on Maduro, says it would be 'smart' for Venezuelan leader to step down  ABC NewsWhite House orders military to focus on 'quarantine' of Venezuela oil  Reuters"
2025-12-25,TOP_NEWS,Pope Leo XIV urges the faithful on Christmas to shed indifference in the face of suffering - AP News,"Pope Leo XIV urges the faithful on Christmas to shed indifference in the face of suffering  AP NewsPope at Urbi et Orbi: Peace is a shared responsibility  Vatican NewsIn first Christmas sermon, Pope Leo decries conditions for Palestinians in Gaza  ReutersPope Leo urges 'courage' to end Ukraine war in first Christmas address  BBCThe pope urges the faithful on Christmas to shed indifference in the face of suffering  NPR"
2025-12-25,TOP_NEWS,Zelensky hails 'new ideas' on peace after talk with US envoys - BBC,"Zelensky hails 'new ideas' on peace after talk with US envoys  BBCWhy Russia Is Likely to Reject the New U.S.-Ukrainian Peace Plan  The New York TimesRussian Offensive Campaign Assessment, December 24, 2025  Institute for the Study of WarZelenskyy says he had ""very good conversation"" with Witkoff and Kushner on Christmas  CBS NewsUkraine, US negotiators discussed how to bring peace closer, Zelenskiy says  Reuters"
2025-12-25,TOP_NEWS,DOJ says it may need a 'few more weeks' to finish releasing Epstein files - NPR,"DOJ says it may need a 'few more weeks' to finish releasing Epstein files  NPR‘It’s perpetuated this news cycle’: Frustration mounts in Trump’s orbit about messaging on latest Epstein documents  CNNSo This Is Why Trump Didn’t Want to Release the Epstein Files  The AtlanticOpinion | The Epstein File Drop Is Not About Justice  The New York TimesMichael Flynn presses Trump, Bondi, Wiles on Epstein response: ‘This is a disaster’  The Hill"
2025-12-25,TOP_NEWS,Trump says US military struck ISIS terrorists in Nigeria - CNN,"Trump says US military struck ISIS terrorists in Nigeria  CNNTrump Announces Strike Against ISIS in Nigeria  The New York TimesUS carries out strikes on Nigeria targeting Islamic State militants, Trump says  The GuardianTrump launches Christmas night airstrikes on ISIS 'Terrorist Scum' in Nigeria after killings of Christians  Fox NewsTrump says he ordered strikes on ISIS targets in Nigeria  NBC News"
2025-12-25,TOP_NEWS,"After 20 years of Florida's gift ban, some would like to make a return - Politico","After 20 years of Florida's gift ban, some would like to make a return  Politico"
2025-12-25,TOP_NEWS,Trump rings in Christmas Day with a flurry of posts denouncing perceived foes and casting doubt on the 2020 election - NBC News,"Trump rings in Christmas Day with a flurry of posts denouncing perceived foes and casting doubt on the 2020 election  NBC NewsDonald Trump And Joe Biden Both Posted Christmas Messages And They Couldn't Be Anymore Different  YahooThe 12 days of Trump-mas  The Guardian'Radical Left Scum.' Trump Xmas cheer greets rivals  USA TodayTrump wishes ‘Merry Christmas to all, including the radical left scum’  The Hill"
2025-12-25,TOP_NEWS,19 states sue to block Kennedy's plan to curb trans care - Axios,19 states sue to block Kennedy's plan to curb trans care  Axios19 states sue HHS over a move that could curtail youth gender-affirming care  NPRDemocratic-led states sue HHS over proposal targeting hospitals that offer transgender care to minors  CNN19 States Sue to Block White House Plan to End Gender-Related Care for Minors  The New York TimesWisconsin sues Trump over rules restricting gender-affirming care  Milwaukee Journal Sentinel
2025-12-25,TOP_NEWS,"Five Killed in Helicopter Crash on Kilimanjaro, Africa’s Highest Peak - The New York Times","Five Killed in Helicopter Crash on Kilimanjaro, Africa’s Highest Peak  The New York TimesA helicopter on a rescue mission crashes on Tanzania's Mount Kilimanjaro, killing all 5 on board  ABC NewsHelicopter crash on Tanzania's Mount Kilimanjaro kills five, aviation authority says  ReutersTanzania: Five dead in helicopter crash on Mt. Kilimanjaro  dw.comRescue helicopter crashes on Tanzania's Mount Kilimanjaro, killing all 5 on board  CBS News"
2025-12-25,TOP_NEWS,Australian prime minister announces bravery award for heroes of Bondi antisemitic attack - Politico,"Australian prime minister announces bravery award for heroes of Bondi antisemitic attack  PoliticoA memorial ends, but Bondi tragedy has left Australia reeling, again  BBCOne Mitzvah for Bondi campaign fights hate with love … one small act of kindness at a time  The GuardianAustralia to honor Bondi Beach terror attack heroes  The Jerusalem Post20,000 ‘Reclaim’ Bondi Beach With Defiant Pledge to Increase Light  Chabad"
2025-12-25,TOP_NEWS,Christmas Around the World in Photos - The New York Times,Christmas Around the World in Photos  The New York TimesWaterskiing Santas and giant cuts of meat: Christmas around the world  BBCPhotos of Christmas celebrations around the world  AP NewsPhotos of ways Christmas is celebrated all around the world  CBS NewsChristmas celebrations around the world in photos  Australian Broadcasting Corporation
2025-12-25,TOP_NEWS,King Charles Urges ‘Compassion’ and Finding Strength in Diversity in Annual Christmas Message - The New York Times,"King Charles Urges ‘Compassion’ and Finding Strength in Diversity in Annual Christmas Message  The New York TimesKing's speech 2025: Christmas message urges communities to pull together in divided world  BBCKing Charles urges 'digital detox,' reconciliation in Christmas speech after year of royal drama  Fox NewsKing Charles calls for reconciliation and unity in Christmas message  The GuardianKing Charles breaks tradition with Christmas speech, calls for 'reconciliation'  USA Today"
2025-12-25,TOP_NEWS,$1.817 Billion Powerball Jackpot Won by Single Ticket in Arkansas - The New York Times,"$1.817 Billion Powerball Jackpot Won by Single Ticket in Arkansas  The New York TimesSingle ticket wins $1.8 billion Powerball jackpot on Christmas Eve  Cincinnati EnquirerOne winning Powerball ticket sold in Arkansas  YahooVA lottery winners in Wednesday draw included: $1M, $100k, two $50k, & K-12 schools  WDBJ7$1 million-winning Powerball ticket sold in Indiana  WTHR"
2025-12-25,TOP_NEWS,Tesla Robotaxis Are Big on Wall St. but Lagging on Roads - The New York Times,Tesla Robotaxis Are Big on Wall St. but Lagging on Roads  The New York TimesTesla's Austin Robotaxi Project Is Smaller Than Elon Musk's Claims: Report  Yahoo FinanceWhy 2026 Will Be the Year of the Tesla Robotaxi  The Motley FoolTesla’s Robotaxi project in Austin is much smaller than Musk claims  ElectrekTesla explores incentive plan to prepare workforce for robotaxi operations  HR Katha
2025-12-25,TOP_NEWS,Investors Warn of ‘Rot in Private Equity’ as Funds Strike Circular Deals - The New York Times,"Investors Warn of ‘Rot in Private Equity’ as Funds Strike Circular Deals  The New York TimesOnce Wall Street’s high-flyer, private equity loses its luster  The Seattle TimesHow one private equity group’s deals show risks of firms selling to themselves  Financial TimesThe Declining Luster of Private Equity: Why the Golden Age is Yielding to Public Markets  FinancialContentContinuation vehicles: Tax considerations to drive private equity fund value  RSM US LLP"
2025-12-25,TOP_NEWS,Google Now Allows Users to Change Their @gmail.com Email Address - CybersecurityNews,"Google Now Allows Users to Change Their @gmail.com Email Address  CybersecurityNewsGoogle says it is ‘gradually rolling out’ option to change your @gmail.com address  9to5GoogleGoogle is allowing users to change their Gmail address, per official Google support doc — experimental @gmail feature rolling out in India first, no official announcement yet  Tom's HardwareYou may finally be able to change your old, embarrassing Gmail address  Android AuthorityGoogle May Soon Let You Change That Old, Silly Gmail Address  bgr.com"
2025-12-25,TOP_NEWS,The video games you may have missed in 2025 - The Guardian,"The video games you may have missed in 2025  The GuardianThe Best Video Games of 2025, From ‘Blue Prince’ to ‘Silksong’ to ‘Avowed’  Bloomberg.com10 indie games from 2025 that delighted the PlayStation Indies teams  PlayStation.BlogHidden Gems 2025: The Best New Games You Might Never Have Heard Of  GameSpotThe Morning After: The best games of 2025  Engadget"
2025-12-25,TOP_NEWS,Grotmas Calendar Day 25 – Huron Blackheart strides forth from the Maelstrom - Warhammer Community,Grotmas Calendar Day 25 – Huron Blackheart strides forth from the Maelstrom  Warhammer Community
