date,source,title,description
2026-05-18,TOP_NEWS,Trump drops IRS lawsuit in exchange for DOJ $1.8 billion 'weaponization' fund - Reuters,Trump drops IRS lawsuit in exchange for DOJ $1.8 billion 'weaponization' fund  ReutersJustice department sets up $1.7bn fund to compensate Trump allies as he drops IRS lawsuit  BBCTop Treasury Lawyer Resigns After Creation of ‘Anti-Weaponization Fund’  The New York TimesTreasury Lawyer Quits as Government Settles Trump IRS Suit  WSJWhat to know about Trump’s nearly $1.8B fund to compensate allies claiming political targeting  Dallas News
2026-05-18,TOP_NEWS,The Supreme Court avoids taking up a fight over Voting Rights Act enforcement for now - NPR,The Supreme Court avoids taking up a fight over Voting Rights Act enforcement for now  NPRJustice Jackson slams Supreme Court’s handling of rush appeal in Louisiana redistricting case  CNNKetanji Brown Jackson says Supreme Court risks being seen as political after voting rights decision  The Boston GlobeUS Supreme Court reverses ruling against Mississippi legislative redistricting  Mississippi TodaySupreme Court sends closely watched Native American voting rights decision back to lower court  AP News
2026-05-18,TOP_NEWS,Minnesota county charges an ICE officer in a nonfatal shooting during Trump's immigration crackdown - AP News,Minnesota county charges an ICE officer in a nonfatal shooting during Trump's immigration crackdown  AP NewsSee more headlines & perspectives on Google News
2026-05-18,TOP_NEWS,"Severe Weather Outbreak Maps Tracker: Radar, Warnings, Storm Reports And More - The Weather Channel","Severe Weather Outbreak Maps Tracker: Radar, Warnings, Storm Reports And More  The Weather ChannelSevere Weather Outbreak Continues Tuesday, Storms Possible From Texas to Maine  YahooSevere storm outbreak in Central US pushes east Tuesday as threat gradually eases  CNNLatest Weather Updates: Tornadoes Reported in Kansas and Nebraska  The New York TimesLive updates: Tornado danger grows across Plains, Midwest as severe weather outbreak continues  FOX Weather"
2026-05-18,TOP_NEWS,"Iran more than doubled executions in 2025 as global use of the death penalty hit 44-year high, report says - CBS News","Iran more than doubled executions in 2025 as global use of the death penalty hit 44-year high, report says  CBS NewsGLOBAL: Executions surge to highest recorded figure in 44 years  Amnesty InternationalDeSantis, Florida singled out in report as executions surge worldwide  Tallahassee DemocratExecutions nearly doubled in the U.S. last year, and soared abroad  NPRExecutions worldwide hit 40-year high, Amnesty says  DW.com"
2026-05-18,TOP_NEWS,Now it’s Vladimir Putin’s turn to visit Beijing - The Economist,Now it’s Vladimir Putin’s turn to visit Beijing  The EconomistPutin heads to Beijing days after Trump in test of China's balancing act  CNBCPutin Aims to Unlock Gas Pipeline Project to China in Xi Talks  Bloomberg.comWhat really holds China and Russia together  BBCXi prepares to welcome Putin to China four days after hosting Trump  The Guardian
2026-05-18,TOP_NEWS,Shifting momentum in the Russia-Ukraine war - NPR,"Shifting momentum in the Russia-Ukraine war  NPRRussia is starting to lose ground in Ukraine  The EconomistRussia’s war casualty toll in Ukraine up by 1,220 over past day  Ukrinform - Ukrainian National News AgencyRussia’s War Is Going Badly—on the Ground and in the Air  WSJEconomist: Russia is starting to lose ground in Ukraine  Institute for the Study of War"
2026-05-18,TOP_NEWS,NextEra-Dominion Deal Signals Era of AI Utility Mega-Mergers - Bloomberg.com,"NextEra-Dominion Deal Signals Era of AI Utility Mega-Mergers  Bloomberg.comWhy you should care about 2 power companies merging. Hint: affordability  NPRSwamped by data center demands, Dominion Energy just opted for a megamerger  The Washington PostNextEra bets $66.8B on AI power boom with Dominion Energy acquisition  Fox BusinessWhat NextEra and Dominion’s giant utility merger means for your electric bill  MarketWatch"
2026-05-18,TOP_NEWS,The Catastrophic Swatch x Audemars Piguet Launch Was Entirely Predictable and Utterly Avoidable - WIRED,"The Catastrophic Swatch x Audemars Piguet Launch Was Entirely Predictable and Utterly Avoidable  WIREDShoppers’ Frenzy for ‘Royal Pop’ Pocket Watches Forces Swatch to Shut Stores  The New York TimesActor Russell Andrews shares ALS diagnosis  CNNA new Swatch model is introduced, and a case study in overexcited ‘drop culture’ plays out  AP NewsSwatch x Audemars Piguet Royal Pop Resale Prices Drop Following Frenzied Worldwide Release  WWD"
2026-05-18,TOP_NEWS,"Apple Readies AI Writing Help, App Shortcuts and Wallpapers for iOS 27 - Bloomberg.com","Apple Readies AI Writing Help, App Shortcuts and Wallpapers for iOS 27  Bloomberg.comApple’s New ChatGPT-Like Siri App Will Have Auto-Deleting Chats  Bloomberg.comMore Apple Intelligence features detailed as iOS 27 leaks continue  MacworldWWDC 2026 Preview: Apple Readies Siri Overhaul, AI Updates, and More  eWeekStandalone Siri app to offer auto-deleting chat history, launch with beta label: report  9to5Mac"
2026-05-18,TOP_NEWS,Report: Saros And Ghost Of Yōtei Aren't Coming To PC As PlayStation Charts A Return To Console Exclusivity - Game Informer,Report: Saros And Ghost Of Yōtei Aren't Coming To PC As PlayStation Charts A Return To Console Exclusivity  Game InformerPlayStation exclusives aren’t coming to PC anymore  The VergeIt’s the end of an era for PlayStation’s first-party free for all  Polygon.comSay goodbye to (most) PlayStation exclusives on PC  PCWorldPlayStation CEO Confirms Single-Player Games Will No Longer Launch on PC  Insider Gaming
2026-05-18,TOP_NEWS,What We’re Expecting at Google I/O 2026 - Gizmodo,"What We’re Expecting at Google I/O 2026  GizmodoGoogle I/O primer: Alphabet's AI showcase is its chance to wow Wall Street  CNBCA smarter, more proactive Android with Gemini Intelligence  blog.googleThis New Gemini Is Not the Siri We Need  CNETHow To Watch The Google I/O 2026 Keynote  Engadget"
2026-05-18,TOP_NEWS,Google is rolling out its redesigned Workspace app icons - The Verge,"Google is rolling out its redesigned Workspace app icons  The VergeGoogle's Much-Improved App Icons Are Rolling Out Now  EngadgetGradient Google icon redesign rolling out on Android, iOS, & web  9to5GoogleGoogle's new gradient icons for Gmail, Calendar, Drive and more are finally rolling out  Android CentralGoogle's icon overhaul is finally here, but not everyone is happy about it  Android Police"
2026-05-18,TOP_NEWS,William Daniels and Bonnie Bartlett clarify 'open marriage' ahead of 75th anniversary - Entertainment Weekly,"William Daniels and Bonnie Bartlett clarify 'open marriage' ahead of 75th anniversary  Entertainment WeeklyBoy Meets World star William Daniels', 99, rules of 'open marriage' with famous wife revealed  YahooVeteran Hollywood couple share details of their ‘open marriage’  News.com.auBonnie Bartlett rejected William Daniels with three brutal words before embarking on 75-year marriage  Page SixBoy Meets World Star William Daniels, Wife Bonnie Bartlett Explain Truth About Their ""Open Marriage""  E! Online"
2026-05-18,TOP_NEWS,Disney Accused of “Staging” Viral Pedro Pascal ‘Mandalorian’ Fan Surprise With Influencers - Yahoo,Disney Accused of “Staging” Viral Pedro Pascal ‘Mandalorian’ Fan Surprise With Influencers  YahooPedro Pascal surprises Star Wars fans at Disneyland  KTLAPedro Pascal goes undercover for ‘Star Wars’ surprise at Disneyland  Los Angeles TimesPedro Pascal shocks fans in costume as the Mandalorian inside Disneyland ride  Entertainment WeeklyPedro Pascal surprises guests as 'The Mandalorian' at Star Wars: Galaxy's Edge in Disneyland  ABC7 Los Angeles
2026-05-18,TOP_NEWS,"Sebastian Stan's Fjord Rocks Cannes With Renate Reinsve, 10-Minute Ovation - Variety","Sebastian Stan's Fjord Rocks Cannes With Renate Reinsve, 10-Minute Ovation  Variety'Fjord' Review: Sebastian Stan and Renate Reinsve in Parenting Hell  The Hollywood ReporterFjord review - Cristian Mungiu at sea with strange child abuse drama starring Renate Reinsve and Sebastian Stan  The Guardian‘Fjord’ premiere red carpet at Cannes Film Festival 2026: Daisy Edgar-Jones, Sharon Stone, Demi Moore more  Page Six'Fjord' Starring Sebastian Stan Has Longest Cannes Ovation So Far This Year  Deadline"
2026-05-18,TOP_NEWS,Brendan Sorsby files suit to restore NCAA eligibility - NBC Sports,"Brendan Sorsby files suit to restore NCAA eligibility  NBC SportsTexas Tech's Brendan Sorsby files injunction, seeks eligibility  ESPNTexas Tech QB Brendan Sorsby files lawsuit vs. NCAA in attempt to play in 2026  Yahoo SportsBrendan Sorsby admits to gambling on his own team, sues NCAA in Lubbock court for injunction  Fox NewsBrendan Sorsby could be the biggest supplemental draft entry in years — what the NFL thinks of him  The New York Times"
2026-05-18,TOP_NEWS,ESPN's Malika Andrews fires subtle shot back at Blake Griffin after Shams Charania bashing - Yahoo Sports,"ESPN's Malika Andrews fires subtle shot back at Blake Griffin after Shams Charania bashing  Yahoo SportsShai Gilgeous-Alexander gives teammates multiple gifts after winning MVP  ESPNWarriors star Draymond Green calls early NBA MVP leak 'embarrassing' for league  Yahoo SportsSGA is NBA MVP again, but has Victor Wembanyama passed him as league’s best player?  The New York TimesShai Gilgeous-Alexander of the Thunder becomes the 14th player to win back-to-back NBA MVPs  AP News"
2026-05-18,TOP_NEWS,Steelers teammates ecstatic to welcome QB Aaron Rodgers back to Pittsburgh - NFL.com,Steelers teammates ecstatic to welcome QB Aaron Rodgers back to Pittsburgh  NFL.comAaron Rodgers quickly gets back to work with Steelers at OTAs  ESPNSteelers Insider Believes Team Made Wrong Move by Re-Signing Aaron Rodgers  Yahoo SportsNFL futures 2026: Can the Steelers repeat as AFC North champs with return of Aaron Rodgers?  CBS SportsOTAs Blog: Making a connection  Steelers.com
2026-05-18,TOP_NEWS,Newly discovered asteroid to pass closer to Earth than the moon Monday - NBC News,"Newly discovered asteroid to pass closer to Earth than the moon Monday  NBC NewsAn asteroid discovered days ago will narrowly miss Earth  CNNWatch tonight's asteroid near-miss live online, as the enormous space rock zips past our planet  BBC Sky at Night MagazineAsteroid 2026 JH2 Is About to Fly Right Past Earth—Relatively Speaking  WIREDWatch an asteroid the size of a blue whale hurtle towards Earth live online TODAY  Space"
