date,source,title,description
2026-04-19,TOP_NEWS,"Trump says US delegation will travel to Islamabad on Monday, Iran declines talks - France 24","Trump says US delegation will travel to Islamabad on Monday, Iran declines talks  France 24Iran rebuffs Trump's plan for new round of peace talks, state media reports  CNBCUS seizes Iranian cargo ship as Tehran rejects a second round of peace talks  KSL NewsIran currently has no decision to send a negotiating delegation to Pakistan, Tasnim reports  ReutersIran Rejects 2nd Round Of Talks With US: ""Excessive Demands, Blame Games""  NDTV"
2026-04-19,TOP_NEWS,"3 students, 2 others shot near the University of Iowa, authorities say - Politico","3 students, 2 others shot near the University of Iowa, authorities say  PoliticoView Full Coverage on Google News"
2026-04-19,TOP_NEWS,Democrats Eye a Broader Battlefield to Capture Congress in November - The New York Times,Democrats Eye a Broader Battlefield to Capture Congress in November  The New York TimesExclusive: DNC bets on the South as next political battleground  AxiosDemocrats Eye Deep-Red Turf As Trump's Popularity Tumbles  HuffPost
2026-04-19,TOP_NEWS,Trump DOJ redoubling election scrutiny efforts - Politico,"Trump DOJ redoubling election scrutiny efforts  PoliticoFBI Director says arrests ‘coming soon’ on 2020 rigged election conspiracy  Democracy DocketKash Patel Just Announced Live On Fox News: “Arrests Are Coming — And I Promise You, It’s Coming Soon”  USA HeraldFox’s Bartiromo Says ‘Yep’ After Trump Tells Her ‘The Election Was Rigged’  Yahoo News UKFox's Maria Bartiromo Grills Kash Patel About 2020 Election  Mediaite"
2026-04-19,TOP_NEWS,Hamas Officials Say Group Is Ready to Hand Over Some Weapons - The New York Times,"Hamas Officials Say Group Is Ready to Hand Over Some Weapons  The New York TimesHamas rejects Gaza disarmament plan, Palestinian official says  BBCHamas officials claim terror group ready to hand over small weapons, rifles to Gazan police - NYT  The Jerusalem PostUS and Hamas hold first direct talks since Gaza truce as ceasefire process stalls  CNNHamas rebuffs ‘trap’ disarmament plan as Israeli violations stall ceasefire process  Middle East Eye"
2026-04-19,TOP_NEWS,Hormuz Shipping Traffic Grinds to a Halt as Tensions Deepen - Bloomberg.com,"Hormuz Shipping Traffic Grinds to a Halt as Tensions Deepen  Bloomberg.comDistress call captures tanker under fire, Iran shuts Hormuz trapping thousands of sailors  Fox NewsIndia flags 'deep concerns' over attack on two Indian ships in Strait of Hormuz  ReutersTrump’s ‘Victory’ Brags Go Up in Smoke as Ships Come Under Attack  The Daily BeastShips Attacked in Strait of Hormuz as Iran Declares Strict Control of Vital Shipping Route  The New York Times"
2026-04-19,TOP_NEWS,Blue Origin successfully reused its New Glenn rocket - The Verge,"Blue Origin successfully reused its New Glenn rocket  The VergeIn its third flight, a Blue Origin New Glenn rocket puts satellite payload into wrong orbit  CBS NewsBlue Origin launch recap: Live updates from AST SpaceMobile mission in Florida  Florida TodayNG-3 | Missions  Blue OriginBlue Origin lands reused New Glenn rocket booster for first time, ratcheting up SpaceX rivalry  Yahoo"
2026-04-19,TOP_NEWS,Markets shudder as Strait of Hormuz starts resembling a combat zone. 'We're prepared to subject you to disabling fire' - Fortune,"Markets shudder as Strait of Hormuz starts resembling a combat zone. 'We're prepared to subject you to disabling fire'  FortuneTraders Brace for Renewed Turmoil on Hormuz Standoff  Bloomberg.comMarket Alert: Morgan Stanley Advises Reducing Exposure to Emergi  GuruFocusEUR/USD, GBP/USD Hormuz shut again as traders await latest peace pivot  FOREX.comHormuz Reblockade Rattles Markets; SK hynix Earnings in Focus  Seoul Economic Daily"
2026-04-19,TOP_NEWS,The next Mac Studio and MacBook Pro releases could be postponed by several months - Engadget,"The next Mac Studio and MacBook Pro releases could be postponed by several months  EngadgetThe Mystery of Why You Can’t Buy a Mac Mini Right Now  WSJApple's major MacBook Pro overhaul is reportedly 'slightly' delayed due to supply chain shortages  9to5MacMac Mini disappears from store shelves in the US, and the reason is the same that drove up prices of second-hand MacBooks in China  The Times of India5+ Things to Know About the Next Mac Studio  MacRumors"
2026-04-19,TOP_NEWS,WWDC 2026 Graphic Teases Major iOS 27 Feature - MacRumors,"WWDC 2026 Graphic Teases Major iOS 27 Feature  MacRumorsApple’s Revamped Siri Interface in iOS 27 Is Hidden in WWDC Teaser  Bloomberg.com4 New Apple Intelligence Features Found in Apple Code, Likely in iOS 27  MacRumorsThe Harsh Glare in the Apple WWDC 26 Logo Is Teasing the Look of New Siri, Report Says  GizmodoGurman: Apple WWDC teaser signals Siri reboot as Mac launches face delays (AAPL:NASDAQ)  Seeking Alpha"
2026-04-19,TOP_NEWS,Massive Intel Nova Lake leak reveals multiple chips with copious amounts of cache - Notebookcheck,"Massive Intel Nova Lake leak reveals multiple chips with copious amounts of cache  NotebookcheckIntel Core Ultra 400D/400DX ""Nova Lake-S"" SKUs to feature up to 288MB of cache  VideoCardz.comIntel’s Answer to AMD X3D Leaked: Nova Lake “bLLC” CPUs Pack Up To 38% More Cache Than Ryzen 9950X3D2  WccftechIntel's Nova Lake CPUs gear up to seize AMD’s 3D V-Cache gaming throne — early leak points to up to 52 cores, blazing DDR5-8000 support, and massive 175W TDP  Tom's HardwareIntel ""Crescent Island"" Xe3P to Skip Arc Gaming GPUs, Focus on Workstations  TechPowerUp"
2026-04-19,TOP_NEWS,Pragmata On Consoles: Fine on PS5/Series X - But PS5 Pro Is The Best Way To Play - Digital Foundry,"Pragmata On Consoles: Fine on PS5/Series X - But PS5 Pro Is The Best Way To Play  Digital FoundryAn Uncanny ‘Sad Dad’ Game With a Robot Child  The New York TimesPragmata Launch: Glowing Reviews and Chart-Topping Sales but Mediocre Player Counts  TechPowerUpPragmata Review  IGNPragmata's tale of AI slop, humanity, & lunar conquest makes it the timeliest sci-fi game of the year  Space"
2026-04-19,TOP_NEWS,Brock Lesnar appears to stunningly retire from WWE after WrestleMania 42 loss - New York Post,"Brock Lesnar appears to stunningly retire from WWE after WrestleMania 42 loss  New York PostRoman Reigns triumphs over CM Punk to win the World Heavyweight Title at WrestleMania 42  WWEOba Femi conquers ‘The Beast Incarnate,’ Brock Lesnar signals WWE retirement at WrestleMania 42  Fox NewsBrock Lesnar's emotional exit at WrestleMania 42 hints at retirement  Asbury Park PressFormer Alabama athlete, SEC champion to headline WWE's 'WrestleMania'  Roll Tide Wire"
2026-04-19,TOP_NEWS,Eddie Murphy Receives AFI Life Achievement Award In Star-Studded Ceremony With Laughs And Heart - Deadline,"Eddie Murphy Receives AFI Life Achievement Award In Star-Studded Ceremony With Laughs And Heart  DeadlineEddie Murphy receives life achievement award by AFI, drawing standing ovation at star-filled tribute  AP News‘SNL’ Star Channels Most Famous Character to Honor Eddie Murphy  The Daily BeastMike Myers showed up in full Shrek makeup to pay tribute to Eddie Murphy and it was perfect  USA TodayCelebrity Photos Updated Daily: Dave Chappelle, Eddie Murphy, Mike Myers and More  People.com"
2026-04-19,TOP_NEWS,Obamas' Higher Ground Will Go Independent After Netflix Deal - The Hollywood Reporter,Obamas' Higher Ground Will Go Independent After Netflix Deal  The Hollywood ReporterBarack & Michelle Obama’s Higher Ground To Go Independent After 8 Years At Netflix  DeadlineBarack and Michelle Obama's film production company reportedly leaving Netflix to go independent  Fox NewsHigher Ground Production Company Shifts to Independent Model from Netflix  HarianBasis.coBarack & Michelle Obama Will End Their Movie & TV Partnership With Netflix This Year  | Cord Cutters News
2026-04-19,TOP_NEWS,"Phoenix Suns vs. Oklahoma City Thunder Live Score and Stats - April 19, 2026 Gametracker - CBS Sports","Phoenix Suns vs. Oklahoma City Thunder Live Score and Stats - April 19, 2026 Gametracker  CBS SportsOklahoma City Thunder dominant in opener, rout Phoenix Suns  ESPNThunder's second straight dominant Game 1 win puts them in elite company alongside Showtime Lakers  Yahoo SportsGilgeous-Alexander, Oklahoma City dominate Phoenix Suns in Game 1 win  The Arizona RepublicThunder vs. Suns odds, prediction, time: 2026 NBA playoff picks, April 19 best bets by proven model  CBS Sports"
2026-04-19,TOP_NEWS,"Dexter Lawrence: I know Bengals gave up a lot for me, and I don’t take that for granted - NBC Sports","Dexter Lawrence: I know Bengals gave up a lot for me, and I don’t take that for granted  NBC SportsBengals sign DT Dexter Lawrence to one-year, $28M extension  ESPNDexter Lawrence has 'fire in me that I've never had before' after Giants trade him to Bengals  Fox News2026 NFL Draft gets massive shakeup after Dexter Lawrence trade: How the top 10 could now unfold  CBS SportsBengals’ pick gives Giants ammunition to move up  NBC Sports"
2026-04-19,TOP_NEWS,"The Little Probe That Could: Why Voyager 1 Matters, and Why NASA Just Switched Part of It Off - NPR","The Little Probe That Could: Why Voyager 1 Matters, and Why NASA Just Switched Part of It Off  NPRNASA Shuts Off Instrument on Voyager 1 to Keep Spacecraft Operating  NASA Science (.gov)Hackaday Links: April 19, 2026  HackadayMission engineers at NASA’s Jet Propulsion Laboratory in Southern California turned off the Low-energy Charged Particles experiment aboard Voyager 1 on April 17th, 2026. (NASA/JPL-Caltech)  Clarksville OnlineNASA powers down Voyager 1 instrument to extend mission lifespan  primetimer.com"
2026-04-19,TOP_NEWS,NASA Artemis II’s Christina Koch Reveals 3 Career Rules She Swears By - Forbes,"NASA Artemis II’s Christina Koch Reveals 3 Career Rules She Swears By  ForbesChristina Koch Says She's Recovering From Major Physical Change After Artemis II  YahooWhat Christina Koch Said About Leaving Earth Is Hitting People Hard  Men's Journal‘Your hearts lifted ours’: NC State alum Christina Koch discusses impact of Artemis II moon mission  WRAL""It Helped Me Turn Fear into Focus"": How Climbing Prepared Christina Koch for the Moon  Outside Magazine"
2026-04-19,TOP_NEWS,"Largest-ever 3D map of the universe shows 47 million galaxies, from the Milky Way to 'cosmic noon' - Live Science","Largest-ever 3D map of the universe shows 47 million galaxies, from the Milky Way to 'cosmic noon'  Live ScienceView Full Coverage on Google News"
