date,source,title,description
2025-05-10,TOP_NEWS,India and Pakistan accuse each other of violating ceasefire hours after reaching deal - NPR,"India and Pakistan accuse each other of violating ceasefire hours after reaching deal  NPRIndia and Pakistan agree to a ceasefire, but will it hold? Here’s what to know  CNNDonald Trump's Mediation Offer To India, Pak Hours After Ceasefire Agreement  NDTVHow India’s partition in 1947 led to the strife over Kashmir today  The Washington PostTrump Announces Cease-Fire Between India and Pakistan: Live Updates  The New York Times"
2025-05-10,TOP_NEWS,World Catholics See the First American Pope as Hardly American - The New York Times,World Catholics See the First American Pope as Hardly American  The New York TimesSaint Joseph Cathedral in Manchester holds Mass to celebrate selection of new pope  WMURLeo XIV: The modest missionary in Peru who became the first American pope  The Washington PostHow Pope Leo became a beloved Peruvian figure  NBC NewsPope Leo XIV's family tree shows Black roots in New Orleans  ABC News
2025-05-10,TOP_NEWS,Trump Admin Accuses Dem of ‘Assaulting an ICE Agent’ at Newark Detention Center - Rolling Stone,"Trump Admin Accuses Dem of ‘Assaulting an ICE Agent’ at Newark Detention Center  Rolling StoneICE facility Democrats 'stormed' holds child rapists, murderers: officials  Fox NewsTrump news at a glance: Newark mayor Ras Baraka takes on Trump administration over immigration  The GuardianMembers of Congress Break into Delaney Hall Detention Center  Homeland Security (.gov)Homeland Security Dept. accuses lawmakers of ‘storming’ an ICE facility despite oversight laws saying they could be there  CNN"
2025-05-10,TOP_NEWS,Trump team mulls suspending the constitutional right of habeas corpus to speed deportations. Can it? - AP News,"Trump team mulls suspending the constitutional right of habeas corpus to speed deportations. Can it?  AP NewsWhat is habeas corpus, the legal procedure Trump is considering suspending?  CNNTop White House adviser Stephen Miller says 'we're actively looking at' suspending due process for migrants  NBC NewsWhat does ‘habeas corpus’ mean, and can President Trump suspend it?  ABC27Toobin: Suspending habeas corpus would be ‘such a wild step’  The Hill"
2025-05-10,TOP_NEWS,4.1 magnitude earthquake in Tennessee rattles homes as far away as Atlanta - PBS,4.1 magnitude earthquake in Tennessee rattles homes as far away as Atlanta  PBS4.1 magnitude earthquake felt across East Tennessee  WVLTTennessee earthquake: Will there be an aftershock? Check the prediction  Knoxville News SentinelDid you feel that? Earthquake rocks Asheville and Western North Carolina  The Asheville Citizen TimesPart of Foothills Parkway closed for inspection after earthquake near Greenback  WATE 6 On Your Side
2025-05-10,TOP_NEWS,Authorities arrest over 100 people on Tennessee roads in support of Trump’s deportation plan - CNN,"Authorities arrest over 100 people on Tennessee roads in support of Trump’s deportation plan  CNNNashville mayor signs executive order after more than 100 people detained by ICE  Https://Www.Wsmv.ComICE: MS-13, Tren De Aragua arrests made, Nashville Mayor demands proof  WZTVICE detains 94 immigrants from THP traffic stops  Nashville BannerNew Jersey Senator Cory Booker, Nashville leaders speak out on ICE arrests at local town hall  The Tennessean"
2025-05-10,TOP_NEWS,"Trump aims for ‘historic return’ to region, taking in Saudi Arabia, Qatar, UAE, not Israel - The Times of Israel","Trump aims for ‘historic return’ to region, taking in Saudi Arabia, Qatar, UAE, not Israel  The Times of IsraelOpinion | This Israeli Government Is Not Our Ally  The New York TimesArab countries hope for big US business amid Gaza war  DWGulf diplomatic sources debate if Trump will announce US recognition of Palestinian state  The Jerusalem PostTrump Travels to the Middle East  The Atlantic"
2025-05-10,TOP_NEWS,Boomers can't afford assisted living and are weighing on the housing market - Fortune,Boomers can't afford assisted living and are weighing on the housing market  Fortune
2025-05-10,TOP_NEWS,"Summer could be about to get a lot more expensive, thanks to tariffs - The Washington Post","Summer could be about to get a lot more expensive, thanks to tariffs  The Washington Post'I freaked out and spent $400 online': US consumers on cheap shipping changes  BBC""It's Real Y'all"": People Are Sharing Their Tariff Receipts, And My Wallet Is Not Ready For What's Coming  YahooTrump’s trade war is about to change the way you shop  CNNTariffs Are Starting to Raise Prices. More Increases Could Come in Waves.  Barron's"
2025-05-10,TOP_NEWS,"Doom: The Dark Ages, 36 GPU Benchmark - TechSpot","Doom: The Dark Ages, 36 GPU Benchmark  TechSpotDoom: The Dark Ages Review  IGN‘Doom: The Dark Ages’ has problems but also some great demon killing  The Washington PostDoom: The Dark Ages review – id Software gets medieval in a dramatic rewrite of the shooter’s rules  The GuardianGet ready for DOOM: The Dark Ages with our Pre-Launch Checklist  Bethesda.net"
2025-05-10,TOP_NEWS,SoundCloud says it isn’t using your music to train generative AI tools - The Verge,SoundCloud says it isn’t using your music to train generative AI tools  The VergeSoundCloud faces backlash after adding an AI training clause in its user terms  Fast CompanySoundCloud Says It “Has Never Used Artist Content to Train AI Models” After Backlash on Terms of Service Change  The Hollywood ReporterSoundCloud changes policies to allow AI training on user content  TechCrunchSoundcloud addresses terms of use that say it has the right to train AI with users' music  AV Club
2025-05-10,TOP_NEWS,Giant Bomb Has Been Sold To Giant Bomb - aftermath.site,Giant Bomb Has Been Sold To Giant Bomb  aftermath.siteView Full Coverage on Google News
2025-05-10,TOP_NEWS,Magic: The Gathering team dives deep into its stunning Final Fantasy set in 2-hour showcase - Polygon,"Magic: The Gathering team dives deep into its stunning Final Fantasy set in 2-hour showcase  PolygonExclusive: Five 'Magic: The Gathering – FINAL FANTASY' Card Reveals  hypebeast.comMagic: The Gathering – Final Fantasy PAX East Panel: See The Revealed Cards Now  GameSpotFinal Fantasy Preview | PAX May 10th  MTG Arena ZonePAX East: Magic: the Gathering - Final Fantasy Reveals Cards From Each Mainline Game, Included A Serialized Gold Chocobo  MMORPG.com"
2025-05-10,TOP_NEWS,"Box Office: ‘Thunderbolts*’ on Top Again in Second Weekend, ‘Sinners’ Crossing $200 Million Domestic - Variety","Box Office: ‘Thunderbolts*’ on Top Again in Second Weekend, ‘Sinners’ Crossing $200 Million Domestic  Variety‘Thunderbolts*’ Striking $35M 2nd Weekend; ‘Sinners’ Strong $20M For 4th Frame – Box Office Update  Deadline'Thunderbolts*' is an unwieldy jumble, and also the best Marvel film in a while  NPR‘Thunderbolts*’ still shaking up the box office  New York PostBox Office Update: Thunderbolts has a better second-weekend hold than recent Marvel movies  JoBlo"
2025-05-10,TOP_NEWS,Tom Cruise Makes Rare Comment About Ex Nicole Kidman - Yahoo,"Tom Cruise Makes Rare Comment About Ex Nicole Kidman  YahooTom Cruise Praises Nicole Kidman, Pays Tribute To Val Kilmer, Lauds Movie Greats Jack Nicholson And Marlon Brando  DeadlineTom Cruise Makes Rare Comments About Ex Nicole Kidman  People.comTom Cruise praises ex-wife Nicole Kidman in rare comments as romance rumors with Ana de Armas heat up  Fox NewsTom Cruise makes rare comment about ex-wife Nicole Kidman in revealing new interview  New York Post"
2025-05-10,TOP_NEWS,"Sean Combs Trial: Celeb Names, Nerves, and a Delayed Jury - Rolling Stone","Sean Combs Trial: Celeb Names, Nerves, and a Delayed Jury  Rolling StoneSean ‘Diddy’ Combs timeline: The key events and allegations against the hip-hop mogul now on trial  CNNA music executive says women forced to pick 'survival' over consent in music industry  NPRSean Combs' lawyer says rapper admits to 'domestic violence' in relationship  YahooMissing key witness cripples Diddy prosecution as trial hits roadblocks before it begins: expert  Fox News"
2025-05-10,TOP_NEWS,"Derek Carr retires, thanks New Orleans Saints for opportunity to live out 'childhood dream' - New Orleans Saints","Derek Carr retires, thanks New Orleans Saints for opportunity to live out 'childhood dream'  New Orleans SaintsDerek Carr retires: Who will start now? What's his legacy?  ESPNFans react to Derek Carr's shocking retirement  YahooKellen Moore declares open QB competition among Tyler Shough, Jake Haener, Spencer Rattler  NBC SportsDerek Carr left $30 million on table to retire from Saints — and what he got in return  New York Post"
2025-05-10,TOP_NEWS,Soviet-era Venus probe plunges back to Earth after 53 years - DW,Soviet-era Venus probe plunges back to Earth after 53 years  DWKosmos 482: Soviet-era spacecraft 'likely' to have re-entered Earth's atmosphere  BBCFailed Soviet Venus lander Kosmos 482 crashes to Earth after 53 years in orbit  SpaceSoviet Spacecraft Crash Lands on Earth After a Journey of Half a Century  The New York TimesA Venus probe will fall to Earth this week — here's how Aerospace is tracking it  The Aerospace Corporation
2025-05-10,TOP_NEWS,SpaceX launches 28 Starlink satellites to orbit from Florida (video) - Space,"SpaceX launches 28 Starlink satellites to orbit from Florida (video)  SpaceSpaceX now targeting early morning Monday Falcon 9 rocket launch from Cape Canaveral, Florida  Florida TodaySpaceX launch 28 Starlink satellites on 470th Falcon 9 rocket launch  Spaceflight NowSpaceX Rocket Delivers 26 Starlink Satellites Into Orbit From Vandenberg  NoozhawkSpaceX launches 900th Starlink satellite of 2025 during Saturday morning flight  Spaceflight Now"
2025-05-10,TOP_NEWS,It's been one year since the most intense solar storm in decades created worldwide auroras. What have we learned? - Space,It's been one year since the most intense solar storm in decades created worldwide auroras. What have we learned?  SpaceWhat NASA Is Learning from the Biggest Geomagnetic Storm in 20 Years  NASA Science (.gov)Mainers remember stunning aurora borealis of 2024 as solar maximum continues in 2025  WGMEMost Intense Solar Storm in Decades: How Close Did Earth Come to a Global Crisis?  The Daily GalaxyNorthern lights dazzled Ozarks one year ago today  OzarksFirst.com
