date,source,title,description
2026-02-16,TOP_NEWS,"The U.S. ready to make up, Europe ready to break up in Munich - NPR","The U.S. ready to make up, Europe ready to break up in Munich  NPRWarmer words but relations remain frosty between the U.S. and its old friends in Europe  NBC NewsMarco Rubio Doesn’t Get It  The AtlanticThree American Speeches at Munich, and Plenty of Confusion  The New York Times5 takeaways from a tense Munich Security Conference  The Hill"
2026-02-16,TOP_NEWS,Epstein ranch in New Mexico bought by family of ‘Trump Republican’ candidate - The Guardian,Epstein ranch in New Mexico bought by family of ‘Trump Republican’ candidate  The GuardianNew Mexico approves comprehensive probe of Epstein’s Zorro Ranch  NBC NewsTexas businessman running for office owns Epstein's Zorro Ranch in Santa Fe County  Santa Fe New MexicanDon Huffines’ family bought Epstein's ranch after his death  The Texas TribuneTexas GOP politician Don Huffines says he'd cooperate with Zorro Ranch probe  Santa Fe New Mexican
2026-02-16,TOP_NEWS,Vaccine Makers Curtail Research and Cut Jobs - The New York Times,Vaccine Makers Curtail Research and Cut Jobs  The New York TimesView Full Coverage on Google News
2026-02-16,TOP_NEWS,"Aliens are ‘real,’ Obama says, as Washington shrugs - The Washington Post","Aliens are ‘real,’ Obama says, as Washington shrugs  The Washington PostObama clarifies alien comments after telling podcast ‘they’re real’  CNNObama clarifies views on aliens after saying 'they're real' on podcast  BBCObama says aliens are 'real.' Congress has heard about UFOs for years  USA TodayBarack Obama clarifies he's seen 'no evidence' of aliens after saying they're real  NBC News"
2026-02-16,TOP_NEWS,Rage. Grief. Anxiety. The New Mood in Iran. - The New York Times,"Rage. Grief. Anxiety. The New Mood in Iran.  The New York TimesPopular anger burns in Iran after crackdown, as Trump turns up pressure  The Washington PostNew photos give glimpse inside Iran’s bloody crackdown on anti-government protests  The GuardianTeachers’ Union Warns of Growing Security Presence in Iranian Schools  IranWireAn artist, a geophysicist and a fruit seller: Accounts of Iran's brutal crackdown emerge  NBC News"
2026-02-16,TOP_NEWS,"Citing Orwell’s ‘1984,’ judge orders Trump administration to return slavery exhibits removed from Philadelphia museum - CNN","Citing Orwell’s ‘1984,’ judge orders Trump administration to return slavery exhibits removed from Philadelphia museum  CNNTrump Live Updates: DHS Employees Work Without Pay Amid Partial Shutdown  The New York TimesJudge orders slavery exhibit to be restored after Trump administration removal  The Washington PostJudge orders slavery exhibit to be restored at the Presidents House  NBC10 PhiladelphiaJudge orders Trump admin to restore slavery exhibits at President's House Site  6abc Philadelphia"
2026-02-16,TOP_NEWS,2 killed and 3 injured in shooting at a Rhode Island high school hockey game - NBC News,"2 killed and 3 injured in shooting at a Rhode Island high school hockey game  NBC News2 killed, 3 hospitalized in Pawtucket ice rink shooting; suspect also dead  WPRI.com2 Victims Killed, 3 in Critical Condition After Shooting at Rhode Island High School Hockey Game  People.comShooting in stands at R.I. rink leaves 3 dead, others injured  ESPNPolice respond to reports of a shooting at a Rhode Island hockey rink  Yahoo"
2026-02-16,TOP_NEWS,How Maryland Democrats are thwarting Wes Moore’s political ambitions - Politico,"How Maryland Democrats are thwarting Wes Moore’s political ambitions  PoliticoHakeem Jeffries to Bill Ferguson: 'Allow democracy to prevail' on redistricting in Maryland  WBAL-TVAs redistricting clock ticks, state House speaker floats candidate filing deadline delay  Baltimore SunMoore's bitter Maryland fights weigh on push to '28  AxiosGov's 'working with judges’ remark fuels redistricting scrutiny after $147M court contract  WBFF"
2026-02-16,TOP_NEWS,"FBI won’t share Alex Pretti shooting evidence, Minnesota authorities say - The Guardian","FBI won’t share Alex Pretti shooting evidence, Minnesota authorities say  The GuardianHopes that the FBI would share evidence in Alex Pretti’s killing with state investigators have shattered  CNNFBI will not provide the BCA access to evidence gathered from Pretti shooting, BCA says  MPR NewsTrump administration formally denies Minnesota access to Alex Pretti evidence  Star TribuneAlex Pretti shooting: Minnesota BCA says FBI officially denied them access to evidence in case  FOX 9 Minneapolis-St. Paul"
2026-02-16,TOP_NEWS,"In Hungary, Marco Rubio Stresses Trump’s Support for Viktor Orban - The New York Times","In Hungary, Marco Rubio Stresses Trump’s Support for Viktor Orban  The New York TimesRubio lends hand to Hungary’s Orban as he faces tough election  The Washington PostSecretary Rubio Advances National Security Through Civil Nuclear Deals in Central Europe  U.S. Department of State (.gov)Rubio bolsters Hungary's far-right leader days after push to mend U.S. ties in Europe  PBSTrump is ‘deeply committed to your success’, Rubio tells Orbán during Hungary visit – as it happened  The Guardian"
2026-02-16,TOP_NEWS,Trump Brutally Mocked on Presidents Day With Satirical Floats at German Festival - TMZ,Trump Brutally Mocked on Presidents Day With Satirical Floats at German Festival  TMZView Full Coverage on Google News
2026-02-16,TOP_NEWS,Prediction: These 3 Stocks Will Crush the Market in 2026 - The Motley Fool,Prediction: These 3 Stocks Will Crush the Market in 2026  The Motley FoolView Full Coverage on Google News
2026-02-16,TOP_NEWS,Ford is asking the Trump Administration to allow Chinese EV tech in the US - Electrek,"Ford is asking the Trump Administration to allow Chinese EV tech in the US  ElectrekWhy the largest U.S. auto dealer isn't interested in Chinese cars — for now  CNBCFord CEO Farley, Trump administration discuss Chinese car making idea  Detroit Free PressFord CEO Jim Farley, Trump officials reportedly discussed U.S.-China carmaking joint ventures  Automotive NewsUS carmakers spooked by Chinese rivals gaining foothold in America  Financial Times"
2026-02-16,TOP_NEWS,Federal Reserve set to loosen US bank rules in attempt to boost mortgage lending - Financial Times,"Federal Reserve set to loosen US bank rules in attempt to boost mortgage lending  Financial TimesUS Banks to See New Mortgage Capital Requirements in Basel Plan  BloombergBasel capital rules may be revised to boost bank mortgage lending  HousingWireFed wants to help banks regain mortgage business to benefit revenue, relationships  InvestmentNewsFed's Bowman wants to boost banks' share of mortgage market  American Banker"
2026-02-16,TOP_NEWS,"Get ready for new Macs and iPads: Apple announces ""Special Experience"" on March 4 - Ars Technica","Get ready for new Macs and iPads: Apple announces ""Special Experience"" on March 4  Ars TechnicaApple’s doing something on March 4th  The VergeApple to Hold Product Launch on March 4 With Mac Updates Coming  BloombergApple Announces Special Event in New York, London, and Shanghai on March 4  MacRumorsApple launching 5+ new products over the next several weeks  9to5Mac"
2026-02-16,TOP_NEWS,"Switch 2 price, PS6 release could be impacted by memory shortage - Mashable","Switch 2 price, PS6 release could be impacted by memory shortage  MashableNintendo Switch 2 Price Hike Reportedly Coming – PS6 May Be Delayed to 2029  VICESwitch 2 pricing and next PlayStation release could be impacted by memory shortage  The VergePS6 Plans Reportedly Thrown Into Uncertainty By AI Hardware Demand  GameSpotNintendo can't seem to decide if it will raise Switch 2 prices  Polygon"
2026-02-16,TOP_NEWS,More leaked Galaxy Buds 4 images show Samsung is going back to basics - 9to5Google,More leaked Galaxy Buds 4 images show Samsung is going back to basics  9to5GoogleLeaked Samsung animation confirms Galaxy Buds 4 Pro redesign  SamMobileSamsung Galaxy Buds 4 Pro surfaces in Tips app with handy upgrade  Sammy FansHere's another look at the Galaxy Buds4 and Buds4 Pro ahead of launch next week - GSMArena.com news  GSMArena.comSamsung Pulls Galaxy Buds 3 From US Store Ahead Of Unpacked  findarticles.com
2026-02-16,TOP_NEWS,Unity says its AI tech will soon eliminate the need for coding - Game Developer,Unity says its AI tech will soon eliminate the need for coding  Game DeveloperUnity's CEO Just Explained Why Google's AI Can't Replace Game Engines (And He's Right)  The Motley FoolEngine Maker Unity Focusing on “AI-Driven Authoring” to Allow Devs to “Prompt Full Casual Games Into Existence”  WccftechGame Makers Turn to AI to Cut Costs and Boost Productivity  KoreabizwireUnity wants to give developers AI tools that will create entire games from ordinary prompts  IXBT.games
2026-02-16,TOP_NEWS,"WWE RAW Spoiler Lineup for February 16, 2026: Full Match Card and Backstage Notes Revealed - Ringside News","WWE RAW Spoiler Lineup for February 16, 2026: Full Match Card and Backstage Notes Revealed  Ringside NewsRaw preview, Feb. 16, 2026: Je’Von Evans, Gunther, and Dominik Mysterio battle in a Men's Elimination Chamber Qualifier  WWEWWE Raw live results (Feb. 16): Updates, grades and highlights tonight from Memphis  Yahoo SportsMonday Night Raw tonight, WWE Raw start time tonight, Raw preview  Asbury Park PressWWE Raw Results, Winners, Live Grades, Reaction, Highlights From Feb. 16  Bleacher Report"
2026-02-16,TOP_NEWS,FCC finds no violations in Bad Bunny halftime show - NBC Sports,FCC finds no violations in Bad Bunny halftime show  NBC SportsFCC Reaches Final Decision On Bad Bunny's Halftime Show  YahooInvestigation clears Bad Bunny Super Bowl show of rule violation  Euronews.comRepublican Congressman Calls for Investigation Into Bad Bunny Halftime Show  Time MagazineTrump vs Bad Bunny: A Super Bowl feud with possible midterm consequences  Reuters
