date,source,title,description
2026-06-19,TOP_NEWS,"Italy's Meloni, once Trump's closest ally in Europe, says he made up a story about her - NPR","Italy's Meloni, once Trump's closest ally in Europe, says he made up a story about her  NPRItaly Doesn’t ‘Beg,’ Giorgia Meloni Tells Trump  The New York TimesTrump ‘totally fabricated’ claim she begged him for a photo, Italy’s Giorgia Meloni says  NBC NewsItaly’s prime minister says Trump made up a story about her supposedly begging him for something. She wouldn’t be the first  CNNTrump doubles down on criticism of Italy’s Meloni: ‘She was a big fan’  The Hill"
2026-06-19,TOP_NEWS,Israeli official spurns call for truce: ‘All of Lebanon must burn’ - The Hill,"Israeli official spurns call for truce: ‘All of Lebanon must burn’  The HillLebanon says Israeli strikes kill 47 as Israel says four soldiers killed by Hezbollah  BBCLebanese villagers return to find homes in ruins  ReutersU.S.-Iran talks postponed and Vance cancels trip after Israeli strikes in Lebanon  NBC10 PhiladelphiaIDF tank battalion commander, three other soldiers killed in Hezbollah attack in south Lebanon  The Times of Israel"
2026-06-19,TOP_NEWS,"New images show murder weapon, fatal injury in Texas high school track meet stabbing of Austin Metcalf - Fox News","New images show murder weapon, fatal injury in Texas high school track meet stabbing of Austin Metcalf  Fox NewsNewly released images show Karmelo Anthony at murder scene before & after stabbing  KBOIKarmelo Anthony on track near Austin Metcalf stabbing  YahooWATCH: Karmelo Anthony trial evidence released by Collin County judge  FOX 4 News Dallas-Fort WorthGrisly photos released of Karmelo Anthony’s victim Austin Metcalf’s wound, a bloody coat and murder weapon  New York Post"
2026-06-19,TOP_NEWS,Trump Shifts Stance in South Carolina After Losses in Governor’s Races - The New York Times,"Trump Shifts Stance in South Carolina After Losses in Governor’s Races  The New York TimesTrump now says either Republican candidate would be a good pick in South Carolina’s governor runoff  PoliticoAfter recent losing endorsements, Donald Trump hedges his bet in South Carolina governor’s race  CNNTrump co-endorses Alan Wilson in SC governor’s race, dealing major blow to Pamela Evette  Post and CourierTrump announces co-endorsement of Wilson, Evette ahead of June 23 runoff  WIS News 10"
2026-06-19,TOP_NEWS,Flu sickens scores of troops at Air Force base after Pentagon ends vaccine requirement - NBC News,"Flu sickens scores of troops at Air Force base after Pentagon ends vaccine requirement  NBC NewsScores Fall Ill at Air Force Base After Hegseth Makes Flu Vaccine Optional  The New York TimesOpinion | Pete Hegseth’s reckless vaccine policy backfires with flu outbreak  The Washington Post150+ recruits test positive for influenza as outbreak hits JBSA-Lackland, reports say  KSATFlu outbreak among Air Force recruits at Joint Base San Antonio after Hegseth ends mandatory flu vaccine  ABC News - Breaking News, Latest News and Videos"
2026-06-19,TOP_NEWS,"Woman killed, 1,700 evacuated in beach hotel fire in Dominican Republic - Reuters","Woman killed, 1,700 evacuated in beach hotel fire in Dominican Republic  ReutersSee more headlines & perspectives on Google News"
2026-06-19,TOP_NEWS,Starmer vows to fight as Burnham’s election win fuels a Labour leadership showdown - AP News,"Starmer vows to fight as Burnham’s election win fuels a Labour leadership showdown  AP NewsBurnham Wins Makerfield By-Election, Clearing Path to Challenge Starmer as UK Prime Minister  The New York TimesBritain’s Next Leader Has Emerged  The AtlanticHe Quit Parliament. Now He’s Set to Become Britain’s Prime Minister.  PoliticoReform’s genius plan is finally coming into view: field terrible candidates then lose | Marina Hyde  The Guardian"
2026-06-19,TOP_NEWS,Why are Moscow’s air defenses struggling to stop drone attacks? And why are oil refineries so vulnerable to Ukrainian strikes? - Meduza,"Why are Moscow’s air defenses struggling to stop drone attacks? And why are oil refineries so vulnerable to Ukrainian strikes?  MeduzaMassive blasts in Moscow shatter even Putin’s protective shell  CNNRussian Offensive Campaign Assessment, June 18, 2026  Institute for the Study of War‘Game Changer’? Too Soon to Tell. But Ukraine Flexed in Striking Moscow.  The New York TimesMoscow refinery ablaze as Ukraine launches biggest attack on Russian capital in years  NBC News"
2026-06-19,TOP_NEWS,The Trump administration says it is cutting student loan interest. Not everyone qualifies. - CBS News,The Trump administration says it is cutting student loan interest. Not everyone qualifies.  CBS NewsRates on New Student Loans Will Rise on July 1  The New York TimesStudent-loan borrowers can act now to become eligible for a new repayment benefit  Business InsiderUS student debt repayment system is being overhauled – here’s what to know  The GuardianEducation Department cuts student loan interest rate  The Hill
2026-06-19,TOP_NEWS,"Exclusive: Trump tells ""The Axios Show"" that Anthropic was a national security threat - Axios","Exclusive: Trump tells ""The Axios Show"" that Anthropic was a national security threat  Axios'They’re politically naive': The political fight behind Anthropic’s export controls  PoliticoAI has granted America vast new power  The EconomistTrump tells Axios he no longer views Anthropic as a national security threat  CNBCAnthropic Has the Template for Fixing Its Mythos Nightmare  Bloomberg.com"
2026-06-19,TOP_NEWS,'Exactly how the dot-com bubble burst': A market research firm says keep an eye on this AI warning sign - Business Insider,"'Exactly how the dot-com bubble burst': A market research firm says keep an eye on this AI warning sign  Business InsiderTech Stocks Are Cheap? That’s a Problem Too.  Barron'sAI and tech groups not in ‘a bubble situation’, says Schroders CIO  Financial TimesLessons from the Original Tech Bubble  The New YorkerAI and Your Money: Opportunity, Innovation, or the Next Market Bubble?  Hawaii Business Magazine"
2026-06-19,TOP_NEWS,SpaceX stock price drops after Cursor purchase. How low could it go? - Mashable,"SpaceX stock price drops after Cursor purchase. How low could it go?  MashableThe average SpaceX buyer post-IPO is almost under water after two-day slide  CNBCSpaceX IPO, Peace Hopes Fuel Rally in Asia Stock Markets  Bloomberg.comSpaceX’s plan: Put all the data centers in space, then profit  The Washington PostSpaceX (SPCX) Is Up 14.9% After Record IPO And $60 Billion Cursor AI Deal - What's Changed  Yahoo Finance"
2026-06-19,TOP_NEWS,Nothing cancels this year’s CMF phone due to RAM prices - The Verge,"Nothing cancels this year’s CMF phone due to RAM prices  The Verge‘We can't build a phone that feels like a genuine step forward’: Nothing scraps the CMF Phone 3 Pro and says the RAM crisis is making budget phones impossible to produce  TechRadarNothing CMF Phone is a RAMageddon casualty, memory now the most expensive component  9to5GoogleSmartphones Market Is Getting 15% Shrink In 2026 — Here Is the AI Memory Crisis Behind It  MemeburnRAM ruins a Pro: Nothing says no CMF Phone 3 Pro to avoid ridiculous pricing  Android Central"
2026-06-19,TOP_NEWS,Unpatchable 'usbliter8' Exploit Breaks Apple A12 and A13 SecureROM Boot Chain - The Hacker News,Unpatchable 'usbliter8' Exploit Breaks Apple A12 and A13 SecureROM Boot Chain  The Hacker NewsNew unpatchable exploit targets Apple devices with A12 and A13 chips  9to5MacOlder iPhones are vulnerable to a flaw Apple likely can’t fix  MashableApple users told to watch out for 'unpatchable' iPhone security issues - here's what we know  TechRadarResearchers uncover an unpatchable security flaw affecting several iPhone generations - GSMArena.com news  GSMArena.com
2026-06-19,TOP_NEWS,Here's why Apple is already dropping support for so many watches in watchOS 27 - GSMArena.com news - GSMArena.com,"Here's why Apple is already dropping support for so many watches in watchOS 27 - GSMArena.com news  GSMArena.com'It’s the most convenient way to interact with Siri': I asked Apple's senior watchOS team how to use the new Siri AI assistant on an Apple Watch, and why it's not coming to so many older models  TechRadarwatchOS 27 adds new Apple Watch trick that I’ve been loving  9to5MacApple Is Leaving Its First Apple Watch Ultra in the Dust  GizmodoSiri AI leaves older Apple Watches behind without a clear reason  AppleInsider"
2026-06-19,TOP_NEWS,"Bunnie Xo opens up about Jelly Roll divorce filing, says decision wasn’t ‘mutual’ - WKRN News 2","Bunnie Xo opens up about Jelly Roll divorce filing, says decision wasn’t ‘mutual’  WKRN News 2Jelly Roll 'Will Always Love' Bunnie Xo Despite Divorce but 'He's in a Very Different Place' Now: Source (Exclusive)  People.comBunnie Xo says Jelly Roll's daughter is 'mad' at them about divorce  YahooJelly Roll Calls Out Cheating Rumors Amid Bunnie Xo Divorce: ‘My Best Friend Forever’  Rolling StoneGrammy Winner, 41, Breaks Silence on Shock Divorce  The Daily Beast"
2026-06-19,TOP_NEWS,"Winners & Losers: Netflix Knifes the Duffer Brothers, ‘Supergirl’ Wows Influencers - The Hollywood Reporter","Winners & Losers: Netflix Knifes the Duffer Brothers, ‘Supergirl’ Wows Influencers  The Hollywood ReporterNetflix Cancels Duffer Brothers’ ‘The Boroughs’ After One Season  The New York TimesDuffer Brothers’ Series ‘The Boroughs’ Canceled By Netflix After One Season  DeadlineGeena Davis Found the “Perfect” Role in ‘The Boroughs’ — Then Netflix Canceled It  The Hollywood ReporterHey, ‘The Boroughs’: Canceled shows can still win Emmys — just ask ‘Étoile’ and ‘Pushing Daisies’  Gold Derby"
2026-06-19,TOP_NEWS,"Box Office: ‘Toy Story 5’ Opens to $17.5 Million, Best Preview Performance of 2026 - Variety","Box Office: ‘Toy Story 5’ Opens to $17.5 Million, Best Preview Performance of 2026  Variety‘Toy Story 5’ Review: The Machines Have Come for the Children  The New York TimesWhat happened in each 'Toy Story' movie? A complete recap as 'Toy Story 5' lands in theaters.  YahooIt's toys vs. tech in 'Toy Story 5.' Here are 4 ways to keep tech in check this summer  NPR‘Toy Story’ Confronts a Nightmare of Modern Parenting  The Atlantic"
2026-06-19,TOP_NEWS,UFC Freedom 250 ratings explained: Understanding what the White House numbers mean — and what they don't - Yahoo Sports,"UFC Freedom 250 ratings explained: Understanding what the White House numbers mean — and what they don't  Yahoo SportsUFC Freedom 250 at White House averages 7M viewers in U.S.  ESPNDid UFC Freedom 250 event at White House get Super Bowl-type numbers?  USA TodayUFC White House Card Averages 8 Million Viewers on Paramount+ in U.S., Latin America  The Hollywood ReporterUFC Freedom 250 audience fell a little short of the Super Bowl  NBC Sports"
2026-06-19,TOP_NEWS,"The Sun may not engulf Earth after all, scientists say - Phys.org","The Sun may not engulf Earth after all, scientists say  Phys.orgComplex life on Earth may last 500 million years longer than expected  New ScientistThe real reason Earth escapes the dying sun gravity  The News InternationalEarth may not be swallowed up by dying sun after all, say Belgian researchers  The Brussels TimesGood news—we have extra time before the Sun ends life on Earth  Ars Technica"
