date,source,title,description
2025-06-04,TOP_NEWS,Restricting The Entry of Foreign Nationals to Protect the United States from Foreign Terrorists and Other National Security and Public Safety Threats - The White House (.gov),"Restricting The Entry of Foreign Nationals to Protect the United States from Foreign Terrorists and Other National Security and Public Safety Threats  The White House (.gov)Trump issues new travel ban covering a dozen countries  NPRTrump announces new travel restrictions on 19 countries, including 12 outright bans  NBC NewsTrump administration reinstates and expands travel ban  The Washington PostTrump announces travel ban affecting a dozen countries set to go into effect Monday  Yahoo"
2025-06-04,TOP_NEWS,'KILL the BILL': Elon Musk continues to blast Trump's bill in barrage of social media posts - ABC News,"'KILL the BILL': Elon Musk continues to blast Trump's bill in barrage of social media posts  ABC NewsTrump Is Losing Patience With Musk’s Outbursts Over Megabill  WSJThe White House’s fuzzy math is starting to haunt the ‘Big, Beautiful Bill’  CNNMusk whips opposition to Trump tax plan: 'KILL the BILL'  CNBCMusk, hardline US Republicans ramp up attacks on Trump tax and spending bill  Reuters"
2025-06-04,TOP_NEWS,Judge bars Trump administration from deporting family of Boulder attack suspect - The Washington Post,Judge bars Trump administration from deporting family of Boulder attack suspect  The Washington PostJudge Blocks Deportation of Family of Suspect in Colorado Attack  The New York TimesBiden-appointed judge blocks deportation of Boulder attack suspect's family despite visa violations  Fox NewsJudge issues order stopping deportation of Boulder suspect’s family  KDVRBoulder attack renews safety concerns for US Jewish communities  BBC
2025-06-04,TOP_NEWS,Trump administration eyes stripping Columbia's accreditation - BBC,"Trump administration eyes stripping Columbia's accreditation  BBCEducation Department says Columbia doesn’t meet accreditation standards  The Washington PostTrump Escalates Attack on Columbia University by Threatening Its Accreditation  The New York TimesTrump admin claims Columbia violated Jewish students' rights, threatens school's accreditation  NBC NewsColumbia failed to meet accreditation standards, US government says  Reuters"
2025-06-04,TOP_NEWS,Washington State Man Arrested on Federal Charges Alleging He Provided Material Support to Palm Springs Fertility Clinic Bomber - Department of Justice (.gov),"Washington State Man Arrested on Federal Charges Alleging He Provided Material Support to Palm Springs Fertility Clinic Bomber  Department of Justice (.gov)Palm Springs accomplice fled to Europe after supplying ingredient for bomb, feds say  Los Angeles TimesFBI arrests man who allegedly aided Palm Springs clinic bomber  LAistMan, 32, arrested in deadly Palm Springs clinic bombing: What we know  KTLAPalm Springs explosion: Daniel Park arrested for link to fertility clinic explosion  ABC7 Los Angeles"
2025-06-04,TOP_NEWS,"Outside of NYC, near-zero awareness about tonight’s debate - Politico","Outside of NYC, near-zero awareness about tonight’s debate  PoliticoNYC Mayoral Debate 2025: Live Updates, Video and Analysis  The New York TimesN.Y.C. mayoral debate recap: Democrats talk immigration and Trump; Andrew Cuomo fights attacks  NBC NewsWhat time is tonight's NYC Democratic mayoral primary debate? Details to know  NBC New YorkNYC Democratic primary mayor debate live updates: Cuomo’s ‘Defund the Police’ attacks spark fireworks  New York Post"
2025-06-04,TOP_NEWS,Two Chinese nationals charged with smuggling toxic fungus into U.S. - The Washington Post,"Two Chinese nationals charged with smuggling toxic fungus into U.S.  The Washington PostSuspected Chinese bioterrorists smuggled dangerous agent into US in boots, officials say  Fox NewsWhat is Fusarium graminearum, the fungus US authorities say was smuggled in from China?  AP NewsChinese researchers’ alleged plot to smuggle crop-killing fungus into US is an ‘attack on US food supply’: feds  New York PostChinese scientist Liu Zunyong tried to bring toxic fungus into US, FBI says  South China Morning Post"
2025-06-04,TOP_NEWS,Controversial Gaza aid operation pauses for 24 hours after days of deadly shootings - CNN,"Controversial Gaza aid operation pauses for 24 hours after days of deadly shootings  CNNIsraeli-Backed Aid Sites in Gaza Close Temporarily After Deadly Shootings  The New York TimesGHF says sites won’t reopen tomorrow morning as planned after one-day shut-down  The Times of Israel31 Palestinians are killed heading to a Gaza aid site, witnesses say. Israel denies responsibility  AP NewsMore than 30 killed by gunfire near U.S. aid site in Gaza  The Washington Post"
2025-06-04,TOP_NEWS,A new satellite TV channel allows Alexei Navalny's videos to reach Russian audiences - NPR,A new satellite TV channel allows Alexei Navalny's videos to reach Russian audiences  NPRView Full Coverage on Google News
2025-06-04,TOP_NEWS,Have You Seen This? Hungry wild elephant raids grocery store for snacks - KSL.com,"Have You Seen This? Hungry wild elephant raids grocery store for snacks  KSL.comA hungry wild elephant raids a grocery store in Thailand for snacks  AP NewsWild Elephant Stomps into Grocery Store to Cause Chaos and Grabs Snacks, Leaves with Unpaid $25 Bill  People.comVideo shows elephant eating sweets, getting stuck at Thailand grocery store  USA TodayElephant Busts Into Grocery Store and Helps Himself to Snacks Like It's a Buffet  AOL.com"
2025-06-04,TOP_NEWS,Judge says migrants sent to El Salvador prison must get a chance to challenge their removals - AP News,"Judge says migrants sent to El Salvador prison must get a chance to challenge their removals  AP NewsTrump foe Judge Boasberg rules deported migrants can challenge removals, in blow to admin  Fox NewsImmigration courts dismissing cases of Venezuelan migrants sent to El Salvador: Attorneys  ABC NewsJudge Boasberg rules migrants at Salvadoran megaprison can contest gang accusations  The HillJudge Orders Trump Administration to Take Steps to Give Due Process to Deported Migrants  The New York Times"
2025-06-04,TOP_NEWS,Wells Fargo Stock Rises as Fed Lifts Asset Cap After 7 Years - Barron's,"Wells Fargo Stock Rises as Fed Lifts Asset Cap After 7 Years  Barron'sWells Fargo Is Allowed to Grow Again After 7 Years Under Asset-Cap Penalty  WSJWells Fargo CEO goes from fixer to builder as regulators lift punishments  ReutersWells Fargo Confirms that the Federal Reserve Has Removed the Limits on Growth in Total Assets Imposed in its 2018 Consent Order and Announces a Special Employee Award  wellsfargo.comCramer calls Wells Fargo's asset-cap removal a 'watershed moment,' raises price target on the stock  CNBC"
2025-06-04,TOP_NEWS,Reddit sues Anthropic for allegedly not paying for training data - TechCrunch,"Reddit sues Anthropic for allegedly not paying for training data  TechCrunchReddit Sues Anthropic, Alleges Unauthorized Use of Site’s Data  WSJReddit sues Anthropic, alleging its bots accessed Reddit more than 100,000 times since last July  The VergeReddit sues AI company Anthropic for allegedly 'scraping' user comments to train chatbot Claude  Yahoo FinanceReddit sues AI startup Anthropic for breach of contract, 'unfair competition'  CNBC"
2025-06-04,TOP_NEWS,"The two rules investors need to follow right now as the S&P 500 eyes a return to 6,000 - MarketWatch","The two rules investors need to follow right now as the S&P 500 eyes a return to 6,000  MarketWatchCharting the S&P 500: Market Strives for 'Elusive Channel' Amid Big Swings  TheStreet ProBullish Trigger Hit! Looking For Longs on the S&P for CME_MINI:MES1! by MarketsByLee_  TradingViewS&P 500 Poised for 6,200 as Wave Count Targets Final Stretch of Rally  Investing.com​S&P 500 surges ahead while silver price stalls at key resistance and USD/JPY bounces off support  ig.com"
2025-06-04,TOP_NEWS,"Fed 'Beige Book' economic report cites declining growth, rising prices and slow hiring - CNBC","Fed 'Beige Book' economic report cites declining growth, rising prices and slow hiring  CNBCUS economic activity declines as tariffs pressure prices, Fed says  ReutersUS Economic Activity Ebbs, Prices Rise in Fed’s Beige Book  Bloomberg.comU.S. economy stalled in May, Fed survey finds  MarketWatchFed: The Economy Is Slowing As 'Companies Can’t Figure Out the Rules of This Tariff Game'  Investopedia"
2025-06-04,TOP_NEWS,Walmart Nintendo Switch 2 pre-order confirmed: what time it'll be in stock online - The Shortcut | Matt Swider,"Walmart Nintendo Switch 2 pre-order confirmed: what time it'll be in stock online  The Shortcut | Matt SwiderNintendo Switch 2 launch day is here: What to know about midnight releases, preorders and more  AxiosGamers line up at the Pinnacle for new Nintendo console  WCYBTarget to sell Nintendo Switch 2 in stores June 5 and on Target.com beginning June 6  Target CorporationNintendo Can’t Afford a Slip Up With Switch 2  Bloomberg.com"
2025-06-04,TOP_NEWS,Wyze Says ‘Screw It’ and Shoves a Camera Into Its Latest Smart Bulb - Gizmodo,Wyze Says ‘Screw It’ and Shoves a Camera Into Its Latest Smart Bulb  GizmodoWyze's new Bulb Cam turns any light socket into a 2K camera - for just $50  ZDNETWyze's New Bulb Cam Turns Any Light Bulb Socket Into a Security Camera  CNETWyze ‘Bulb Cam’ combines lightbulb and camera for new smart-home security option  GeekWireWyze’s latest smart bulb is also a camera  The Verge
2025-06-04,TOP_NEWS,"CD Projekt Red clarifies Unreal showcase of Witcher 4 was tech demo, not gameplay - GamesIndustry.biz","CD Projekt Red clarifies Unreal showcase of Witcher 4 was tech demo, not gameplay  GamesIndustry.bizThe Witcher 4: The People, Places, and Secrets of the Tech Demo  IGNThe Witcher 4 Gets New Cinematic Trailer Revealing A Slightly Different-Looking Ciri And A 9-Minute Gameplay Tech Demo  KotakuThe Witcher 4 tech demo ran on a base PS5 to ‘show how much we can optimize’  The VergeThe Witcher 4's tech demo featured a familiar voice from The Witcher 3, and there's an interesting extra wrinkle  Rock Paper Shotgun"
2025-06-04,TOP_NEWS,Final Fantasy Tactics Remake Is Happening: Trailer And Release Date Announced During State Of Play - GameSpot,"Final Fantasy Tactics Remake Is Happening: Trailer And Release Date Announced During State Of Play  GameSpotFinal Fantasy Tactics – The Ivalice Chronicles comes to PS5 and PS4 September 30, 2025  PlayStation.BlogFinal Fantasy Tactics' Long-Rumored Remake is Real After All, Includes Voice Acting and Classic Original Version  IGNSquare Enix surprise announced a Final Fantasy Tactics remaster  The VergeFinal Fantasy Tactics: The Ivalice Chronicles is remastering the 1997 cult classic later this year  Rock Paper Shotgun"
2025-06-04,TOP_NEWS,"Edmund White, Pioneer of Gay Literature, Is Dead at 85 - The New York Times","Edmund White, Pioneer of Gay Literature, Is Dead at 85  The New York TimesThe Writer Who Knew the Joys of Sex  The AtlanticEdmund White remembered: ‘He was the patron saint of queer literature’  The GuardianEdmund White, acclaimed novelist of gay life, dies at 85  The Washington PostEdmund White, who broke ground in gay literature, has died at 85  NPR"
