date,source,title,description
2025-05-25,TOP_NEWS,Trump agrees to give EU until July 9 to negotiate a trade deal with the US - CNN,Trump agrees to give EU until July 9 to negotiate a trade deal with the US  CNNTrump Administration Live Updates: Latest News on the Trump Policy Bill  The New York TimesTrump pauses threatened EU tariffs until July  AxiosUS Equity Futures Gain as Europe Deadline Extended: Markets Wrap  Bloomberg.comTrump extends deadline for EU trade deal until 9 July  BBC
2025-05-25,TOP_NEWS,Top Republicans threaten to block Trump’s spending bill if national debt is not reduced - The Guardian,"Top Republicans threaten to block Trump’s spending bill if national debt is not reduced  The GuardianFiscal Hawks in the Senate Balk at Trump’s Domestic Agenda Bill  The New York TimesSenators eye more budget bill cuts despite House speaker’s plea for few changes  The Washington PostSen. Ron Johnson says there's enough opposition in the Senate to hold up Trump's 'big, beautiful' bill  NBC NewsGOP senator says resistance to Trump's 'Big, Beautiful Bill' could stop it in the Senate  ABC News"
2025-05-25,TOP_NEWS,Americans remember George Floyd on fifth anniversary of his death - BBC,"Americans remember George Floyd on fifth anniversary of his death  BBC5 Years After George Floyd’s Murder, the Backlash Takes Hold  The New York TimesFive years later, the spot where George Floyd died is filled with memories but calm  NBC NewsGeorge Floyd’s legacy under siege as racial justice efforts lose ground, memorials removed  USA TodayWeekend of events remembering legacy of George Floyd on 5-year anniversary  FOX 9 Minneapolis-St. Paul"
2025-05-25,TOP_NEWS,"Israeli airstrikes in Gaza kill 38 people, including children, as Noem visits Israel - PBS","Israeli airstrikes in Gaza kill 38 people, including children, as Noem visits Israel  PBSIsraeli Airstrike Kills Doctor’s Children, Gaza Officials Say  The New York TimesLIVE: Israel bombs Gaza school, kills 19; EU, Arab nations urge end to war  Al JazeeraGaza pediatrician and mother loses 9 of 10 children after Israeli airstrike hits their home, hospital says  ABC NewsIsraeli strike kills 20 in Gaza school housing displaced people, health authorities say  Reuters"
2025-05-25,TOP_NEWS,"'I am Roman,' Pope Leo says, as he becomes the bishop of Rome - NPR","'I am Roman,' Pope Leo says, as he becomes the bishop of Rome  NPRPope Leo Just Officially Scored a New Role  The Daily BeastPope Leo XIV: 'Let us renew our devotion to Mary'  Vatican NewsPope Leo XIV delivers first homily as bishop of Rome at Basilica of St. John Lateran  Catholic News AgencyPope Leo XIV declares 'I am Roman!' as he completes formalities to become bishop of Rome  ABC News"
2025-05-25,TOP_NEWS,"Former Gateway police chief, serving murder sentence, escapes from Arkansas prison - KHBS","Former Gateway police chief, serving murder sentence, escapes from Arkansas prison  KHBSFormer police chief, serving murder and rape sentences, escapes from Arkansas prison  AP NewsManhunt underway after disgraced former police chief convicted of murder, rape escapes Arkansas prison  Fox NewsManhunt underway for escaped inmate from Calico Rock prison  KTLOConvicted murderer escapes prison, search underway  K8 News | Jonesboro, Arkansas"
2025-05-25,TOP_NEWS,Jasmine Crockett: ‘It’s Time for Republicans to Question Trump’s Mental Acuity’ - Rolling Stone,"Jasmine Crockett: ‘It’s Time for Republicans to Question Trump’s Mental Acuity’  Rolling StoneTrump Gives Commencement Address at West Point, Stressing a New Era  The New York TimesOn both sides of the Hudson, protesters counter Trump's message to West Point's cadets  LohudTrump tells West Point grads to avoid 'trophy wives' in commencement speech  USA TodayTrump Addresses a Military He’s Remaking in His Image  The Atlantic"
2025-05-25,TOP_NEWS,Texas House passes Senate bill requiring display of the Ten Commandments in all public-school classrooms - Houston Public Media,"Texas House passes Senate bill requiring display of the Ten Commandments in all public-school classrooms  Houston Public MediaTexas will require public school classrooms to display Ten Commandments under bill nearing passage  The Texas TribuneTexas bill requiring Ten Commandments in public schools moves closer to governor's desk  NBC NewsTexas House approves bill to require Ten Commandments in every classroom, adds amendment  KXAN AustinBill requiring classroom displays of Ten Commandments passes Texas House  Dallas News"
2025-05-25,TOP_NEWS,"Russia hits Ukraine with massive drone, missile barrage amid prisoner exchange - ABC News","Russia hits Ukraine with massive drone, missile barrage amid prisoner exchange  ABC NewsRussia launches war's largest air attack on Ukraine, kills at least 12 people  ReutersAt Least 12 Killed and Dozens Injured After Russia’s Air Strike In Ukraine  The New York TimesRussian strikes on Ukraine kill 12 in one of largest aerial attacks of war  The Washington PostRussia is raining hellfire on Ukraine  The Economist"
2025-05-25,TOP_NEWS,"5 skiers found dead on mountain near Zermatt, Switzerland - USA Today","5 skiers found dead on mountain near Zermatt, Switzerland  USA TodayBodies of five skiers found near Swiss resort  BBCAbandoned Skis Lead To Grim Discovery Near Luxury Swiss Resort  The Daily BeastFive skiers found dead in mountains near Swiss luxury resort  The Guardian5 skiers found dead on glacier in Switzerland; another skier killed by avalanche  CBS News"
2025-05-25,TOP_NEWS,IDF aims to capture 75% of Gaza Strip in 2 months in new offensive against Hamas - The Times of Israel,"IDF aims to capture 75% of Gaza Strip in 2 months in new offensive against Hamas  The Times of IsraelIsrael Aims to Control 75% of Gaza in Two Months, Military Says  WSJIDF chief Zamir, in Gaza, says battle against Hamas ‘not an endless war’  The Times of IsraelIsraeli Military Aims to Take Over 75% of Gaza Within Two Months  Bloomberg.comIDF deploys all standing army infantry and armored brigade to Gaza, local media report  Euronews.com"
2025-05-25,TOP_NEWS,North Korea detains 4 officials over the failed launch of a naval destroyer - AP News,North Korea detains 4 officials over the failed launch of a naval destroyer  AP NewsView Full Coverage on Google News
2025-05-25,TOP_NEWS,Federal Reserve Chair Jerome Powell says he didn't major in economics because he saw it as 'boring and useless' - Business Insider,Federal Reserve Chair Jerome Powell says he didn't major in economics because he saw it as 'boring and useless'  Business InsiderPowell defends Federal Reserve in Princeton speech amid onslaught of attacks from Trump  AP NewsFed Chair Powell urges Princeton grads to embrace risk and public service  Fox BusinessJerome Powell tells Princeton grads not to take universities for granted and that 'integrity is all we have—guard it carefully'  FortuneFederal Reserve’s Jay Powell urges US university students to protect democracy  Financial Times
2025-05-25,TOP_NEWS,Long-Bond Revolt Pressures 60/40 Comeback in Chaotic 2025 Market - Bloomberg.com,Long-Bond Revolt Pressures 60/40 Comeback in Chaotic 2025 Market  Bloomberg.comIs the 60/40 rule making a comeback? How to mix and match your stocks and bonds.  Wicked LocalThe Rebirth of the 60/40 Portfolio Has Been Greatly Exaggerated  Advisor PerspectivesSurge in long-term yields is said to test resilience of 60/40 strategy  MSN
2025-05-25,TOP_NEWS,Scott Galloway says Musk's work at DOGE fueled 'one of the greatest brand destructions' of all time - AOL.com,Scott Galloway says Musk's work at DOGE fueled 'one of the greatest brand destructions' of all time  AOL.comView Full Coverage on Google News
2025-05-25,TOP_NEWS,"At Amazon, Some Coders Say Their Jobs Have Begun to Resemble Warehouse Work - The New York Times","At Amazon, Some Coders Say Their Jobs Have Begun to Resemble Warehouse Work  The New York Times"
2025-05-25,TOP_NEWS,"Everything from Google I/O 2025 you might've missed: Gemini, smart glasses, and more - ZDNET","Everything from Google I/O 2025 you might've missed: Gemini, smart glasses, and more  ZDNETIntroducing Google AI Ultra: The best of Google AI in one subscription  Google BlogGoogle's new AI video tool floods internet with real-looking clips  AxiosI tried Google's new 'Try it on' AI shopping tool. I'm equally impressed and mortified.  MashableGoogle has a massive mobile opportunity, and it's partly thanks to Apple  Business Insider"
2025-05-25,TOP_NEWS,"Pixel 10 and 10 Pro leak reveals possible colors, like blue, yellow, and green - 9to5Google","Pixel 10 and 10 Pro leak reveals possible colors, like blue, yellow, and green  9to5GoogleWhy The Pixel 10 Will Be Google's Latest Game Changer  ForbesPixel 10 ‘Ask more of your phone’ ad leaks as it’s being filmed [Gallery]  9to5GoogleGoogle Pixel 10 rumors: Everything we know (and everything we think we know)  MashableNo Shot Google's Pixel 10 Pro Leaked This Way  Droid Life"
2025-05-25,TOP_NEWS,Iran summons French envoy in diplomatic row over 'insulting' Cannes remarks - BBC,Iran summons French envoy in diplomatic row over 'insulting' Cannes remarks  BBC‘Un Simple Accident’ Wins Palme d’Or at Cannes Film Festival  The New York TimesIranian dissident Jafar Panahi wins the Palme d’Or at Cannes  The Washington PostThe 78th Festival de Cannes winners’ list  Festival de CannesCannes Proved Its Own Value With This Year’s Palme d’Or Winner  Vulture
2025-05-25,TOP_NEWS,'Lilo & Stitch' and Tom Cruise’s ‘Mission: Impossible' power record Memorial Day weekend box office - Los Angeles Times,"'Lilo & Stitch' and Tom Cruise’s ‘Mission: Impossible' power record Memorial Day weekend box office  Los Angeles Times‘Lilo & Stitch’ Blows Up Memorial Day Box Office With $183M Bow, ‘Mission: Impossible’ Nabs Series-Best $77M  The Hollywood ReporterHollywood Notches Record Memorial Day Weekend at Box Office  Barron's'Lilo & Stich' teams with Tom Cruise and 'Mission Impossible' for a monster Memorial Day weekend  AP News‘Lilo & Stitch,’ ‘Mission: Impossible’ sell nearly $500M in tickets  Honolulu Star-Advertiser"
