date,source,title,description
2025-04-23,TOP_NEWS,Trump signs executive order to influence college accreditations - CBS News,"Trump signs executive order to influence college accreditations  CBS NewsTrump targeting college accreditation process in new executive order  CNNTrump issues mandates on HBCUs, school discipline, foreign gifts, accreditation  USA TodayTrump signs orders cracking down on diversity and inclusion at US universities  The GuardianTrump Live Updates: China Tariff News, Education Executive Orders and More  The New York Times"
2025-04-23,TOP_NEWS,Mourners visit Pope Francis lying in state at St Peter's Basilica - BBC,Mourners visit Pope Francis lying in state at St Peter's Basilica  BBCThousands of Mourners Wait for Hours to Have a Few Seconds to Pay Their Respects to Pope Francis  People.comCardinals prepare to battle over the future direction of the Catholic Church  CNNForget the film: Vatican is preparing for the real 'Conclave'  ReutersPope Francis' death: A time for 'reflection' before funeral  BBC
2025-04-23,TOP_NEWS,Trump says Zelenskyy is prolonging war in Ukraine by resisting calls to cede Crimea to Russia - AP News,Trump says Zelenskyy is prolonging war in Ukraine by resisting calls to cede Crimea to Russia  AP NewsView Full Coverage on Google News
2025-04-23,TOP_NEWS,Federal judge blasts Trump DOJ for stonewalling in high-profile deportation case - NPR,Federal judge blasts Trump DOJ for stonewalling in high-profile deportation case  NPRFederal judge temporarily halts order for details on any efforts to return Abrego Garcia to US  AP News‘That ends now’: Judge overseeing Abrego Garcia case knocks Trump administration for repeated stonewalling  CNNAmerican citizens wrongly detained in Trump administration’s immigration crackdown  PBSFederal judge accuses White House of ‘bad faith’ in Kilmar Ábrego García case  The Guardian
2025-04-23,TOP_NEWS,Fears grow that Signal leaks make Pete Hegseth top espionage target - The Guardian,Fears grow that Signal leaks make Pete Hegseth top espionage target  The GuardianProminent role of Pete Hegseth’s wife at Pentagon draws scrutiny  CNNTrump's Behavior After Hegseth Reports Is 'Dangerous': Retired Army General  NewsweekFormer Pentagon official on Hegseth turmoil: 'It looks like they actually broke the law'  NPRPete Hegseth’s Patriotic Duty Is to Resign  The Atlantic
2025-04-23,TOP_NEWS,Trump job approval falls 7 points since February: Pew - The Hill,"Trump job approval falls 7 points since February: Pew  The HillTrump’s Job Rating Drops, Key Policies Draw Majority Disapproval as He Nears 100 Days  Pew Research CenterTrump’s Approval Rating Has Been Falling Steadily, Polling Average Shows  The New York TimesAmericans sour on Trump's handling of the economy, Reuters/Ipsos poll finds  ReutersAmericans souring on Trump's economic strategy, polls say  Axios"
2025-04-23,TOP_NEWS,"Wildfire in New Jersey Pine Barrens expected to grow before it’s contained, officials say - AP News","Wildfire in New Jersey Pine Barrens expected to grow before it’s contained, officials say  AP NewsCommunication efforts during NJ wildfire draw mixed reactions from residents  NBC10 PhiladelphiaOfficials: Ocean County wildfire consumes more than 13,200 acres, is 50% contained  News 12Evacuation orders lifted and portion of Garden State Parkway reopens as crews battle New Jersey wildfire  CNNPine Barrens fire today: 12,500 acres burned, 40% contained  Asbury Park Press"
2025-04-23,TOP_NEWS,A dozen states sue the Trump administration to stop tariff policy - NPR,A dozen states sue the Trump administration to stop tariff policy  NPRView Full Coverage on Google News
2025-04-23,TOP_NEWS,Victims' loved ones denied chance to confront Highland Park mass shooter - NBC News,"Victims' loved ones denied chance to confront Highland Park mass shooter  NBC NewsSentencing in Highland Park parade shooting: Plans, hopes and dreams destroyed by ‘violent tantrum’  Chicago TribuneHighland Park shooter Robert Crimo III to be sentenced Thursday  ABC NewsHighland Park parade shooting: Survivors of July Fourth parade mass shooting speak in court before Robert Crimo III sentencing  ABC7 ChicagoSurvivors of 2022 July Fourth parade mass shooting describe chaos, panic and bloodshed  WGN-TV"
2025-04-23,TOP_NEWS,Let Harvard take care of itself - AL.com,"Let Harvard take care of itself  AL.comExclusive | Trump Administration Irate at Harvard, Plans to Pull Additional $1 Billion in Funding  WSJHarvard’s fight with the Trump administration is just getting started. The cost is already high  CNNHarvard's president says the school will 'not compromise' on its rights with the Trump admin  NBC NewsSome Harvard Donors Still Want It to Strike a Deal With Trump  The New York Times"
2025-04-23,TOP_NEWS,"After Kashmir attack, India downgrades ties with Pakistan and suspends water treaty - NPR","After Kashmir attack, India downgrades ties with Pakistan and suspends water treaty  NPRPahalgam attack: How will India respond to the Kashmir killings  BBCIndia blames Pakistan for a deadly attack in Kashmir and suspends a key water treaty  AP NewsKilling of Civilians Near Pahalgam in Kashmir Shatters Illusion of Calm  The New York TimesIndia Suspends Indus Waters Treaty, Shuts Attari Border In Strong Response To Pakistan  NDTV"
2025-04-23,TOP_NEWS,"Killing of Gaza Aid Workers: IDF Troops Fired Indiscriminately for Over Three Minutes, Some at Point-blank Range - Haaretz","Killing of Gaza Aid Workers: IDF Troops Fired Indiscriminately for Over Three Minutes, Some at Point-blank Range  HaaretzIsrael's changing story of an attack on rescue workers  NPRPalestinian Red Crescent says Israel lying about Gaza medics' killings  BBCGaza rescue service dismisses Israeli probe into killing of medics as a 'fabricated investigation'  AP NewsA Tragic Mistake? Yes. A War Crime? No | Opinion  Newsweek"
2025-04-23,TOP_NEWS,A magnitude 6.2 quake shakes Istanbul and injures more than 230 people - AP News,"A magnitude 6.2 quake shakes Istanbul and injures more than 230 people  AP NewsIstanbul earthquake live: More than 150 injured as buildings shaken in Turkey's largest city  BBC‘I grabbed my cat and ran’: Istanbul panics as earthquake hits  Al JazeeraPowerful Earthquake Shakes Istanbul, Sending People Into Streets  The New York TimesLarge earthquake hits off the coast of Turkey  NBC News"
2025-04-23,TOP_NEWS,Victims and Eyewitnesses in Kashmir Attack Describe Scenes of Chaos and Horror - The New York Times,"Victims and Eyewitnesses in Kashmir Attack Describe Scenes of Chaos and Horror  The New York TimesHimachal Pradesh on high alert following Pahalgam terror attack  Hindustan TimesPahalgam: Rage and grief after 26 killed in Indian-administered Kashmir  BBCKashmir experiences worst civilian attack in years, coinciding with Vance India visit  NPRBodies Of Two Karnataka Tourists Killed In Pahalgam Attack Reach Bengaluru  NDTV"
2025-04-23,TOP_NEWS,5 Things Elon Musk Accomplished With Trump - The New York Times,"5 Things Elon Musk Accomplished With Trump  The New York TimesTesla Profit Sinks, Hurt by Backlash Over Elon Musk’s Political Role  WSJElon Musk Backs Away From Washington, but DOGE Remains  The New York TimesTesla’s Remarkably Bad Quarter Is Even Worse Than It Looks  The AtlanticEven Republicans are falling out of love with Tesla  The Economist"
2025-04-23,TOP_NEWS,"Trump reversals on Fed chair, China tariffs send markets higher - Los Angeles Times","Trump reversals on Fed chair, China tariffs send markets higher  Los Angeles TimesTrump was warned of empty shelves and financial turmoil from tariffs and firing Powell. His U-turn pushed stocks higher  CNNStock market today: Dow, S&P 500, Nasdaq rally as Trump softens stance on Powell, China tariffs  Yahoo FinanceMarkets rally after Trump eases concerns over tariffs and Fed  AP NewsExclusive | Why Trump Decided Not to Try to Fire Jerome Powell  WSJ"
2025-04-23,TOP_NEWS,"Southwest to cut flights this year, pulls guidance, citing 'macroeconomic uncertainty' - CNBC","Southwest to cut flights this year, pulls guidance, citing 'macroeconomic uncertainty'  CNBCSouthwest Pulls Financial Outlook Due to Economic Uncertainty  Bloomberg.comSouthwest Airlines joins rivals Delta, United in cutting flights, scrapping forecasts  New York PostSouthwest Airlines pulls it profit outlook for 2025 and 2026  Yahoo FinanceHere’s how Southwest is trying to stay one step ahead of weaker travel demand  MarketWatch"
2025-04-23,TOP_NEWS,Gold prices plunge in biggest one-day drop in years. Is the record rally over? - MarketWatch,"Gold prices plunge in biggest one-day drop in years. Is the record rally over?  MarketWatchGold Rises Amid Lingering Uncertainty Over U.S.-China Trade War  WSJGold Falls From Record as Trump Stances on Fed, China Calm Fears  Bloomberg.comGold Hits $3500 as China Warns of 'Irrational Trading', Trump Attacks Powell Again  BullionVaultGold surges to new record high after Trump’s repeated attacks on US Fed chief  CNN"
2025-04-23,TOP_NEWS,Backward compatible: Many old Oblivion mods still work on Oblivion Remastered - Ars Technica,Backward compatible: Many old Oblivion mods still work on Oblivion Remastered  Ars TechnicaThe Elder Scrolls IV: Oblivion Remastered Review in Progress  IGNBethesda isn’t shutting down ambitious fan-made “Skyblivion” remaster project  Ars TechnicaPlaying Oblivion for the first time is like opening an RPG time capsule  The VergeSomeone Is Already Playing ‘Oblivion Remastered’ in VR  VICE
2025-04-23,TOP_NEWS,Anker’s 4K outdoor projector looks and sounds great… on paper - The Verge,Anker’s 4K outdoor projector looks and sounds great… on paper  The VergeNebula's new X1 4K portable projector is liquid cooled  Engadget‘Ultimate backyard projector’ features 3 lasers and first-ever liquid cooling  Cult of MacAnker's new portable 4K projector could be the ultimate easy outdoor projector thanks to its stunning brightness  TechRadarNebula announces its new X1 triple laser outdoor 4K smart projector  Techaeris
