date,source,title,description
2026-05-10,TOP_NEWS,Democratic Candidates Scramble in Virginia After Court Tosses Map - The New York Times,"Democratic Candidates Scramble in Virginia After Court Tosses Map  The New York TimesAfter Virginia Redistricting Map Is Tossed, Democrats Search Desperately for a Response  The New York TimesBrooks and Marcus on Virginia’s major shakeup in the national redistricting battle  PBSJONATHAN TURLEY: Angry Left plots to purge Virginia's  Fox NewsTranscript: Rep. Ted Lieu on ""Face the Nation with Margaret Brennan,"" May 10, 2026  CBS News"
2026-05-10,TOP_NEWS,Body of missing US soldier recovered off coast of Morocco - The Guardian,"Body of missing US soldier recovered off coast of Morocco  The GuardianBody of soldier who went missing in Morocco during training exercise recovered, U.S. Army says  CBS NewsRemains of US soldier who went missing in Morocco recovered  The HillPress Release - US Army recovers, identifies one Soldier near Cap Draa, Morocco; search co  europeafrica.army.milMorocco: Remains of US soldier who fell off cliff found in ocean  Sky News"
2026-05-10,TOP_NEWS,These Democrats shouldn’t have a shot at winning—but they do - Daily Kos,These Democrats shouldn’t have a shot at winning—but they do  Daily KosG.O.P. Fatigue in Iowa Strains the Republican Primary for Governor  The New York TimesDemocrats Might Actually Win Iowa  The AtlanticThe Ruby Red Farm State That Is Now a Political Battleground  WSJIowa hasn't gotten better under a decade of Republican rule | Opinion  The Des Moines Register
2026-05-10,TOP_NEWS,Texas Gov. Greg Abbott orders state emergency response activation ahead of Mother's Day and overnight storms - KHOU,Texas Gov. Greg Abbott orders state emergency response activation ahead of Mother's Day and overnight storms  KHOUSevere t-storms closing in on Austin area  KXAN AustinLIVE RADAR: SEVERE THUNDERSTORM WATCH through midnight  WOAIGov. Abbott activates state emergency resources ahead of severe storm threat  YahooDallas weather: Severe storms bring threat of large hail and 75 mph winds  FOX 4 News Dallas-Fort Worth
2026-05-10,TOP_NEWS,"Keir Starmer Says No, He Won’t Resign - The New York Times","Keir Starmer Says No, He Won’t Resign  The New York TimesStarmer to promise bolder action as leadership threats mount  BBCLabour MP puts Cabinet 'on notice,' threatens to trigger leadership challenge against Starmer by Monday  Fox NewsMPs from Labour’s left to urge Ed Miliband to consider leadership bid  The GuardianUK's Starmer says his government is a 10-year project despite calls to quit  Reuters"
2026-05-10,TOP_NEWS,Israeli settlers force Palestinian family to exhume and rebury their father - NPR,Israeli settlers force Palestinian family to exhume and rebury their father  NPRSee more headlines & perspectives on Google News
2026-05-10,TOP_NEWS,Russia and Ukraine trade blame as fragile US-brokered ceasefire rocked by deadly drone strikes - The Independent,"Russia and Ukraine trade blame as fragile US-brokered ceasefire rocked by deadly drone strikes  The IndependentRussian Offensive Campaign Assessment, May 9, 2026  Institute for the Study of WarRussia and Ukraine accuse each other of violating US-brokered 3-day truce  AP NewsUkraine, Russia trade accusations of violating US-backed ceasefire  ReutersTrump says Russia and Ukraine have agreed to his request for a 3-day ceasefire  NPR"
2026-05-10,TOP_NEWS,More chocolate bars added to nationwide recall over possible contamination - Yahoo,More chocolate bars added to nationwide recall over possible contamination  YahooChocolate recall hits company's entire product lineup over Salmonella contamination fears  Fox BusinessChocolate sold nationwide recalled for potential salmonella contamination  WKRCChocolate bars recalled for salmonella concerns expands  USA TodaySalmonella scare forces Spring & Mulberry recall  Rolling Out
2026-05-10,TOP_NEWS,"Trump Administration Is Considering Pausing the Federal Gas Tax to Lower Prices, Energy Secretary Says - The New York Times","Trump Administration Is Considering Pausing the Federal Gas Tax to Lower Prices, Energy Secretary Says  The New York TimesEnergy secretary says Trump administration is open to suspending gas tax amid soaring prices  NBC NewsChris Wright: ‘I don't know the future of gas prices'  PoliticoTrump official opens door to gas tax suspension  AxiosTrump’s Energy Secretary: “I Can’t Predict the Price of Energy”  Mother Jones"
2026-05-10,TOP_NEWS,Sunday Preview – March out with the Cities of Sigmar - Warhammer Community,Sunday Preview – March out with the Cities of Sigmar  Warhammer Community
2026-05-10,TOP_NEWS,Some Japanese Retailers Are Now Heavily Restricting Nintendo Switch 2 Purchases - TheGamer,"Some Japanese Retailers Are Now Heavily Restricting Nintendo Switch 2 Purchases  TheGamerNintendo Shares Tumble After Lackluster Switch 2 Games Outlook  Bloomberg.comNintendo shares slump as price hikes, games shortfall spook market  ReutersThe future of game consoles is looking bleak  The VergeNintendo hikes Switch 2 prices and expects console sales to decline as memory crunch bites  CNBC"
2026-05-10,TOP_NEWS,"Fitbit Air has status light & double-tap gesture, gets Whoop size comparison - 9to5Google","Fitbit Air has status light & double-tap gesture, gets Whoop size comparison  9to5GoogleIntroducing the all-new Fitbit Air  blog.googleWhy the New Fitbit Air Could Be the Most Important New Wearable of 2026  Men's HealthWhy Removing Screens From Fitness Trackers Made Them 88% More Popular: 'If It Has a Screen, It's a Watch'  entrepreneur.comGoogle Fitbit Air preorders come with a second band for free  The Verge"
2026-05-10,TOP_NEWS,"Sandra Bullock shares rare family photos for Mother's Day - ABC News - Breaking News, Latest News and Videos","Sandra Bullock shares rare family photos for Mother's Day  ABC News - Breaking News, Latest News and VideosSandra Bullock's kids Laila and Louis make ultra-rare social media appearance in poignant tribute  YahooSandra Bullock Shares Ultra Rare Image of Her Kids in Mother’s Day Tribute  E! NewsSandra Bullock Shares Rare Throwback Photo with Kids Louis and Laila  People.comSandra Bullock shares rare photo of her kids for Mother's Day, calls motherhood 'honor of a lifetime'  Page Six"
2026-05-10,TOP_NEWS,Washington Wizards win first pick in 2026 NBA draft - NBC News,"Washington Wizards win first pick in 2026 NBA draft  NBC News2026 NBA mock draft: Projecting all 60 picks post-lottery  ESPNNo. 1. Washington Wizards  WJLANBA Draft Lottery winners and losers: Clippers, Pacers, shameless tankers and more  The New York TimesThe NBA Draft Lottery will change the trade market, and these five teams could all make blockbusters  CBS Sports"
2026-05-10,TOP_NEWS,"Jarrod Bowen vents, Nuno Espirito Santo disheartened as West Ham equalizer taken away by VAR versus Arsenal - NBC Sports","Jarrod Bowen vents, Nuno Espirito Santo disheartened as West Ham equalizer taken away by VAR versus Arsenal  NBC SportsWest Ham 0-1 Arsenal (May 10, 2026) Game Analysis  ESPNBiggest VAR call ever? Four chaotic minutes that may define the season  BBCWest Ham 0 Arsenal 1: Did referee, VAR make right call? Has Trossard put Arsenal too far ahead? - The Athletic  The New York TimesVAR offers up Arsenal’s title-deciding moment for digital mess generation | Barney Ronay  The Guardian"
2026-05-10,TOP_NEWS,Barcelona 2 Real Madrid 0: Hansi Flick’s side wrap up La Liga title in El Clasico - The Athletic - The New York Times,"Barcelona 2 Real Madrid 0: Hansi Flick’s side wrap up La Liga title in El Clasico - The Athletic  The New York TimesBarcelona win second straight LaLiga title after El Clásico victory  ESPNBarcelona 2 – 0 Real Madrid Player Ratings  Yahoo SportsBarcelona vs. Real Madrid live stream: Where to watch El Clasico online, odds, start time, channel  CBS SportsMarcus Rashford and Ferran Torres lead Barcelona’s La Liga title charge vs Real Madrid in El Clásico  World Soccer Talk"
2026-05-10,TOP_NEWS,Caitlin Clark-Paige Bueckers debate suddenly got uncomfortable for Fever fans - High Post Hoops,Caitlin Clark-Paige Bueckers debate suddenly got uncomfortable for Fever fans  High Post HoopsCaitlin Clark 'felt good' in return despite lingering back issue  ESPNThe biggest star of the Wings' thrilling opening-day win over the Fever? The WNBA's new CBA  CBS SportsPaige Bueckers and Wings best Caitlin Clark’s Fever in battle of WNBA No 1 picks  The GuardianWhy Caitlin Clark went back to Indiana Fever locker room in season opener  IndyStar
2026-05-10,TOP_NEWS,James Webb telescope zooms in on a black hole that could reveal the truth about 'little red dots' - Live Science,James Webb telescope zooms in on a black hole that could reveal the truth about 'little red dots'  Live ScienceUnlocking the Mystery of X-ray Dots  NASA (.gov)Astronomers Spot Possible Missing Link to Webb’s Little Red Dots  Sky & TelescopeAstronomers Find an X-Ray Key to the Red Dot Mystery  Universe TodayGalactic Islands of Tranquility: How “Little Red Dots” May Brew Life’s Building Blocks  SETI Institute
2026-05-10,TOP_NEWS,115 Fall Sick as Norovirus Rips Through Cruise Ship - The Daily Beast,"115 Fall Sick as Norovirus Rips Through Cruise Ship  The Daily BeastNorovirus Outbreak Sickens 115 on Cruise Ship  The New York TimesMore than 100 sickened in norovirus outbreak aboard Caribbean Princess cruise  NBC NewsOver 100 passengers, crew sick in Florida bound cruise after norovirus outbreak  WPECPrincess Cruise ship with Norovirus outbreak coming to Port Canaveral  Florida Today"
2026-05-10,TOP_NEWS,"A Mother's Brain Is Profoundly Rewired by Pregnancy, Scans Show - ScienceAlert","A Mother's Brain Is Profoundly Rewired by Pregnancy, Scans Show  ScienceAlertOften-maligned ‘mommy brain’ isn’t a bad thing, emerging research suggests  The Denver PostPregnancy reshapes the brain. But each pregnancy may do it differently.  National GeographicInside ‘mommy brain’: How pregnancy and childbirth rewire the maternal mind  The Times of IndiaPregnancy Changes Mothers’ Brains. These Recent Discoveries Are Showing Us How  Smithsonian Magazine"
