date,source,title,description
2025-07-23,TOP_NEWS,Bryan Kohberger sentenced to life in prison without parole: Live updates after victims’ families tell Idaho killer ‘you're gonna go to hell’ - Yahoo Home,"Bryan Kohberger sentenced to life in prison without parole: Live updates after victims’ families tell Idaho killer ‘you're gonna go to hell’  Yahoo HomeLive updates: Bryan Kohberger sentenced to life without parole for Idaho student murders  CNN‘In and out of it’: Friend explains why roommate didn’t call police on Kohberger  Idaho StatesmanKaylee Goncalves' sister, Alivea, delivers powerful impact statement, condemns Bryan Kohberger  KREMNew Documents Shed Light on Bryan Kohberger and Idaho Student Murders  The New York Times"
2025-07-23,TOP_NEWS,Trump derides copyright and state rules in AI Action Plan launch - Politico,Trump derides copyright and state rules in AI Action Plan launch  PoliticoPREVENTING WOKE AI IN THE FEDERAL GOVERNMENT  The White House (.gov)The Chatbot Culture Wars Are Here  The New York TimesTrump's new AI policies keep culture war focus on tech companies  NPRWhat’s in Trump’s new AI policy and why it matters  PBS
2025-07-23,TOP_NEWS,Florida judge rules Epstein grand jury records will remain sealed - ABC News,Florida judge rules Epstein grand jury records will remain sealed  ABC NewsView Full Coverage on Google News
2025-07-23,TOP_NEWS,Gaza doctors ‘becoming too weak to treat patients’ as hunger crisis deepens - The Guardian,"Gaza doctors ‘becoming too weak to treat patients’ as hunger crisis deepens  The GuardianAid agencies warn of Gaza starvation as Israel urged to end blockade  CNNHunger crisis deepens in Gaza as 10 more starvation deaths reported  Al JazeeraGaza facing man-made 'mass starvation', says WHO's Tedros  ReutersAid Groups Blame Israel’s Gaza Restrictions for ‘Mass Starvation’  The New York Times"
2025-07-23,TOP_NEWS,Republican-led House panel passes Democrat's measure to subpoena Epstein files - Axios,Republican-led House panel passes Democrat's measure to subpoena Epstein files  AxiosView Full Coverage on Google News
2025-07-23,TOP_NEWS,Gabbard releases more Russia documents to accuse Obama of ‘manufacturing’ intelligence - CNN,"Gabbard releases more Russia documents to accuse Obama of ‘manufacturing’ intelligence  CNNMurkowski questions whether Trump admin is attacking Obama to distract from Epstein fallout  CNNGabbard releases more Russia documents, prompting concerns over intelligence sources  CBS News5 takeaways from Tulsi Gabbard’s White House press briefing  The HillTargeting Obama, Trump’s Retribution Campaign Takes Another Turn  The New York Times"
2025-07-23,TOP_NEWS,Judge pauses Kilmar Abrego Garcia's release from federal custody - NBC News,"Judge pauses Kilmar Abrego Garcia's release from federal custody  NBC NewsAbrego Garcia to remain behind bars for at least a month even as judge rejects Trump administration’s claim he’s dangerous  CNNRulings Order Abrego Garcia’s Release and Guard Against Hasty Deportation  The New York TimesWrongly deported migrant Abrego scores legal wins, but remains behind bars  ReutersJudge pauses Kilmar Abrego Garcia's release for 30 days  ABC News"
2025-07-23,TOP_NEWS,Russia and Ukraine Met Again. Here’s Where the Peace Talks Stand - The New York Times,"Russia and Ukraine Met Again. Here’s Where the Peace Talks Stand  The New York TimesRussia and Ukraine agree prisoner swap, but little other progress in Istanbul talks  CNNUkraine proposes summit with Putin, Trump, Zelensky and Erdogan  The HillRussia and Ukraine Are No Closer to Peace After Trump’s Threats  The Wall Street JournalUkraine updates: Third round of talks underway in Istanbul  DW"
2025-07-23,TOP_NEWS,Top UN court says countries can sue each other over climate change - BBC,"Top UN court says countries can sue each other over climate change  BBCUN court rules wealthy nations pay up for climate change damages in controversial global ruling  Fox NewsNations who fail to curb fossil fuels could be ordered to pay reparations, top UN court rules  The GuardianU.N. court says polluters can be held responsible for greenhouse gas emissions  CBS NewsIn landmark opinion, World Court says countries must address climate change  Reuters"
2025-07-23,TOP_NEWS,Gang leaders among first to be hit by small boat sanctions - BBC,"Gang leaders among first to be hit by small boat sanctions  BBCBritain Moves to Curb Migrant Trafficking, and Ease Anger at Home  The New York TimesUK launches sanctions regime targeting people-smuggling gangs  ReutersStarmer’s sanctions plan for people smugglers ‘far-fetched’, say experts  The GuardianUnmasked: The men masterminding the Channel migrant crossings  The Telegraph"
2025-07-23,TOP_NEWS,Google earnings keep Silicon Valley’s AI flywheel spinning - Financial Times,"Google earnings keep Silicon Valley’s AI flywheel spinning  Financial TimesGoogle beats on Q2 earnings, raises capex expeditures  Yahoo FinanceAlphabet beats earnings expectations, raises spending forecast  CNBCGoogle Revenue Soars on AI Boom, and Investors Eye Spending Surge  The Wall Street JournalGoogle parent Alphabet surprises with capital spending boost after earnings beat  Reuters"
2025-07-23,TOP_NEWS,"Southwest profit drops, but airline says travel demand has stabilized - CNBC","Southwest profit drops, but airline says travel demand has stabilized  CNBCSouthwest misses profit expectations as weak domestic demand erodes fares  Yahoo FinanceSouthwest Airlines earnings hit by weak US travel demand  ReutersSouthwest, American Earnings Will Test the Airline-Stock Rally  Barron'sSouthwest (LUV) Brings Back 2025 Profit Outlook Amid Travel Recovery  Bloomberg.com"
2025-07-23,TOP_NEWS,"‘I’m already up $45,000 in about an hour’ — Reddit traders boast about wins as meme-stock mania returns - MarketWatch","‘I’m already up $45,000 in about an hour’ — Reddit traders boast about wins as meme-stock mania returns  MarketWatchGoPro, Krispy Kreme join the meme party as Wall Street speculation ramps up  CNBCMeet the DORK stocks — the latest obsessions of Reddit’s retail trader army  Sherwood NewsKohl’s and Opendoor Headline a New Class of Meme Stocks  The Wall Street JournalKrispy Kreme, GoPro both soar as the next darlings of this summer's meme stock resurgence  Yahoo Finance"
2025-07-23,TOP_NEWS,Apple launches $19.99 monthly AppleCare One subscription with coverage for three devices - TechCrunch,"Apple launches $19.99 monthly AppleCare One subscription with coverage for three devices  TechCrunchApple introduces AppleCare One, streamlining coverage into a single plan with incredible value  AppleApple Launches $20-a-Month AppleCare One Plan Covering Up to Three Devices  Bloomberg.comApple launches $20 subscription service to protect your gadgets  The VergeApple's Newest Warranty Plan Might Finally Convince Me to Get AppleCare  Yahoo Home"
2025-07-23,TOP_NEWS,Qi2 25W wireless charging is coming to iPhones and 'major Android smartphones' - Engadget,Qi2 25W wireless charging is coming to iPhones and 'major Android smartphones'  EngadgetWPC Ushers in Next Generation of Faster Wireless Charging  Business WireFaster Qi2 charging is coming to iPhones and ‘major’ Android phones  The VergeQi2 is getting 25W charging with ‘major Android smartphones’ soon to add support  9to5GoogleQi2.2 wireless charging is here — and Baseus is ready to play  PhoneArena
2025-07-23,TOP_NEWS,AI video is invading YouTube Shorts and Google Photos starting today - Ars Technica,"AI video is invading YouTube Shorts and Google Photos starting today  Ars TechnicaUnlock next level Shorts with new creation tools  YouTube Official BlogTransform your photos into videos and remix your pics in Google Photos  The KeywordYouTube Shorts is adding an image-to-video AI tool, new AI effects  TechCrunchGoogle is bringing its AI-powered photo-to-video capability to more apps  The Verge"
2025-07-23,TOP_NEWS,This iPhone case switches Lightning ports to USB-C - The Verge,"This iPhone case switches Lightning ports to USB-C  The VergeAn engineer's new smartphone cases can give any iPhone a USB-C port  EngadgetThis Phone Case Lets Older iPhones Connect Via USB-C  PCMagThis iPhone case adds USB-C port to Lightning models  9to5MacGoodbye, dongle life – this clever new iPhone case trades your older model’s Lightning port for USB-C  TechRadar"
2025-07-23,TOP_NEWS,"Alice Cooper, Elton John, Judas Priest Pay Tribute to Ozzy Osbourne: “The Whole World Is Mourning Ozzy Tonight” - The Hollywood Reporter","Alice Cooper, Elton John, Judas Priest Pay Tribute to Ozzy Osbourne: “The Whole World Is Mourning Ozzy Tonight”  The Hollywood Reporter'There won't be another like him': Ozzy Osbourne's Black Sabbath bandmates pay tribute  BBCDouble Fine Honor's Heavy Metal Legend Ozzy Osbourne by Making Heavy Metal Video Game Brütal Legend Free for 666 Minutes Only  IGNHow ‘The Osbournes’ changed reality TV  CNNSharon Osbourne Reacts to Ozzy Osbourne Tribute After His Death  E! Online"
2025-07-23,TOP_NEWS,"After Malcolm-Jamal Warner's death, Red Cross says a second man survived same drowning - Los Angeles Times","After Malcolm-Jamal Warner's death, Red Cross says a second man survived same drowning  Los Angeles TimesMalcolm-Jamal Warner Drowning: Person Who Tried to Save Actor's Life Discharged from Hospital  People.comMalcolm-Jamal Warner drowning: 'The Cosby Show' actor was swimming with 8-year-old daughter, who was rescued, when he died  6abc PhiladelphiaEmotional Raven-Symoné consoled by wife in first sighting after co-star Malcolm-Jamal Warner’s death  Yahoo HomeIs Gen X Dying Before Our Eyes?  The Hollywood Reporter"
2025-07-23,TOP_NEWS,Jessica Simpson Laughs Off Wardrobe Malfunction in a Corseted Dress During Live TV Performance - instyle.com,"Jessica Simpson Laughs Off Wardrobe Malfunction in a Corseted Dress During Live TV Performance  instyle.comJessica Simpson rolls with wardrobe malfunction on 'Today' show  USA TodayMulti-Platinum Pop Star, 45, Suffers ‘Malfunction’ During Music Comeback  Yahoo HomeJessica Simpson Seems to Detail the Demise of Marriage to Ex-Husband Eric Johnson in New Song Lyrics  People.comJessica Simpson Implies She and Eric Johnson Weren't Sleeping Together in New Song “Fade”  Cosmopolitan"
