date,source,title,description
2025-08-01,TOP_NEWS,Live updates: US stock market and global trade partners react to Trump’s new tariffs - AP News,"Live updates: US stock market and global trade partners react to Trump’s new tariffs  AP NewsThese are the countries affected by Trump’s latest tariffs  CNNHigher U.S. tariffs will extend uncertainty for businesses, experts say. Here's why.  CBS NewsFURTHER MODIFYING THE RECIPROCAL TARIFF RATES  The White House (.gov)Businesses got some clarity on Trump’s trade deal. They aren't reassured.  Politico"
2025-08-01,TOP_NEWS,Corporation for Public Broadcasting says it will shut down after Congress cut money - NBC News,Corporation for Public Broadcasting says it will shut down after Congress cut money  NBC NewsCorporation for Public Broadcasting Will Shut Down  The New York TimesNot just Big Bird: Things to know about the Center for Public Broadcasting and its funding cuts  The Seattle TimesCorporation for Public Broadcasting says it's shutting down  NPRCorporation for Public Broadcasting will shut down after Trump funding cuts  CNN
2025-08-01,TOP_NEWS,"Anaconda, Montana shooting: Manhunt under way after 4 killed - BBC","Anaconda, Montana shooting: Manhunt under way after 4 killed  BBCFour people dead in Montana bar shooting, suspect at large  CNNManhunt launched after 4 killed in a shooting at a Montana bar  Yahoo Home4 Dead in Anaconda, Montana, Bar Shooting; Police Search for Gunman  The New York TimesAt least 4 dead in Montana bar shooting  Fox News"
2025-08-01,TOP_NEWS,Trump moves nuclear submarines after statements by former Russian president - Reuters,"Trump moves nuclear submarines after statements by former Russian president  ReutersTrump shortens deadline for Russia to make peace deal with Ukraine  Fox NewsTrump moves nuclear submarines after ex-Russia president’s menacing tweet  The GuardianNot With a Bang, but With a Truth Social Post  The AtlanticTrump Says He Ordered Nuclear Submarines Repositioned After Threats From Medvedev  The New York Times"
2025-08-01,TOP_NEWS,"Ghislaine Maxwell, Epstein's former girlfriend, transferred to a prison camp in Texas - NPR","Ghislaine Maxwell, Epstein's former girlfriend, transferred to a prison camp in Texas  NPRGhislaine Maxwell moved to women's prison in Texas  BBCEpstein accomplice Ghislaine Maxwell moved to Bryan prison  KBTX News 3What we know about Camp Bryan, Ghislaine Maxwell's new minimum-security prison  AxiosLegal expert breaks down the 'curious' timeline of Ghislaine Maxwell's DOJ meeting  MSNBC News"
2025-08-01,TOP_NEWS,"Senate unlocks ‘minibus’ deal , prepares to advance three spending bills - Politico","Senate unlocks ‘minibus’ deal , prepares to advance three spending bills  PoliticoSenate passes first funding package ahead of shutdown cliff  PoliticoSenate Passes Its First Spending Bills, but Battles Lie Ahead  The New York TimesSenate passes FDA appropriations bill  AxiosSen. John Thune discusses Schumer's 'no-win situation'  Fox News"
2025-08-01,TOP_NEWS,"In a Plot Twist, George Mason’s Politically Embattled President Gets a Raise - The Chronicle of Higher Education","In a Plot Twist, George Mason’s Politically Embattled President Gets a Raise  The Chronicle of Higher EducationGeorge Mason U. president gets raise from the board as the university is investigated by Trump administration  WTOPGeorge Mason board votes to end some DEI efforts, approve raise for president  The Washington PostGMU president keeps job, gets pay raise amid concerns of political pressure  WUSA9George Mason President Holds Job After Attacks on His Diversity Views  The New York Times"
2025-08-01,TOP_NEWS,Federal government cuts UCLA research funding over antisemitism claims - NBC News,"Federal government cuts UCLA research funding over antisemitism claims  NBC NewsUCLA research grants suspended by Trump administration  ABC7 Los AngelesTrump freezes $300 million in UCLA science and medical research funding, citing antisemitism  Los Angeles TimesTrump administration reportedly suspends $200m in grants to UCLA  The GuardianTrump's UCLA, Columbia settlements don't stifle free speech. They protect civil rights. | Opinion  USA Today"
2025-08-01,TOP_NEWS,"Mom in Arkansas park attack killed after helping kids to safety, police say - The Washington Post","Mom in Arkansas park attack killed after helping kids to safety, police say  The Washington PostTeacher arrested for Arkansas double murder admits to killing married couple: Police  ABC NewsExclusive | Devil’s Den murder suspect Andrew James McGann would 'tickle' girls, told one, 'I wish you could be my girlfriend,' parent at his former school says  New York PostFormer Texas student of Devil’s Den murder suspect expressed concerns of inappropriate behavior  Yahoo HomeDevil's Den murder suspect had been investigated by Texas school district in 2023  USA Today"
2025-08-01,TOP_NEWS,Trump recalibrates Gaza stance as humanitarian concerns grow - Politico,"Trump recalibrates Gaza stance as humanitarian concerns grow  PoliticoUS envoy Witkoff visits Gaza aid distribution site as starvation crisis deepens  CNNTop Trump officials visit Gaza as hunger crisis draws outrage  The Washington PostTrump's envoy meets Netanyahu for Gaza aid, ceasefire push  ReutersU.S. officials on rare visit to controversial Gaza aid distribution site  NPR"
2025-08-01,TOP_NEWS,Opposition leaders say ‘democracy in El Salvador has died’ after scrapping of presidential term limits - The Guardian,"Opposition leaders say ‘democracy in El Salvador has died’ after scrapping of presidential term limits  The GuardianEl Salvador Ends Term Limits, Letting Bukele Seek Re-Election Indefinitely  The New York TimesEl Salvador approves indefinite presidential reelection, extends presidential terms to 6 years  NPREl Salvador opens path for its president to stay in power indefinitely. Why critics aren't surprised  AP NewsFox News Flash top headlines for August 1  Fox News"
2025-08-01,TOP_NEWS,"With ‘broken heart,’ author David Grossman calls Israeli actions in Gaza ‘genocide’ - The Times of Israel","With ‘broken heart,’ author David Grossman calls Israeli actions in Gaza ‘genocide’  The Times of IsraelSeveral countries launch 'New York Declaration' in support of two-state solution  France 24In a First, Leading Israeli Rights Groups Accuse Israel of Gaza Genocide  The New York TimesIt's Not Just War. It's Genocide – and It's Being Done in Our Name - Opinion  HaaretzThere’s no magic number of deaths that makes it a genocide in Gaza  The Hill"
2025-08-01,TOP_NEWS,"Trump Fires BLS Commissioner, Claiming Weak Jobs Numbers Were ‘Rigged’ - The New York Times","Trump Fires BLS Commissioner, Claiming Weak Jobs Numbers Were ‘Rigged’  The New York TimesRepublican senators raise concerns about Trump's firing of Labor Dept. official  NBC NewsTrade adviser says Trump has ""real concerns"" about jobs data after president fires labor statistics chief  CBS NewsTrump removes official overseeing jobs data after dismal employment report  AP NewsSenate to Trump on job numbers: Don't shoot the messenger  Axios"
2025-08-01,TOP_NEWS,"Stock Market Today: Dow Closes 500 Points Lower on Weak Jobs Report, New Trump Tariffs — Live Updates - The Wall Street Journal","Stock Market Today: Dow Closes 500 Points Lower on Weak Jobs Report, New Trump Tariffs — Live Updates  The Wall Street JournalStock market today: Dow, S&P 500, Nasdaq tank as market confidence cracks under Trump tariffs, weak jobs data  Yahoo FinanceGlobal stock index sinks with dollar, bond yields after weak US jobs data  ReutersRecent global trade deals with the U.S. were secured with murky investments.  The New York TimesTrade War Turmoil, Rising Unemployment Send Markets Diving: Evening Briefing  Bloomberg"
2025-08-01,TOP_NEWS,Alarming jobs report makes potent case for the Fed to cut interest rates - Axios,"Alarming jobs report makes potent case for the Fed to cut interest rates  AxiosFed governors Bowman, Waller explain their dissents, say waiting to cut rates threatens economy  CNBCFed Dissenters Defend Call for July Rate Cut as Trump Intensifies Attacks on Powell  The New York TimesFed holds rates steady but sees first double dissent in three decades  The HillPowell didn’t just refuse to deliver a rate cut—he also hinted a raise could have been on the cards  Fortune"
2025-08-01,TOP_NEWS,Anthropic Revokes OpenAI's Access to Claude - WIRED,Anthropic Revokes OpenAI's Access to Claude  WIRED
2025-08-01,TOP_NEWS,"After Backlash, ChatGPT Removes Option to Have Private Chats Indexed by Google - PCMag","After Backlash, ChatGPT Removes Option to Have Private Chats Indexed by Google  PCMagExclusive: Google is indexing ChatGPT conversations, potentially exposing sensitive user data  Fast CompanyOpenAI quickly rolled back a new feature that allowed users to make private conversations with ChatGPT searchable  Business InsiderYour public ChatGPT queries are getting indexed by Google and other search engines  TechCrunchYour ChatGPT conversations may be visible in Google Search  Search Engine Land"
2025-08-01,TOP_NEWS,Microsoft Authenticator won't manage your passwords anymore - or most passkeys - ZDNET,Microsoft Authenticator won't manage your passwords anymore - or most passkeys  ZDNETWhy Microsoft Authenticator is changing and how to set up a passkey before the deadline  The IndependentMicrosoft Authenticator is ending password autofill soon. How to set up a passkey before Aug. 1  ABC NewsMicrosoft Authenticator is deleting your passwords today - here is what to do now  TechRadarLast Call: Microsoft Will Delete Your Passwords Tomorrow. Do This Now  PCMag
2025-08-01,TOP_NEWS,"Battlefield 6 leads will avoid goofy crossover skins to ""stray true to Battlefield"" - Eurogamer","Battlefield 6 leads will avoid goofy crossover skins to ""stray true to Battlefield""  EurogamerBattlefield 6 Release Date, 'Sims' Movie Update From EA Entertainment President  VarietyHow to Join the Battlefield 6 Open Beta: Early Access Sign Up and Weekend Dates  CNETBattlefield 6 will avoid goofy crossover skins, keep its visuals grounded  DBLTAPEA knows Battlefield 6's destruction will be controversial, but says ""you have to trust that we're good at our jobs""  PCGamesN"
2025-08-01,TOP_NEWS,Sydney Sweeney American Eagle Ad Addressed By Clothing Company Amidst Partisan Uproar - Deadline,Sydney Sweeney American Eagle Ad Addressed By Clothing Company Amidst Partisan Uproar  DeadlineSydney Sweeney’s American Eagle Jeans Ad Is Just Her Latest Controversial Project  The New York TimesAmerican Eagle breaks silence on Sydney Sweeney ‘great jeans’ ad controversy  New York PostJD Vance mocks Dem reaction to Sydney Sweeney ad on 'Ruthless' podcast  Fox NewsAmerican Eagle Bets Big on Sydney Sweeney to Rev Up Fall Denim Sales  WWD
