date,source,title,description
2025-08-10,TOP_NEWS,European leaders urge for Ukraine to be included in Trump-Putin Alaska peace talks - NPR,"European leaders urge for Ukraine to be included in Trump-Putin Alaska peace talks  NPREuropeans fear being a footnote in history as Putin looks to strike deal with Trump  CNNZelenskiy wins EU, NATO backing as he seeks place at Trump-Putin talks  ReutersEurope Casts Doubt on Trump-Putin Summit Without Ukraine  Time MagazineEuropean leaders rally behind Ukraine ahead of Trump-Putin meeting  CNBC"
2025-08-10,TOP_NEWS,Suspected gunman in CDC shooting had grievance toward Covid vaccine: Sources - ABC News,"Suspected gunman in CDC shooting had grievance toward Covid vaccine: Sources  ABC NewsCurrent, former CDC staff angered by shooting response  decaturish.comSuspect named in deadly CDC Atlanta shooting; more details  11Alive.comMore than 90 kids kept in daycare amid active shooter investigation at Emory, CDC  WSB-TVCDC shooting in Atlanta jars Emory University students, alumni  AJC.com"
2025-08-10,TOP_NEWS,Flooding cancels last day of Wisconsin State Fair as severe storms knock out power and close roads - AP News,"Flooding cancels last day of Wisconsin State Fair as severe storms knock out power and close roads  AP NewsWisconsin flooding: National Guard called up; Hart Park turf damaged  Milwaukee Journal SentinelPhotos: Historic flash floods hit Milwaukee as Midwest faces heavy rains threat  AxiosSE Wisconsin rainfall totals: How much rain has fallen since Saturday  WISNAppleton Fire Dept. sends water rescue crews to Waukesha County following storms, flooding  WLUK"
2025-08-10,TOP_NEWS,JD Vance’s attempt to link Democrats to Epstein renews calls to ‘release the files’ - The Guardian,"JD Vance’s attempt to link Democrats to Epstein renews calls to ‘release the files’  The GuardianVance calls out Democrats over Epstein files, reignites push for transparency  CNNVance: ‘We know’ Epstein had ‘connections with left-wing’ politicians, billionaires  The HillVance Unwittingly Gives MAGA New Ammo for Epstein Files Obsession  The Daily BeastVance Tries to Convince Americans That Trump Wants ‘Full Transparency’ in Epstein Case  Rolling Stone"
2025-08-10,TOP_NEWS,Trump and Putin May Get a Cold Reception From Some Alaskans - The New York Times,Trump and Putin May Get a Cold Reception From Some Alaskans  The New York TimesPutin Tells U.S. He’ll Halt War in Exchange for Eastern Ukraine  The Wall Street JournalUkraine war briefing: US ambassador to Nato says Zelenskyy could attend Alaska summit but decision is Trump’s  The GuardianPutin ally warns 'titanic efforts' are underway to sink Trump summit over Ukraine war  Fox NewsWhite House hasn’t ruled out Zelensky being in Alaska during Trump-Putin meeting on Friday  CNN
2025-08-10,TOP_NEWS,Texas governor promises to keep redistricting fight going for years - The Washington Post,Texas governor promises to keep redistricting fight going for years  The Washington PostDemocrats slam GOP redistricting fight as 'cheating' as Texas Gov. Abbott threatens arrests  CNBCIllinois Gov. JB Pritzker blasts Texas Gov. Greg Abbott and Trump over GOP redistricting efforts  NBC NewsTexas Democrats fled the state to oppose GOP redistricting. Why this one stayed behind.  USA TodayCornyn leans into Texas redistricting fight amid uphill reelection bid  The Hill
2025-08-10,TOP_NEWS,"Man clings to high-speed train in Austria after it left station without him, officials say - CBS News","Man clings to high-speed train in Austria after it left station without him, officials say  CBS NewsView Full Coverage on Google News"
2025-08-10,TOP_NEWS,UK police say more than 500 people arrested in pro-Palestinian events over weekend - AP News,UK police say more than 500 people arrested in pro-Palestinian events over weekend  AP NewsPalestine Action protest arrests rise to more than 500  BBCHundreds of anti-Israel protestors arrested in London for supporting group banned under terrorism law  Fox NewsLondon police arrest 466 people for backing banned Palestine Action group  CNNUK police arrest more than 466 at protest for banned Palestine Action group  Reuters
2025-08-10,TOP_NEWS,"Magnitude 6.1 earthquake in Turkey causes buildings to collapse, killing 1 - PBS","Magnitude 6.1 earthquake in Turkey causes buildings to collapse, killing 1  PBSOne killed in 6.1 magnitude earthquake in northwestern Turkey  Reuters6.1 earthquake hits Turkey’s Balikesir province, killing 1 and collapsing buildings  AP NewsEarthquake of magnitude 6.1 strikes Turkey  Hindustan TimesWestern Turkey Is Hit by Earthquake but Avoids Major Damage  The New York Times"
2025-08-10,TOP_NEWS,World reacts to peace agreement between Armenia and Azerbaijan - Euronews.com,World reacts to peace agreement between Armenia and Azerbaijan  Euronews.comIran threatens planned Trump corridor envisaged by Azerbaijan-Armenia peace deal  ReutersPresident Trump Brokers Another Historic Peace Deal  The White House (.gov)Pope Leo hails Armenia-Azerbaijan peace deal  Vatican NewsDonald Trump brokers a peace plan in the Caucasus  The Economist
2025-08-10,TOP_NEWS,"SoftBank selects banks for U.S. IPO of payments app PayPay, Reuters reports - CNBC","SoftBank selects banks for U.S. IPO of payments app PayPay, Reuters reports  CNBCExclusive-SoftBank selects banks for US IPO of payments app PayPay, sources say  Yahoo FinanceExclusive: SoftBank selects banks for US IPO of payments app PayPay, sources say  ReutersSoftBank's PayPay US IPO: A Strategic Play in the Global Digital Payments Race?  AInvestSoftBank Plans $2B US IPO for PayPay App in Late 2025  WebProNews"
2025-08-10,TOP_NEWS,Exclusive: Former Intel CEO Craig Barrett outlines plan to save Intel and America’s advanced chip manufacturing - Fortune,Exclusive: Former Intel CEO Craig Barrett outlines plan to save Intel and America’s advanced chip manufacturing  FortuneView Full Coverage on Google News
2025-08-10,TOP_NEWS,Stock-market rebound to be tested by inflation reports as stagflation threat emerges - MarketWatch,"Stock-market rebound to be tested by inflation reports as stagflation threat emerges  MarketWatchStock futures tick higher ahead of key inflation data expected this week: Live updates  CNBCDow futures rise as Wall Street and the Fed brace for updates on how much Trump's tariffs are stoking inflation  FortuneWall St Week Ahead Inflation data to test stocks as some investors brace for rally to pause  ReutersInflation Is Rising, Growth Is Slowing, Stocks Are Bubbly. What Could Go Wrong?  Barron's"
2025-08-10,TOP_NEWS,Gurman: All-new App Intents feature and Siri overhaul on track to launch next spring - 9to5Mac,Gurman: All-new App Intents feature and Siri overhaul on track to launch next spring  9to5MacApple’s Upcoming AI Voice Control Will Change How People Use iPhones  Bloomberg.comApple’s Siri delay is said to mask bigger AI ambitions behind the scenes (AAPL:NASDAQ)  Seeking AlphaApple may launch App Intents alongside the upgraded Siri next spring  MashableReport: Apple Testing Revamped Siri With Apps Like Uber and YouTube  MacRumors
2025-08-10,TOP_NEWS,66-53: Chart - Lookout Landing,66-53: Chart  Lookout Landing
2025-08-10,TOP_NEWS,NASA and Google Unveil Cutting-Edge AI to Safeguard Astronauts’ Health on Mars - The Daily Galaxy,NASA and Google Unveil Cutting-Edge AI to Safeguard Astronauts’ Health on Mars  The Daily GalaxyNASA and Google are building an AI medical assistant to keep Mars-bound astronauts healthy  Yahoo FinanceNASA and Google built a health AI tool for astronauts  statnews.comAlphabet Class A’s AI Ambitions Reach New Heights  TipRanksNASA and Google Collaborate on AI Medical Assistant for Space Missions  Startup Ecosystem Canada
2025-08-10,TOP_NEWS,"International Box Office: ‘Weapons’ Picks Up $27.5 Million, ‘Jurassic World Rebirth’ Tops $800 Million Worldwide - Variety","International Box Office: ‘Weapons’ Picks Up $27.5 Million, ‘Jurassic World Rebirth’ Tops $800 Million Worldwide  Variety‘Weapons’ Gives Warner Bros. Another Outstanding No. 1 Opening  The New York Times'Weapons' horror film scores a box office victory  ABC News17 children vanish into the night — 'Weapons' is terrific and terrifying  NPRWeekend Box Office: Weapons Racks up Another big Win for Warner Bros.  Rotten Tomatoes"
2025-08-10,TOP_NEWS,Billie Eilish's brother Finneas details extremely 'cringeworthy' interaction with Taylor Swift that still haunts him - Daily Mail,Billie Eilish's brother Finneas details extremely 'cringeworthy' interaction with Taylor Swift that still haunts him  Daily MailFinneas and Ashe: ‘I said thanks for coming to Taylor Swift. At her own birthday party’  The GuardianFinneas Details Awkward Moment With Taylor Swift  TMZFinneas looks back at 'cringiest' interaction with Taylor Swift  The News InternationalFinneas reveals hilarious encounter with Taylor Swift  Geo.tv
2025-08-10,TOP_NEWS,Collin Gosselin Pens Tearful Message About Fractured Relationship With Siblings - TODAY.com,"Collin Gosselin Pens Tearful Message About Fractured Relationship With Siblings  TODAY.comJon and Kate Gosselin’s Son Collin Details Being “Forced Apart” From His Siblings  E! OnlineCollin Gosselin Posts Emotional Message About His Siblings Being ‘Forced Apart, Pitted Against Each Other’  People.comReality Star Pens Tearful Letter to Estranged Siblings  The Daily BeastCollin Gosselin Shares Heartbreaking Message For Estranged Siblings  AOL.com"
2025-08-10,TOP_NEWS,Tom Holland Recaps First Day Back in Spider-Man Suit for ‘Brand New Day’: “It Feels Different This Time” - The Hollywood Reporter,"Tom Holland Recaps First Day Back in Spider-Man Suit for ‘Brand New Day’: “It Feels Different This Time”  The Hollywood Reporter‘Spider-Man: Brand New Day’ Footage Shows Tom Holland Riding a Tank, High-Fiving Fans  VarietyTom Holland Begins Filming ‘Spider-Man: Brand New Day’ In Glasgow: “Feels Different This Time”  DeadlineZendaya and Tom Holland Share Sweet PDA on ‘Spider-Man’ Set  ELLELooks Like Zendaya and Tom Holland Are Back On Set  The Cut"
