date,source,title,description
2026-04-03,TOP_NEWS,Trump Goes After Federal Programs He Calls ‘Woke’ in Budget Proposal - The New York Times,"Trump Goes After Federal Programs He Calls ‘Woke’ in Budget Proposal  The New York TimesWhite House Seeks 40 Percent Increase in Military Spending  The New York TimesBudget seeks billions for Air Force's F-47 fighter jet, just millions for Navy’s F/A-XX  Defense OneThe White House has a war-funding sales pitch the GOP might not buy  PoliticoTrump just raised the $39 trillion national debt with the largest budget hike since World War II—and nobody can figure out how to pay for it  Fortune"
2026-04-03,TOP_NEWS,‘This is a recalibration’: Trump Cabinet worries no one is safe after Bondi and Noem firings - CNN,‘This is a recalibration’: Trump Cabinet worries no one is safe after Bondi and Noem firings  CNN‘I Think It’s Time’: The Inside Story of Pam Bondi’s Ouster  WSJTrump Contemplates Other Cabinet Changes as He Faces Political Clock  The New York TimesPam Bondi’s portrait already taken down at Justice Department  MS NOWTrump is considering more changes to his Cabinet in the coming weeks  NBC News
2026-04-03,TOP_NEWS,Liberating the Department of Homeland Security From the Democrat-Caused Shutdown - The White House (.gov),Liberating the Department of Homeland Security From the Democrat-Caused Shutdown  The White House (.gov)Trump signs memo directing DHS to pay all employees during shutdown  NBC NewsTrump issues order declaring all DHS staff get paid amid partial shutdown  The GuardianIn their own words: Unpaid DHS workers have 'never seen the morale so low'  CNNAirport security: Are TSA wait times still long? Here’s how to check  The Hill
2026-04-03,TOP_NEWS,Trump's ballroom fight sheds new light on an underground White House bunker - NPR,Trump's ballroom fight sheds new light on an underground White House bunker  NPRWhat to Know About the ‘Massive’ Military Bunker Beneath Trump’s Ballroom  The New York TimesPlanning commission approves Trump's ballroom and East Wing design  CBS NewsTrump gives rare praise to persistent GOP foe after White House ballroom vote  Fox NewsWhy Republicans aren’t rushing to save Trump’s ballroom  Politico
2026-04-03,TOP_NEWS,Trump Seeks $152 Million to Begin to Turn Alcatraz Back Into a Prison - The New York Times,Trump Seeks $152 Million to Begin to Turn Alcatraz Back Into a Prison  The New York TimesTrump seeks $152 million to reopen Alcatraz as active prison  reuters.comTrump seeking $152 million from Congress to reopen Alcatraz as a federal prison  ABC7 San FranciscoTrump includes millions in budget request for re-opening Alcatraz as prison  KRON4White House seeks $152M to reopen Alcatraz as federal prison  NBC Bay Area
2026-04-03,TOP_NEWS,US judge upholds decision to toss subpoenas into Fed Chair Jerome Powell - Al Jazeera,"US judge upholds decision to toss subpoenas into Fed Chair Jerome Powell  Al JazeeraU.S. judge upholds block on subpoenas to Fed's Powell, teeing up likely appeal  CNBCJudge won’t reconsider decision blocking grand jury subpoenas of Fed, Jerome Powell  The HillUS judge upholds block of subpoenas in criminal investigation of Jay Powell  ft.comJudge denies Justice Department request to revive Federal Reserve subpoenas  CBS News"
2026-04-03,TOP_NEWS,23 states sue Trump over new executive order targeting mail voting - CBS News,"23 states sue Trump over new executive order targeting mail voting  CBS NewsTrump’s new role for USPS in mail balloting is unconstitutional, three lawsuits say  CNNDemocratic states sue to stop Trump's mail-in ballot restrictions  BBC‘Confusion, chaos and distrust’: Oregon challenges Trump’s order restricting vote-by-mail  The HillTwo dozen Democrat-led states sue Trump over mail-in ballot limits  Al Jazeera"
2026-04-03,TOP_NEWS,"Iran Is Quickly Repairing Missile Bunkers, U.S. Intelligence Says - The New York Times","Iran Is Quickly Repairing Missile Bunkers, U.S. Intelligence Says  The New York TimesWhat to know about Iran's military as the U.S. weighs ground operations  axios.comTrump's Iran 'Knocked Out' Claim Blown Up By US Intel On Missiles, Drones  NDTVExclusive: U.S. can only confirm about a third of Iran's missile arsenal destroyed, sources say  reuters.comExclusive: US intelligence assesses Iran maintains significant missile launching capability, sources say  CNN"
2026-04-03,TOP_NEWS,"Pope Leo carries cross for all 14 stations during Good Friday procession, first pontiff to do so in decades - CBS News","Pope Leo carries cross for all 14 stations during Good Friday procession, first pontiff to do so in decades  CBS NewsPope Leo XIV carries cross for full Good Friday procession, the first pontiff to do so in decades  YahooPope Leo XIV carries Cross for Via Crucis at Colosseum in Rome  Vatican NewsPope Leo's Good Friday service offers prayer for deported children  reuters.comAt the Colosseum, Pope Leo XIV urges the faithful to 'live our lives as a journey' in Christ's love  EWTN News"
2026-04-03,TOP_NEWS,Trump: ‘With a little more time’ the US ‘can easily’ reopen Strait of Hormuz - The Times of Israel,"Trump: ‘With a little more time’ the US ‘can easily’ reopen Strait of Hormuz  The Times of IsraelTrump’s Mission Impossible for Allies: Reopening the Strait of Hormuz  WSJTrump wants the world to buy more US oil. He might regret it.  PoliticoTrump says with more time, US can ‘take the oil’ in Iran  Al JazeeraDesperate Trump Pleads With World to Help Him ‘Make a Fortune’ With His War  The Daily Beast"
2026-04-03,TOP_NEWS,"Seville, Spain's Holy Week blends faith, tradition and spectacle - NPR","Seville, Spain's Holy Week blends faith, tradition and spectacle  NPREaster processions in Spain in pictures: from Seville to Zamora to Málaga | Fotos | Culture  EL PAÍS EnglishAPTOPIX Spain Holy Week  Goshen NewsSpain-Holy Week-Women  GazetteXtraSpain begins Holy Week with processions, palm branches and familiar faces  The Lufkin Daily News"
2026-04-03,TOP_NEWS,US Bonds Fall as Strong Jobs Data Undermines Fed Cut Outlook - Bloomberg.com,"US Bonds Fall as Strong Jobs Data Undermines Fed Cut Outlook  Bloomberg.comBond Yields Rise After Strong March Jobs Report  WSJStrong Showing for Job Market in Latest Report  The New York TimesJob growth shatters expectations in March, in boost to Trump  PoliticoThe jobs report looks good ‘for the wrong reasons,’ top economist warns: It’s hiding how many Americans are giving up  Fortune"
2026-04-03,TOP_NEWS,Your Easter candy is still expensive — even with cheaper cocoa - axios.com,"Your Easter candy is still expensive — even with cheaper cocoa  axios.comFrom chocolate to travel, Easter costs are on the rise  ABC7 Los AngelesNews10NBC compares food item prices at local stores ahead of Easter  WHEC.comWhy the price of an Easter basket has soared since 2020, stunning consumers  OregonLive.comWhy Filling Up Your Easter Basket Is So Expensive, Despite Much-Lower Cocoa Prices  WSJ"
2026-04-03,TOP_NEWS,US Airlines Are Hiking Bag Fees Amid Iran War Oil Crisis - Gizmodo,US Airlines Are Hiking Bag Fees Amid Iran War Oil Crisis  GizmodoUnited Airlines checked bag fees climbs $10-50 as fuel prices nearly double since Iran war  Fox BusinessUnited Airlines hikes checked bag fee by $10 as fuel prices continue to climb  CNBCAirline bag fees are sky-high. Save money with these packing hacks.  washingtonpost.comUnited Airlines is the second airline to raise baggage fees this week  Bring Me The News
2026-04-03,TOP_NEWS,Elon Musk insists banks working on SpaceX IPO must buy Grok subscriptions - Ars Technica,"Elon Musk insists banks working on SpaceX IPO must buy Grok subscriptions  Ars TechnicaBig Banks Seeking a Piece of SpaceX’s I.P.O. Must Subscribe to Elon Musk’s Grok  The New York TimesSpaceX Is Worth $2 Trillion? What That Might Mean.  Barron'sMusk asks SpaceX IPO banks to buy Grok AI subscriptions, NYT reports  Yahoo FinanceExclusive: SpaceX has held talks with Saudi fund for possible $5 billion investment in IPO, sources say  reuters.com"
2026-04-03,TOP_NEWS,"Google launches Gemma 4, a new open-source model: How to try it - Mashable","Google launches Gemma 4, a new open-source model: How to try it  MashableGemma 4: Byte for byte, the most capable open models  blog.googleFrom RTX to Spark: NVIDIA Accelerates Gemma 4 for Local Agentic AI  NVIDIA BlogGemma 4 and what makes an open model succeed  Interconnects AIBring state-of-the-art agentic skills to the edge with Gemma 4  blog.google"
2026-04-03,TOP_NEWS,New Apple TV Waiting for Siri: Here's What's Coming When It Launches - MacRumors,New Apple TV Waiting for Siri: Here's What's Coming When It Launches  MacRumorsApple TV 4K might break a record no one wants to see happen  9to5MacApple’s first smart home display is ‘in a warehouse’ until Siri’s big update – report  stuff.tvUpcoming Apple Products: Apple has 4 devices in pipeline waiting for AI Siri upgrade: What to expect  business-standard.comReport claims new Apple HomePad smart display is ready to ship  The Apple Post
2026-04-03,TOP_NEWS,‘PlayStation 6 Is Not Many Years Away’: Leaks Suggest Sony Is Working On Imminent Generational Transition With Handheld Support and ‘PlayGo’ Smart Delivery - Wccftech,"‘PlayStation 6 Is Not Many Years Away’: Leaks Suggest Sony Is Working On Imminent Generational Transition With Handheld Support and ‘PlayGo’ Smart Delivery  WccftechNew Leaks Point To Sony Paving The Way for A PS6 Handheld  KotakuPS6 might be closer than you think, and it’s not coming alone  Digital TrendsSony’s next-gen handheld rumoured to outperform Xbox Series S  kitguru.netThe PlayStation 6 Portable Will Get the Advanced PSSR 3 Upscaler  GameGPU"
2026-04-03,TOP_NEWS,Apple releases new iOS 26.5 beta 1 build for iPhone - 9to5Mac,"Apple releases new iOS 26.5 beta 1 build for iPhone  9to5MaciOS 26.5 release date: Here’s when to expect new iPhone features  9to5MacApple releases iOS 26.5 beta: What's new this time  MashableApple Releases First iOS 26.5, iPadOS 26.5 and macOS Tahoe 26.5 Public Betas  MacRumorsiOS 26.5 developer beta 1 gets revised release, for reasons unknown  AppleInsider"
2026-04-03,TOP_NEWS,Blake Lively Gets Agents' Support After Justin Baldoni Suit Pared Down - Deadline,Blake Lively Gets Agents' Support After Justin Baldoni Suit Pared Down  DeadlineJustin Baldoni scores major victory in legal battle with Blake Lively  CNNBlake Lively Vows To Fight On After Baldoni Sexual Harassment Claim Dismissed  DeadlineJustin Baldoni's Lead Attorney Speaks Out About Huge Court Win Against Blake  TMZBlake Lively and Justin Baldoni’s lawyers called in for last-ditch settlement attempt before trial  Yahoo
