date,source,title,description
2026-03-01,TOP_NEWS,First oil tanker attacked in the Strait of Hormuz according to Oman - Euronews.com,"First oil tanker attacked in the Strait of Hormuz according to Oman  Euronews.comHormuz erupts: Attacks, GPS jamming, Houthi threats rock Strait amid US-Israeli strikes  Fox NewsOil prices jump after ships attacked near Strait of Hormuz  BBCThree tankers damaged in Gulf and one seafarer killed as US-Iran conflict escalates  ReutersOman Says Oil Tanker Targeted Off Its North Coast  Bloomberg.com"
2026-03-01,TOP_NEWS,Hundreds of thousands of travelers stranded following U.S.-Israel attacks on Iran - PBS,"Hundreds of thousands of travelers stranded following U.S.-Israel attacks on Iran  PBSFlights cancelled and new travel warnings issued after Iran strikes  BBCHundreds of thousands of travellers stranded or diverted by airspace closures in Middle East  The GuardianWhat travelers need to know after the U.S., Israeli strikes on Iran  CNBCDelta pauses flights between New York-JFK and Tel Aviv through March 3, extends flexibility for customers  Delta News Hub"
2026-03-01,TOP_NEWS,Blasts heard in Kabul as Pakistan-Afghanistan conflict continues - Al Jazeera,"Blasts heard in Kabul as Pakistan-Afghanistan conflict continues  Al JazeeraAfghanistan fires at Pakistani jets over Kabul as conflict intensifies  NBC NewsUS backs Pakistan’s ‘right to defend itself’ against Taliban after strikes on Afghanistan  The GuardianDeath Toll Rises as Pakistan, Afghan Forces Keep Up Clashes  Bloomberg.comWhy are Afghanistan and Pakistan fighting?  BBC"
2026-03-01,TOP_NEWS,Starmer says he will give US permission to use UK bases for Iran missions - Politico,"Starmer says he will give US permission to use UK bases for Iran missions  PoliticoUK will allow US to use bases to strike Iranian missile sites, PM says  BBCBritish forces responding to suspected drone strike at Cyprus base  The Times of IsraelUkraine war briefing: Starmer says Ukrainian experts will help shoot down Iranian drone attacks in Gulf  The GuardianBritain says it is for US to set out legal basis for Iran strikes  Reuters"
2026-03-01,TOP_NEWS,"Pope Leo condemns ""spiral of violence"" in U.S., Israel strikes on Iran - Axios","Pope Leo condemns ""spiral of violence"" in U.S., Israel strikes on Iran  AxiosLetter from Presiding Bishop Sean Rowe on Military Strike on Iran  The Episcopal ChurchUCC GMP issues statement following US/Israel attack on Iran, calls on elected officials to 'reject war'  United Church of ChristUrgent prayer needed for Iran and the region  Open Doors UK & IrelandPope Leo amid Iran strikes: Stability and peace not achieved with ‘mutual threats’ or ‘weapons’  The Hill"
2026-03-01,TOP_NEWS,Epstein’s New Mexico Ranch Gets Scrutiny at Last. It May Be Too Late. - The New York Times,Epstein’s New Mexico Ranch Gets Scrutiny at Last. It May Be Too Late.  The New York TimesMemorial for survivors and victims placed at Epstein's ranch  KOATMemorial grows at former Zorro Ranch  KOB.com'There were victims': Protesters at former Epstein ranch demand action  Santa Fe New MexicanNew Mexico Launches Two-Pronged Investigation into Jeffrey Epstein’s Zorro Ranch: DOJ Reopens Criminal Probe While Bipartisan “Truth Commission” Gains Subpoena Power  2nd Life Media Alamogordo Town News
2026-03-01,TOP_NEWS,Reza Pahlavi makes his pitch to lead Iran - Politico,"Reza Pahlavi makes his pitch to lead Iran  PoliticoIran's Prince Reza Pahlavi says ""this is our chance"" after Khamenei's death  CBS NewsIran’s exiled prince tells Europe to get off the fence and back the war  politico.euWho Is Reza Pahlavi, Symbol of Opposition to Iran’s Regime?  WSJWhat to know about Reza Pahlavi, a potential successor to lead Iran  Axios"
2026-03-01,TOP_NEWS,Democratic Leaders Face Backlash Over 'Cowardly' Responses to Trump War on Iran - Common Dreams,"Democratic Leaders Face Backlash Over 'Cowardly' Responses to Trump War on Iran  Common DreamsOpinion | There is no reason to think this war with Iran is necessary  The Washington PostDems eyeing 2028 split on criticism of attacks on Iran  AxiosTrump Is on the Verge of War. Previous Presidents Did It Differently.  PoliticoDemocrats Denounce Trump’s Iran Attack, but Subtle Divisions Emerge  The New York Times"
2026-03-01,TOP_NEWS,How the Assault on Iran Unfolded - The New York Times,"How the Assault on Iran Unfolded  The New York TimesOpinion | With Iran, Trump and Netanyahu are Doing the Free World a Favor  The New York TimesIsrael hits Tehran again after killing Khamenei, leadership council takes over  ReutersAt last, a just war  The EconomistIDF launches new wave of airstrikes against Iranian regime targets in Tehran  The Times of Israel"
2026-03-01,TOP_NEWS,"Live updates: Trump says Iran operation could take ""four weeks or less,"" 3 U.S. troops killed - CBS News","Live updates: Trump says Iran operation could take ""four weeks or less,"" 3 U.S. troops killed  CBS NewsTrump says strikes on Iran will continue as Tehran hits US assets in Gulf  Al JazeeraTrump Says War Could Last Weeks and Offers Contradictory Visions of New Regime  The New York Times‘I Have Agreed to Talk’  The AtlanticWhite House official: Iran's 'new potential leadership' suggests it's open to talks and Trump says he's 'eventually' willing  PBS"
2026-03-01,TOP_NEWS,Investors seek harbour in gold as US and Israel strike Iran - Reuters,"Investors seek harbour in gold as US and Israel strike Iran  ReutersGold, Silver Rise as Middle East Conflict Spurs Safe-Haven Demand  WSJGold climbs 2% as US-Israel strikes on Iran raise regional temperature  ReutersGold price today, Friday, February 27: Gold remains above $5,100 as U.S.-Iran talks set to continue  Yahoo FinanceIran To Set Silver Prices On Fire? Investors Brace For Manic Monday  NDTV"
2026-03-01,TOP_NEWS,Bets on Fate of Iran’s Khamenei Spark Uproar at Leading Prediction Markets - WSJ,Bets on Fate of Iran’s Khamenei Spark Uproar at Leading Prediction Markets  WSJIran Strikes Expose the Dark Edge Case of Prediction-Market Era  Bloomberg.comFresh accounts netted $1 million on Polymarket hours before US airstrikes on Iran: Bubblemaps  The Block'He Bet on Bombs': Mystery Trader Made Rs 4 Crore On Tehran Strike Before Missiles Hit  NDTVKhamenei's killing spurs outrage among Kalshi and Polymarket users over claims of rigged markets and insider trading  Business Insider
2026-03-01,TOP_NEWS,Shipping companies divert vessels around Cape of Good Hope after strikes on Iran - Reuters,Shipping companies divert vessels around Cape of Good Hope after strikes on Iran  ReutersMaersk Diverts Shipments Away from Middle East  Barron'sInsurers to cancel policies and raise prices for ships in Gulf and Strait of Hormuz  Financial TimesSuspension of Strait of Hormuz Transits Due to Security Closure  Hapag-LloydMaersk to Halt Some Red Sea Shipping in Sign of War’s Disruption to Global Supply Chain  The New York Times
2026-03-01,TOP_NEWS,Soundcore’s New Headphones Have an Absurd Battery Life for the Price - Gizmodo,Soundcore’s New Headphones Have an Absurd Battery Life for the Price  GizmodoAnker launches noise-cancelling wireless headphones that can play music for nearly three days straight!  What Hi-Fi?Soundcore new Space 2 promise improved ANC and sound  The VergeAnker's Soundcore Space 2 Headphones Sent My Ears to Heaven  PCMagSoundcore Unveils Its New Space 2 Over-Ear Headphones At MWC Barcelona  Forbes
2026-03-01,TOP_NEWS,"NYT Crossword Answers for March 2, 2026 - The New York Times","NYT Crossword Answers for March 2, 2026  The New York TimesThe New York Times is adding another daily crossword, because why not  Nieman LabIntroducing the Midi, a New Crossword Offering From New York Times Games  The New York Times CompanyA Mid(i) crossword.  The VergeNew York Times Debuts the Midi Crossword, Its In-Between Puzzle  AOL.com"
2026-03-01,TOP_NEWS,Gallery: Here's A Look At Pokémon Winds & Waves On Switch 2 - Nintendo Life,"Gallery: Here's A Look At Pokémon Winds & Waves On Switch 2  Nintendo LifeSee the New Trailer for Pokémon Winds and Pokémon Waves, Coming to Nintendo Switch 2  Pokemon.comPokemon Winds and Waves Revealed, Gen 10 Starter Debates Are Live  CNETPokémon Winds And Waves Is Arriving Next Year  Game InformerAll Pokemon in Winds and Waves Confirmed So Far  IGN"
2026-03-01,TOP_NEWS,‘Scream 7’ Roars To Record Decibels With Franchise-Best $97M+ Global Debut – Box Office Update - Deadline,‘Scream 7’ Roars To Record Decibels With Franchise-Best $97M+ Global Debut – Box Office Update  DeadlineScream 7 First Reviews: Neve Campbell is Fierce in Brutal but Familiar Thriller  Rotten Tomatoes: Movies‘Scream 7’ Review: Do You Like… Sh*tty Movies?  IndieWire‘Scream 7’ Controversies: What You Need to Know  The New York TimesWho is Ghostface? Let's unmask the killer in 'Scream 7' (spoilers!)  USA Today
2026-03-01,TOP_NEWS,Writers Guild Awards Los Angeles Ceremony Canceled Amid Internal Labor Strike - The Hollywood Reporter,Writers Guild Awards Los Angeles Ceremony Canceled Amid Internal Labor Strike  The Hollywood ReporterWGA Cancels L.A. Award Show Due to Staff Strike  variety.comWGA Awards West Coast Ceremony Canceled Amid Staff Union Strike  DeadlineWGA cancels Los Angeles awards show amid labor strike  Los Angeles TimesWAG axes LA awards show over AI labor dispute  New York Post
2026-03-01,TOP_NEWS,Chaos At Brit Awards As Singer Gets Pushed Off Stage Mid Performance In Viral Video - Bored Panda,"Chaos At Brit Awards As Singer Gets Pushed Off Stage Mid Performance In Viral Video  Bored PandaSombr Altercation at Brit Awards Was Staged, Rep Confirms  variety.comThe drama 😱  facebook.comSombr's Onstage Attack at the 2026 Brit Awards Confirmed to Be Staged Stunt  IMDbBRIT Award viewers baffled as 'fan storms stage' during Sombr performance  Manchester Evening News"
2026-03-01,TOP_NEWS,Shane Lowry Just Had The Most Inexplicable PGA Tour Meltdown In Years - OutKick,"Shane Lowry Just Had The Most Inexplicable PGA Tour Meltdown In Years  OutKickShane Lowry collapse leads to Nico Echavarria's Cognizant win  ESPN2026 Cognizant Classic purse, payouts: Shane Lowry falls apart late at PGA National as Nico Echavarria grabs win  Yahoo SportsCognizant Classic highlights: Nico Echavarria wins stunner at PGA National  Golfweek‘I only wanted it for her today’: Shane Lowry misses out on first win with daughter by his side at Cognizant Classic  PGA Tour"
