date,source,title,description
2025-07-13,TOP_NEWS,"Kentucky church shooting leaves three dead, including suspect - Reuters","Kentucky church shooting leaves three dead, including suspect  ReutersGunman kills 2, wounds 2 at Lexington church after shooting Kentucky state trooper  Fox NewsTwo women killed, two injured, after shooting at Kentucky church  Sky NewsTwo dead and three injured, including state trooper, in Kentucky shootings  The GuardianTwo women shot dead at Kentucky church  The Telegraph"
2025-07-13,TOP_NEWS,Air India crash victims’ families not satisfied with ‘vague’ initial report - The Guardian,"Air India crash victims’ families not satisfied with ‘vague’ initial report  The GuardianAir India crash report answers one question – and raises more  CNNAmid Air India probe, US FAA, Boeing notify fuel switch locks are safe, document, sources say  ReutersAAIB preliminary report: Air India pilots' association lashes out at 'insinuation of suicide'  Times of IndiaAir India pilot’s medical records examined after mental health claims  Yahoo"
2025-07-13,TOP_NEWS,California farmworker who fell from greenhouse roof during chaotic ICE raid dies - Politico,"California farmworker who fell from greenhouse roof during chaotic ICE raid dies  PoliticoCalifornia farmworker dies after chaotic federal immigration raid, family says  NBC NewsDisabled veteran who is a US citizen was taken during Camarillo immigration raid, family says  ABC7 Los AngelesTrump administration defends immigration tactics after California worker death  ReutersFundraiser for Farm Worker Killed in ICE Raid Tops $150K  Newsweek"
2025-07-13,TOP_NEWS,Donald Trump defends Pam Bondi over Jeffrey Epstein files - BBC,Donald Trump defends Pam Bondi over Jeffrey Epstein files  BBCTrump defends Bondi amid MAGA fallout over her handling of Epstein investigation  CNNFormer CNN White House Correspondent Jim Acosta Says Trump ‘Freaking Out’ Over Epstein Blowback  The Daily BeastTrump Gets 'Ratioed' on Truth Social for First Time Amid Epstein Backlash  NewsweekChristie says Trump ‘benefited’ from Epstein conspiracy theories  The Hill
2025-07-13,TOP_NEWS,Trump to miss chance for UK parliamentary address during September state visit - Financial Times,"Trump to miss chance for UK parliamentary address during September state visit  Financial TimesTrump to be hosted by King at Windsor for second state visit  BBCKing Charles III Will Host Trump for U.K. State Visit in September  The New York TimesPresident Trump, Melania Trump to visit U.K.'s King Charles in September  CBS NewsKing Charles schedules Trump state visit for when UK parliament is in recess  The Guardian"
2025-07-13,TOP_NEWS,Wildfire destroys a historic Grand Canyon lodge and other structures - AP News,"Wildfire destroys a historic Grand Canyon lodge and other structures  AP NewsA historic Grand Canyon lodge has been destroyed by wildfire, an official says  CNNDragon Bravo Fire destroys 50-80 structures at Grand Canyon; historic lodge gone  AZFamilyWildfires force evacuations at Grand Canyon and Black Canyon of the Gunnison parks  AP NewsHistoric Grand Canyon Lodge among dozens of buildings burned in wildfire; chlorine gas leak hampers firefight  FOX Weather"
2025-07-13,TOP_NEWS,Germany urges tough EU response if 'fair deal' cannot be reached on US tariffs - France 24,"Germany urges tough EU response if 'fair deal' cannot be reached on US tariffs  France 2430% US tariff on European goods threatens to shake up a key trade relationship  AP NewsThe EU is delaying retaliatory tariffs on U.S. goods in hopes of reaching a deal by Aug. 1  The HinduAmid Tariff Chaos, U.S. Allies Try to Redraw the Trade Map  The New York TimesEU announces delay to its trade countermeasures against United States until early August  CNN"
2025-07-13,TOP_NEWS,"Children killed collecting water in Gaza, medical officials say, as ceasefire talks hit sticking points - CNN","Children killed collecting water in Gaza, medical officials say, as ceasefire talks hit sticking points  CNNGaza officials say children killed in strike as Israeli military admits 'error'  BBCIsraeli missile hits Gaza children collecting water, IDF blames malfunction  Reuters59 Palestinians in Gaza are killed by Israeli airstrikes or shot dead while seeking aid  AP NewsChildren Among at Least 10 Killed in Israeli Strike in Central Gaza, Officials Say  The New York Times"
2025-07-13,TOP_NEWS,Dow futures drop nearly 200 points after Trump slaps 30% tariff on Mexico and the EU: Live updates - CNBC,Dow futures drop nearly 200 points after Trump slaps 30% tariff on Mexico and the EU: Live updates  CNBCCNBC Daily Open: Surprise tariff salvo on Saturday  CNBCEuro eases after Trump threatens 30% tariffs on EU  ReutersTrump announces tariffs of 30% on Mexico and the European Union  CNNTrump’s sudden shifts make his policies baffling to countries trying to negotiate lower tariffs  AP News
2025-07-13,TOP_NEWS,"Muhammadu Buhari, Nigerian president and ex-military ruler, dies at 82 - The Washington Post","Muhammadu Buhari, Nigerian president and ex-military ruler, dies at 82  The Washington PostFormer Nigerian leader Muhammadu Buhari dies aged 82  BBCMuhammadu Buhari, Nigeria’s Former President, Dies at 82  The New York TimesHere’s how Nigerians remember Buhari, who ruled both as a dictator and a democrat  AP NewsNigeria's ex-president Buhari, twice leader of Africa's most populous nation, dies at 82  NBC News"
2025-07-13,TOP_NEWS,"Emergency teams respond to plane 'collision' at London Southend Airport - ABC News - Breaking News, Latest News and Videos","Emergency teams respond to plane 'collision' at London Southend Airport  ABC News - Breaking News, Latest News and VideosSouthend airport to remain closed after fireball plane crash  BBCSmall plane crashes at London Southend Airport  NBC NewsSouthend Airport plane crash latest: Airport shuts ‘until further notice’ after aircraft crashes moments after take-off  The IndependentPlane crashes at Southend Airport  Yahoo"
2025-07-13,TOP_NEWS,Dow futures sink as Trump keeps pushing tariffs while White House suggests Powell's job could be at risk - Fortune,"Dow futures sink as Trump keeps pushing tariffs while White House suggests Powell's job could be at risk  FortuneWhy the near-record high stock market has taken Trump's renewed tariff blitz in stride  CNBCWall St slips with Asia stocks as US trade policy confounds  ReutersStock market today: Dow falls 250 points, S&P 500, Nasdaq retreat from record as Trump escalates tariff threats  Yahoo FinanceDow Futures Fall 200 Points After Trump’s Tariff Threats  Barron's"
2025-07-13,TOP_NEWS,"$300 billion, 500 million users, and no time to enjoy it: The sharks are circling OpenAI - Business Insider","$300 billion, 500 million users, and no time to enjoy it: The sharks are circling OpenAI  Business InsiderOpenAI’s Stock Compensation Reflect Steep Costs of Talent Wars  The InformationOpenAI is betting millions on building AI talent from the ground up amid rival Meta’s poaching pitch  FortuneThe Hidden Cost of OpenAI’s Genius  GizmodoOpenAI's Head of Recruiting says Meta's hiring tactics ""reek of desperation""  the-decoder.com"
2025-07-13,TOP_NEWS,"Hassett says White House probing Fed renovation costs, authority to fire Powell - Reuters","Hassett says White House probing Fed renovation costs, authority to fire Powell  ReutersTrump ‘certainly’ can fire Fed chair Powell ‘if there’s cause’: Hassett  CNBCFed explains its mega-renovation project as Trump pressures Powell  AxiosWhite House Seizes on Fed Renovations as Opening to Oust Powell  The Wall Street JournalRisk of Powell ouster is underpriced, Deutsche Bank strategist says  Fortune"
2025-07-13,TOP_NEWS,Potential iPhone 17 Launch Dates Narrow Down As Apple Prepares To Unveil Four New Models Including The Stunning Ultra-Thin Air And Redesigned Pro Versions - Wccftech,Potential iPhone 17 Launch Dates Narrow Down As Apple Prepares To Unveil Four New Models Including The Stunning Ultra-Thin Air And Redesigned Pro Versions  WccftechWhy You Shouldn’t Buy an iPhone Right Now  The Wall Street JournalNew iPhone 17 Color Lineup Potentially Revealed in Leak  CNETFresh leak confirms new iPhone 17 and iPhone 17 Air colors  MacworldApple iPhone 17 Release Date: New Clue Revealed In Latest Leak  Forbes
2025-07-13,TOP_NEWS,Apple Watch Ultra 3: What to Expect - MacRumors,Apple Watch Ultra 3: What to Expect  MacRumors
2025-07-13,TOP_NEWS,"Galaxy Z Fold 7 is a major leap forward, but Pixel 9 Pro Fold was still the bigger upgrade - 9to5Google","Galaxy Z Fold 7 is a major leap forward, but Pixel 9 Pro Fold was still the bigger upgrade  9to5GoogleSamsung's New Phones Show How Far Ahead China Is on Innovation  WIREDGalaxy Z Flip 7 Hands-On: I'm Excited About the Bigger Screens, Battery and FE Variant  CNETSamsung Makes 24-Hour $190 Offer To Galaxy Z Fold 7 Buyers  ForbesSamsung Galaxy Z Flip 7 vs. Motorola Razr Ultra: The Ultimate Flip Phone Face-Off  PCMag"
2025-07-13,TOP_NEWS,2025 MLB Draft Day One Discussion Thread - Lone Star Ball,2025 MLB Draft Day One Discussion Thread  Lone Star Ball
2025-07-13,TOP_NEWS,David Zaslav Champions New DC Universe After Superman Box Office Victory - Variety,"David Zaslav Champions New DC Universe After Superman Box Office Victory  VarietyWith $217 Million in Ticket Sales, ‘Superman’ Helps Save Warner Bros., Too  The New York Times‘Superman’ Launches New Chapter for DC With $217 Million Global Box Office Opening  TheWrapHow ‘Superman’ Inspired a Movie-Review War: When Is It Fair to Say That Too Much Fun Is No Fun at All?  Variety'Superman' launches James Gunn's DC cinematic universe with $122 million domestic opening  CNBC"
2025-07-13,TOP_NEWS,‘Love Island USA’ prepares to crown winning couple following tumultuous seventh season - AP News,"‘Love Island USA’ prepares to crown winning couple following tumultuous seventh season  AP News'Love Island USA' 2025 finale reveals Season 7 winners  USA TodayWhen is the Love Island USA finale 2025? How to watch tonight, season 7 winners odds, predictions, first look  Milwaukee Journal Sentinel'Love Island USA' Finale: Find Out Which Couple Won Season 7  People.comPeacock Sets ‘Love Island USA’ Season 7 Reunion Premiere Date; Andy Cohen & Ariana Madix To Host  Deadline"
