date,source,title,description
2025-12-17,TOP_NEWS,Republicans defy Speaker Mike Johnson to force House vote on extending ACA subsidies - PBS,Republicans defy Speaker Mike Johnson to force House vote on extending ACA subsidies  PBSRepublicans Clinch Democrats’ Bid to Force Vote on ACA Subsidies  The New York TimesGOP centrists choose nuclear option in fight with Mike Johnson over Obamacare  CNNNew Senate momentum  AxiosJohnson denies he's 'lost control' of House after Republican health care revolt  ABC News
2025-12-17,TOP_NEWS,"Trump: FBI deputy director Bongino ""wants to go back to his show"" - Axios","Trump: FBI deputy director Bongino ""wants to go back to his show""  AxiosDan Bongino plans to step down as FBI deputy director in January  CNNFBI Deputy Director Dan Bongino says he plans to resign next month as bureau's No 2 official  AP NewsDan Bongino stepping down as FBI deputy director  BBCDan Bongino to Step Down as FBI Deputy Director  The New York Times"
2025-12-17,TOP_NEWS,Watch: Trump to address the nation as economic concerns drag on his approval ratings - NPR,"Watch: Trump to address the nation as economic concerns drag on his approval ratings  NPRTrump to address nation from the White House  CNNTrump speech live updates: President addresses nation amid economic pressure, tension with Venezuela  The Washington PostLive updates: Trump speech tonight; Moderate House Republicans join petition forcing ACA funding vote  NBC NewsLive: Trump to highlight achievements amid Venezuela, economic tensions  Al Jazeera"
2025-12-17,TOP_NEWS,Senate passes defense bill that defies Trump and forces sharing of boat strike videos - Politico,"Senate passes defense bill that defies Trump and forces sharing of boat strike videos  PoliticoSweeping US defense bill passes, with Ukraine, Venezuela provisions defying Trump  ReutersCongress passes $901bn defense bill that includes support for Ukraine and Europe  The GuardianSenate passes $901 billion defense bill that pushes Hegseth for boat strike video  NPRSenate Passes Defense Policy Bill, Clearing It for Trump  The New York Times"
2025-12-17,TOP_NEWS,Venezuelan Navy Escorts Vessels After Trump’s Blockade Threat - The New York Times,"Venezuelan Navy Escorts Vessels After Trump’s Blockade Threat  The New York TimesWATCH: ‘We want it back’: Trump demands Venezuela return ‘land, oil rights’ to U.S.  PBSTrump orders ‘total and complete blockade’ of sanctioned oil tankers coming to and leaving Venezuela  CNN‘We want it back’: Trump asserts U.S. claims to Venezuelan oil and land  Los Angeles TimesOpinion | Don’t Stop at a Single Oil Tanker  The Wall Street Journal"
2025-12-17,TOP_NEWS,‘Oh how we will miss this man’: Meg Ryan posts emotional tribute to Rob Reiner - The Guardian,‘Oh how we will miss this man’: Meg Ryan posts emotional tribute to Rob Reiner  The GuardianNew Details Emerge About How Rob and Michele Reiner Were Found  The New York TimesRita Wilson Breaks Silence on Rob and Michele Reiner's Death: 'They Did Everything Right'  People.comRob Reiner's children speak out after brother's hearing in parents' murder  NBC NewsRob Reiner's son Nick makes 1st court appearance after being charged with murder in deaths of his parents: Full coverage  Yahoo
2025-12-17,TOP_NEWS,Two Massachusetts Men Charged with Large-Scale SNAP Benefits Trafficking - Department of Justice (.gov),"Two Massachusetts Men Charged with Large-Scale SNAP Benefits Trafficking  Department of Justice (.gov)Two Mattapan store owners charged in alleged $7 million SNAP fraud scheme  The Boston GlobeMass. men charged with fraud for alleged $7 million SNAP scam, prosecutors say  Boston.com2 Massachusetts store owners charged in $7 million SNAP fraud case  CBS NewsWatch live: Mass. US Attorney announces charges in $7M SNAP benefits trafficking case  Boston 25 News"
2025-12-17,TOP_NEWS,The White House promises to dismantle the National Center for Atmospheric Research - Colorado Public Radio,"The White House promises to dismantle the National Center for Atmospheric Research  Colorado Public RadioNational Center for Atmospheric Research to Be Dismantled, Trump Administration Says  The New York TimesRep. Joe Neguse calls Trump's National Center for Atmospheric Research breakup plan an ""unlawful"" act of retaliation  CBS NewsThe Trump admin is closing a critical research center. Officials believe it’s really trying to punish a governor  CNNTrump moves to dismantle major US climate research center in Colorado  USA Today"
2025-12-17,TOP_NEWS,"Trump hangs plaques mocking Biden, Obama along White House Colonnade - ABC News","Trump hangs plaques mocking Biden, Obama along White House Colonnade  ABC NewsNew plaques on Trump’s ‘Presidential Walk of Fame’ offer pointed descriptions of predecessors  CNNTrump attacks Democratic foes in White House presidential portraits  The GuardianWhite House installs plaques mocking Barack Obama and Joe Biden  NBC NewsTrump trolls Biden, Obama in new plaques on ‘Presidential Walk of Fame’  The Washington Post"
2025-12-17,TOP_NEWS,"Heavy rains compound dire conditions of displaced Gazans, UN warns - BBC","Heavy rains compound dire conditions of displaced Gazans, UN warns  BBCWinter storms worsen Gaza humanitarian crisis as UN says aid still blocked  Al JazeeraUN, aid groups warn Gaza operations at risk from Israel impediments  ReutersGaza families struggle to recover from days of torrential rains that killed 12 people  AP NewsDire weather causes misery for Gaza homeless  Vatican News"
2025-12-17,TOP_NEWS,Accused gunman in Bondi Beach shooting charged with 15 counts of murder - AP News,Accused gunman in Bondi Beach shooting charged with 15 counts of murder  AP NewsThe Philippines’ long battle against Islamist extremism is back in the spotlight following Bondi attack  CNNOpinion | Australia Can’t Recover From This  The New York TimesBondi Beach hero Ahmed Al Ahmed receives over $1M in donations after tackling gunman in Australia shooting  CBS NewsAlleged Bondi gunman charged with 15 murders as funerals of victims begin  KSL News
2025-12-17,TOP_NEWS,Britain to rejoin EU’s Erasmus student exchange program in Brexit reversal - CNN,"Britain to rejoin EU’s Erasmus student exchange program in Brexit reversal  CNN'I learned languages and travelled Europe through Erasmus'  BBCUK Rejoins EU’s Erasmus Student Exchange Program That It Left After Brexit  The New York Times£570m cost of Erasmus is ‘money coming back to UK’, says minister – as it happened  The Guardian'UK to rejoin Erasmus' and 'BBC comes out fighting'  BBC"
2025-12-17,TOP_NEWS,All the countries affected by Trump’s expanded travel ban - The Washington Post,All the countries affected by Trump’s expanded travel ban  The Washington PostTrump expands travel ban list to 39 countries  CNNTrump's expanded travel ban hits Africa the hardest but reactions are muted  ABC NewsTrump expands travel ban and restrictions to include an additional 20 countries  NPRTrump expands U.S. travel ban to include two Caribbean countries  Miami Herald
2025-12-17,TOP_NEWS,"Inside the Fractious WBD-Paramount Deal Talks Between Ellison, Zaslav - Variety","Inside the Fractious WBD-Paramount Deal Talks Between Ellison, Zaslav  VarietyWarner Bros. Urges Shareholders to Reject Paramount Takeover Bid, Saying Ellisons ‘Misled’ Them  The New York TimesWBD tells shareholders Netflix deal is superior to Paramount offer: 'It was not a hard choice,' chairman tells CNBC  CNBCWarner Bros. Discovery advises shareholders to reject Paramount’s offer. But the battle isn’t over  CNNWarner Bros. board slams Paramount in rejection letter: Claims there’s no Ellison family backstop  Fortune"
2025-12-17,TOP_NEWS,"Another billionaire just announced a donation to ""Trump accounts"" - Axios","Another billionaire just announced a donation to ""Trump accounts""  AxiosAdministration asks the ultra-wealthy for ‘Trump accounts’ donations  The Washington PostHow to get $1,000 for your child through the new Trump account program  USA TodayRay Dalio joins Michael Dell in backing 'Trump accounts' for kids  CNBCChime Joins Firms Matching Worker ‘Trump Account’ Contributions  Bloomberg.com"
2025-12-17,TOP_NEWS,"Stock Market Today: Nasdaq, S&P 500 Close Below Critical Levels; Oracle, Other AI Players Sell Off (Live Coverage) - Investor's Business Daily","Stock Market Today: Nasdaq, S&P 500 Close Below Critical Levels; Oracle, Other AI Players Sell Off (Live Coverage)  Investor's Business DailyStock Market Today: Tech Slide Weighs on Nasdaq; Oil Prices Gain  The Wall Street JournalReview preview: Reining in risk  MSNStock market today: Nasdaq sinks, leading Dow, S&P 500 lower as Oracle shares plummet  Yahoo FinanceWall Street closes lower as AI funding jitters drag tech stocks  Reuters"
2025-12-17,TOP_NEWS,OnePlus 15R Hands-on: If only battery and refresh rate were the name of the game - 9to5Google,"OnePlus 15R Hands-on: If only battery and refresh rate were the name of the game  9to5GoogleOnePlus 15R review: A 165Hz display and big battery for $700  EngadgetMy OnePlus 15R Review: A Lovely $700 Phone That's Held Back by Its Compromises  CNETOnePlus 15R review: unbeatable battery life, beatable value  The VergeOnePlus 15 One Month In: A Battery Beast That Confidently Delivers  Forbes"
2025-12-17,TOP_NEWS,OpenAI’s new ChatGPT image generator makes faking photos easy - Ars Technica,OpenAI’s new ChatGPT image generator makes faking photos easy  Ars TechnicaThe new ChatGPT Images is here  OpenAIOpenAI's answer to Google's viral Nano Banana Pro image model is here  Business InsiderOpenAI continues on its ‘code red’ warpath with new image generation model  TechCrunchOpenAI’s new flagship image generator AI is here  The Verge
2025-12-17,TOP_NEWS,"Google launches Gemini 3 Flash, makes it the default model in the Gemini app - TechCrunch","Google launches Gemini 3 Flash, makes it the default model in the Gemini app  TechCrunchGemini 3 Flash: frontier intelligence built for speed  blog.googleGemini 3 Flash is now available in Gemini CLI  blog.googleGoogle Releases More Efficient Gemini 3 AI Model Across Products  Bloomberg.comGoogle releases Gemini 3 Flash, promising improved intelligence and efficiency  Ars Technica"
2025-12-17,TOP_NEWS,Google's New AI Agent Helps You Get Ahead With a Morning Briefing - PCMag,"Google's New AI Agent Helps You Get Ahead With a Morning Briefing  PCMagHelp boost your daily productivity with CC, a new experimental AI agent from Google Labs.  blog.googleGoogle tests an email-based productivity assistant  TechCrunchGoogle debuts CC, an AI tool with Gmail, Calendar access  MashableGoogle, Amazon and Meta Embed AI Into Core Products  PYMNTS.com"
