date,source,title,description
2025-08-25,TOP_NEWS,Full text of Illinois Gov. JB Pritkzer's speech at news conference on reported Trump military plan for Chicago - CBS News,"Full text of Illinois Gov. JB Pritkzer's speech at news conference on reported Trump military plan for Chicago  CBS NewsDefiant Chicago Leaders Blast Trump's Troop Plan: ‘If You Hurt My People, Nothing Will Stop Me'  Block Club ChicagoJB Pritzker press conference today: Illinois politicians condemn possible Donald Trump National Guard Chicago deployment plans  ABC7 ChicagoChicago residents split on National Guard presence as officials resist Trump's plan  FOX 32 ChicagoTrump says National Guard is at the ready but hedges on Chicago plans  NPR"
2025-08-25,TOP_NEWS,Trump meets with South Korean leader after public blast - The Washington Post,"Trump meets with South Korean leader after public blast  The Washington PostTrump Live Updates: Latest News on Executive Orders, National Guard and More  The New York TimesSouth Korea’s Very Good Day in the Oval Office  PoliticoTrump says he hopes to meet Kim Jong-un and raises prospect of US taking over some South Korean land  The GuardianS Korea's Lee Jae Myung turns charm on during Trump meeting  BBC"
2025-08-25,TOP_NEWS,"Israeli strikes kill 22, including 5 journalists, in a Gaza hospital - NPR","Israeli strikes kill 22, including 5 journalists, in a Gaza hospital  NPROutrage after Israel kills five journalists in ‘double-tap’ attack on Gaza hospital  CNNWhat to Know About the Journalists Killed in Gaza  The New York TimesPhotos by journalist Mariam Dagga  AP NewsNetanyahu says Israel regrets 'mishap' at Gaza hospital  Reuters"
2025-08-25,TOP_NEWS,Kilmar Abrego Garcia fights imminent deportation to Uganda - Politico,"Kilmar Abrego Garcia fights imminent deportation to Uganda  PoliticoKilmar Abrego Garcia taken into ICE custody, but judge blocks deportation for now  NBC NewsAbrego Garcia Detained Again After Government Signaled It Would Re-Deport Him  The New York TimesWrongly deported migrant Abrego detained again, may be sent to Uganda  ReutersKilmar Abrego Garcia faces new deportation efforts after ICE detains him in Baltimore  AP News"
2025-08-25,TOP_NEWS,Trump threatens to sue California over redistricting plan favoring Democrats - The Washington Post,Trump threatens to sue California over redistricting plan favoring Democrats  The Washington PostWhat’s keeping Republicans from uniting against Newsom’s gerrymander  PoliticoTrump says DOJ will sue California over redistricting as he celebrates similar Texas effort  CNBCNewsom signs California redistricting measures in response to Texas bill  AxiosRepublicans try again to block California redistricting plan from November ballot  Los Angeles Times
2025-08-25,TOP_NEWS,Mexican drug lord 'El Mayo' enters guilty plea - BBC,"Mexican drug lord 'El Mayo' enters guilty plea  BBCSinaloa Cartel Founder Known as El Mayo Pleads Guilty to Drug Trafficking  The New York TimesMexican drug lord Ismael ‘El Mayo’ Zambada, who led Sinaloa cartel with ‘El Chapo,’ pleads guilty to trafficking in US  CNN‘El Mayo’ Faces Life in Prison, Forfeits $15 Billion in Plea  Bloomberg.comFormer Mexican drug kingpin Ismael 'El Mayo' Zambada pleads guilty to US charges  Reuters"
2025-08-25,TOP_NEWS,Philly lawyer George Bochetto hired to sue SEPTA to stop service cuts - Inquirer.com,Philly lawyer George Bochetto hired to sue SEPTA to stop service cuts  Inquirer.comSEPTA cuts: 1st weekday commute since drastic cut to Philadelphia's mass transit services  6abc PhiladelphiaDeep Transit Cuts in Philadelphia Set Commuters and Parents Scrambling  The New York TimesSEPTA cuts bring crowded buses and skipped stops; Shapiro open to using special transit fund money  Inquirer.comSEPTA cuts: Riders feel a 'sense of loss' during the first day of reduced service  WHYY
2025-08-25,TOP_NEWS,"FBI, sheriff's office focus Travis Decker search on quarter-mile near Rock Island Campground - KING5.com","FBI, sheriff's office focus Travis Decker search on quarter-mile near Rock Island Campground  KING5.comTravis Decker manhunt nears 3 months as FBI leads search of rugged Washington terrain  CBS NewsAuthorities ramp up search for Washington dad accused of killing daughters  NBC NewsTravis Decker search: Authorities reveal disturbing crime scene details, new DNA analysis  ABC NewsTravis Decker manhunt: FBI to swarm Wash. campground where dad allegedly killed 3 young daughters  New York Post"
2025-08-25,TOP_NEWS,Trump Seen With Bruised Right Hand Again—Here’s Everything We Know About The Condition - Forbes,"Trump Seen With Bruised Right Hand Again—Here’s Everything We Know About The Condition  ForbesBruise on Trump’s hand won’t go away, and neither will questions about his health – US politics live  The GuardianTrump Apparently Has A New Bruise And Karoline Leavitt Has An Explanation  Yahoo News CanadaWhen and why has the National Guard been deployed in the US before?  Al JazeeraTrump's hand makeup, bruise go viral again. Here's what the White House has said about it.  USA Today"
2025-08-25,TOP_NEWS,US doubles down on support for envoy to France after antisemitism row - The Times of Israel,"US doubles down on support for envoy to France after antisemitism row  The Times of IsraelFrance summons U.S. Ambassador Kushner over ‘unacceptable’ antisemitism letter  The Washington PostOpinion | A Letter to Emmanuel Macron  The Wall Street JournalIsrael launches diplomatic attacks on its Western allies ahead of Palestinian statehood recognition  CNNFrance summons Charles Kushner, Ivanka Trump's father-in-law, in antisemitism dispute  USA Today"
2025-08-25,TOP_NEWS,At Least One Dead as Typhoon Kajiki Slams Vietnam - The New York Times,"At Least One Dead as Typhoon Kajiki Slams Vietnam  The New York Times'It's terrifying': Thousands evacuate as typhoon batters Vietnam  BBCTrees down, homes flooded as Typhoon Kajiki batters Vietnam  ReutersVietnam plans mass evacuation, China’s Sanya shuts as Typhoon Kajiki intensifies  CNNChina’s Tropical Resort Island Orders Evacuations as Typhoon Kajiki Nears  The New York Times"
2025-08-25,TOP_NEWS,"Helicopter spirals out of control, spins wildly before crashing into lake while fighting wildfire — watch - Times of India","Helicopter spirals out of control, spins wildly before crashing into lake while fighting wildfire — watch  Times of IndiaFrench helicopter crew survive crash into lake  BBCMoment helicopter fighting massive wildfire in France crashes into lake  MSNFirefighting helicopter crashed into a lake in France: exclusive video of the accident  112.uaHelicopter Crashes into Lake in France While Grabbing Water to Fight Blaze  TMZ"
2025-08-25,TOP_NEWS,Police apologize at grave of Japanese businessman who was wrongfully arrested and died after long detention - CBS News,"Police apologize at grave of Japanese businessman who was wrongfully arrested and died after long detention  CBS NewsPolice, prosecutors apologize at grave of wrongfully accused man  english.kyodonews.netSon seeks second look into what led to father’s false accusation  朝日新聞Authorities apologize to Ohkawara Kakohki ex-adviser's family  The Japan TimesPolice And Japanese Prosecutors Apologize At The Tomb Of The Wrong Man Arrested  VOI.ID"
2025-08-25,TOP_NEWS,Cracker Barrel finally responds to ‘woke’ logo backlash - yahoo.com,Cracker Barrel finally responds to ‘woke’ logo backlash  yahoo.comCracker Barrel admits it 'could've done a better job' after new logo backlash  Fox BusinessCracker Barrel responds to backlash over new logo and rebranding: 'We could've done a better job'  CNBCCracker Barrel responds amid fan backlash to contemporary country redesign  ABC NewsCracker Barrel refreshed its logo and paid the price. Here's what brand experts say went wrong.  CBS News
2025-08-25,TOP_NEWS,"Feeling lucky? Powerball jackpot jumps to $750 million, the 10th largest ever - Los Angeles Times","Feeling lucky? Powerball jackpot jumps to $750 million, the 10th largest ever  Los Angeles TimesPowerball jackpot hits $750 million for Monday’s drawing, 10th largest in game’s history after no Saturday winner  CNNWinning Powerball numbers for Monday, Aug. 25, with jackpot at $750 million  Treasure Coast NewsPowerball winning numbers for Monday, August 25, 2025  LohudLucky San Antonian claims $1M from winning Powerball ticket  kens5.com"
2025-08-25,TOP_NEWS,Trump Administration signals plans to nix US Wind project - WBOC TV,Trump Administration signals plans to nix US Wind project  WBOC TVOrsted shares sink to record lows after US halts wind farm off Rhode Island  ReutersTrump Administration Orders Work Halted on Wind Farm That Is Nearly Built  The New York TimesTrump to Halt Development of Another Offshore Wind Farm  Bloomberg.comISO-NE statement on Revolution Wind stop work order  ISO Newswire
2025-08-25,TOP_NEWS,"Elon Musk's xAI sues Apple and OpenAI over AI competition, App Store rankings - Reuters","Elon Musk's xAI sues Apple and OpenAI over AI competition, App Store rankings  ReutersInside Elon Musk's suit against Apple and OpenAI: 'This is a tale of two monopolists'  Yahoo FinanceElon Musk accuses Apple and OpenAI of stifling AI competition in antitrust lawsuit  AP NewsMusk firms sue Apple and OpenAI, alleging they hurt competition  BBCElon Musk’s xAI Sues Apple and OpenAI Over Claims It Is Being Shut Out  The New York Times"
2025-08-25,TOP_NEWS,Google will block sideloading of unverified Android apps starting next year - Ars Technica,"Google will block sideloading of unverified Android apps starting next year  Ars TechnicaGoogle will require developer verification to install Android apps, including sideloading  9to5GoogleAndroid users warned of app changes as Google follows Apple’s lead  NewsNationGoogle Will Make Installing Third-Party Android Apps Safer By Making Them Less Accessible  bgr.comGoogle Android Developer Identity Verification Policy 2026 - News and Statistics  IndexBox"
2025-08-25,TOP_NEWS,Google tests QR code verification for text messages - Engadget,Google tests QR code verification for text messages  EngadgetGoogle Messages beta rolling out QR code key verification  9to5GoogleGoogle Messages Is Testing a New Way to Verify Who You’re Chatting With  LifehackerA recent Google Messages beta lets users test its QR code key verifier  Android CentralNew Security and AI Features in Google Messenger  Zamin.uz
2025-08-25,TOP_NEWS,Details About the First iPhone Foldable Are Coming Into Focus - CNET,"Details About the First iPhone Foldable Are Coming Into Focus  CNETApple to Kick Off Three-Year Plan to Reinvent Its Iconic iPhone  Bloomberg.comApple Plans Foldable, Curved-Glass iPhones: Report. What It Means for the Stock.  Barron'sApple's Biggest iPhone Overhaul in a Decade Could Redefine the Stock's Next Growth Cycle  Yahoo FinanceApple’s three-year iPhone plan is a break from the boring  The Verge"
